BusinessPriceResponse,BusinessPriceLocalBusiness
what are the business prices,
what's the price,
what is their price range,their
what are the prices,
what are their price range,their
what is the price of that place,that place
what are their business prices,their
what are the business prices of that place,that place
what is the price range of the first one,first one
What are the business prices of the second one,second one
whats the prices of the fifth one,fifth one
Tell me the prices of that place,that place
Tell me the business price of that place,that place
Tell me the price range of that place,that place
Tell me the prices of the third one,third one
Tell me their price,their
Tell me a price range of the fourth one,fourth one
what is their local price,their
which prices are listed,
what are their prices,their
prices,
business price,
Give me the price range of that place,that place
Give me the business price of the last one,last one
Give me the price of that place,that place
Give me the price of the third one,third one
Show me the price range of that place,that place
Show me the business price of the last one,last one
Show me the price range of that place,that place
Show me the price of the third one,third one
how are the prices,
price,
does it have bad prices,
Show its prices,
Tell me its best price,
does the first one have good prices,first one
Does that one have bad prices,that one
does it have a good price,
show the prices,
Give the prices,
tell me the price range,
price range,
range of prices,
