MusicPlayResponse,MusicPlaySongAlbum,MusicPlayAlbumArtist,MusicPlayAlbumArtistSong,MusicPlaySong,MusicPlayArtist,MusicPlayAlbum,MusicPlayCollection,MusicPlayGenre,MusicPlayMood,MusicPlayEra,MusicPlayKeyword,MusicPlayNew,MusicPlaySimilar
can you play 12 stones,,,,,12 stones,,,,,,,,
can you play 1950s garage punk music,,,,,,,,garage punk,,1950s,,,
can you play 80 s masters,,,,,80 s masters,,,,,,,,
can you play a perfect circle,,,,,a perfect circle,,,,,,,,
can you play a-type player,,,,,a-type player,,,,,,,,
can you play aaron tveit eddie redmayne students les misérables cast,,,,,aaron tveit eddie redmayne students les misérables cast,,,,,,,,
can you play adam sandler,,,,,adam sandler,,,,,,,,
can you play alexander o neal,,,,,alexander o neal,,,,,,,,
can you play alina devecerski,,,,,alina devecerski,,,,,,,,
can you play alma cogan,,,,,alma cogan,,,,,,,,
can you play american country hits,,,,,american country hits,,,,,,,,
can you play andrew w k,,,,,andrew w k,,,,,,,,
can you play annie,,,,,annie,,,,,,,,
can you play artist,,,,,artist,,,,,,,,
can you play augustus pablo,,,,,augustus pablo,,,,,,,,
can you play band,,,,,band,,,,,,,,
can you play band of skulls,,,,,band of skulls,,,,,,,,
can you play beady eye,,,,,beady eye,,,,,,,,
can you play bell biv devoe,,,,,bell biv devoe,,,,,,,,
can you play bella thorne,,,,,bella thorne,,,,,,,,
can you play ben tankard,,,,,ben tankard,,,,,,,,
can you play bent,,,,,bent,,,,,,,,
can you play big grams,,,,,big grams,,,,,,,,
can you play bingo players,,,,,bingo players,,,,,,,,
can you play blackhawk,,,,,blackhawk,,,,,,,,
can you play bobby v,,,,,bobby v,,,,,,,,
can you play bohse onkelz,,,,,bohse onkelz,,,,,,,,
can you play breaking benjamin,,,,,breaking benjamin,,,,,,,,
can you play brooke candy,,,,,brooke candy,,,,,,,,
can you play bryan adams,,,,,bryan adams,,,,,,,,
can you play buck owens,,,,,buck owens,,,,,,,,
can you play carefree,,,,,carefree,,,,,,,,
can you play chalino sanchez,,,,,chalino sanchez,,,,,,,,
can you play charly garcía,,,,,charly garcía,,,,,,,,
can you play chrisette michele,,,,,chrisette michele,,,,,,,,
can you play christmas songs,,,,,christmas songs,,,,,,,,
can you play comet kid,,,,,comet kid,,,,,,,,
can you play conchita wurst,,,,,conchita wurst,,,,,,,,
can you play cristian castro,,,,,cristian castro,,,,,,,,
can you play crystal gayle,,,,,crystal gayle,,,,,,,,
can you play current singer,,,,,current singer,,,,,,,,
can you play current singer,,,,,current singer,,,,,,,,
can you play dan bull,,,,,dan bull,,,,,,,,
can you play daniel johns,,,,,daniel johns,,,,,,,,
can you play danko jones,,,,,danko jones,,,,,,,,
can you play devvon terrell,,,,,devvon terrell,,,,,,,,
can you play dexter gordon,,,,,dexter gordon,,,,,,,,
can you play diana ross,,,,,diana ross,,,,,,,,
can you play die drei,,,,,die drei,,,,,,,,
can you play diego boneta,,,,,diego boneta,,,,,,,,
can you play drumsound bassline smith,,,,,drumsound bassline smith,,,,,,,,
can you play dusty springfield,,,,,dusty springfield,,,,,,,,
can you play earth wind fire,,,,,earth wind fire,,,,,,,,
can you play eminem,,,,,eminem,,,,,,,,
can you play english baroque soloists,,,,,english baroque soloists,,,,,,,,
can you play eric bellinger,,,,,eric bellinger,,,,,,,,
can you play erick sermon,,,,,erick sermon,,,,,,,,
can you play europe,,,,,europe,,,,,,,,
can you play exam study classical music orchestra,,,,,exam study classical music orchestra,,,,,,,,
can you play famous last words,,,,,famous last words,,,,,,,,
can you play fedez,,,,,fedez,,,,,,,,
can you play fifth,,,,,fifth,,,,,,,,
can you play fifth one,,,,,fifth one,,,,,,,,
can you play fifth one,,,,,fifth one,,,,,,,,
can you play fifth one,,,,,fifth one,,,,,,,,
can you play finger eleven,,,,,finger eleven,,,,,,,,
can you play first,,,,,first,,,,,,,,
can you play first one,,,,,first one,,,,,,,,
can you play first one,,,,,first one,,,,,,,,
can you play foster allen,,,,,foster allen,,,,,,,,
can you play franck pourcel,,,,,franck pourcel,,,,,,,,
can you play freda payne,,,,,freda payne,,,,,,,,
can you play freddie jackson,,,,,freddie jackson,,,,,,,,
can you play gareth emery,,,,,gareth emery,,,,,,,,
can you play gina g,,,,,gina g,,,,,,,,
can you play graeme revell,,,,,graeme revell,,,,,,,,
can you play great lake swimmers,,,,,great lake swimmers,,,,,,,,
can you play grupo bryndis,,,,,grupo bryndis,,,,,,,,
can you play guy penrod,,,,,guy penrod,,,,,,,,
can you play hank williams jr,,,,,hank williams jr,,,,,,,,
can you play harris jayaraj,,,,,harris jayaraj,,,,,,,,
can you play hawthorne heights,,,,,hawthorne heights,,,,,,,,
can you play helmet,,,,,helmet,,,,,,,,
can you play henry jackman,,,,,henry jackman,,,,,,,,
can you play her,,,,,her,,,,,,,,
can you play him,,,,,him,,,,,,,,
can you play him,,,,,him,,,,,,,,
can you play his,,,,,his,,,,,,,,
can you play honeyblood,,,,,honeyblood,,,,,,,,
can you play hudson thames,,,,,hudson thames,,,,,,,,
can you play j cole feat miguel,,,,,j cole feat miguel,,,,,,,,
can you play j-kwon,,,,,j-kwon,,,,,,,,
can you play jack ü,,,,,jack ü,,,,,,,,
can you play jerry reed,,,,,jerry reed,,,,,,,,
can you play jess glynne,,,,,jess glynne,,,,,,,,
can you play joe diffie,,,,,joe diffie,,,,,,,,
can you play joe flizzow,,,,,joe flizzow,,,,,,,,
can you play johannes oerding,,,,,johannes oerding,,,,,,,,
can you play john mayall,,,,,john mayall,,,,,,,,
can you play johnny nash,,,,,johnny nash,,,,,,,,
can you play johnossi,,,,,johnossi,,,,,,,,
can you play jolin tsai,,,,,jolin tsai,,,,,,,,
can you play jools holland,,,,,jools holland,,,,,,,,
can you play jorge ben,,,,,jorge ben,,,,,,,,
can you play kate nash,,,,,kate nash,,,,,,,,
can you play katzenjammer,,,,,katzenjammer,,,,,,,,
can you play kay one,,,,,kay one,,,,,,,,
can you play kb,,,,,kb,,,,,,,,
can you play kungs,,,,,kungs,,,,,,,,
can you play last one,,,,,last one,,,,,,,,
can you play lenka,,,,,lenka,,,,,,,,
can you play linkin park,,,,,linkin park,,,,,,,,
can you play lisa stokke,,,,,lisa stokke,,,,,,,,
can you play loose ends,,,,,loose ends,,,,,,,,
can you play los angeles negros,,,,,los angeles negros,,,,,,,,
can you play los invasores de nuevo leon,,,,,los invasores de nuevo leon,,,,,,,,
can you play louis armstrong,,,,,louis armstrong,,,,,,,,
can you play louis the child,,,,,louis the child,,,,,,,,
can you play love and theft,,,,,love and theft,,,,,,,,
can you play lp,,,,,lp,,,,,,,,
can you play luniz,,,,,luniz,,,,,,,,
can you play maino,,,,,maino,,,,,,,,
can you play mark morrison,,,,,mark morrison,,,,,,,,
can you play mark morrison,,,,,mark morrison,,,,,,,,
can you play markus schulz,,,,,markus schulz,,,,,,,,
can you play matt monro,,,,,matt monro,,,,,,,,
can you play matt simons,,,,,matt simons,,,,,,,,
can you play mc hammer,,,,,mc hammer,,,,,,,,
can you play me jolene by akala,jolene,,,,akala,,,,,,,,
can you play me one kiss from you by foster allen,one kiss from you,,,,foster allen,,,,,,,,
can you play me some 1930s smooth new school hip hop,,,,,,,,new school hip hop,,1930s,,,
can you play me supercollider the butcher by him,supercollider the butcher,,,,him,,,,,,,,
can you play mellow playlist,,,,,,,mellow,,,,,,
can you play mercury rev,,,,,mercury rev,,,,,,,,
can you play mika,,,,,mika,,,,,,,,
can you play milk bone,,,,,milk bone,,,,,,,,
can you play miss saigon original cast,,,,,miss saigon original cast,,,,,,,,
can you play modjo,,,,,modjo,,,,,,,,
can you play modjo,,,,,modjo,,,,,,,,
can you play mother mother,,,,,mother mother,,,,,,,,
can you play mushroomhead,,,,,mushroomhead,,,,,,,,
can you play my out and about playlist,,,,,,,out and about,,,,,,
can you play nakash aziz,,,,,nakash aziz,,,,,,,,
can you play nanci griffith,,,,,nanci griffith,,,,,,,,
can you play nate ruess,,,,,nate ruess,,,,,,,,
can you play newsong,,,,,newsong,,,,,,,,
can you play nils lofgren,,,,,nils lofgren,,,,,,,,
can you play ninth,,,,,ninth,,,,,,,,
can you play nursery rhymes,,,,,nursery rhymes,,,,,,,,
can you play oddisee,,,,,oddisee,,,,,,,,
can you play odyssey,,,,,odyssey,,,,,,,,
can you play oslo ess,,,,,oslo ess,,,,,,,,
can you play pandora,,,,,pandora,,,,,,,,
can you play passion,,,,,passion,,,,,,,,
can you play patrick swayze,,,,,patrick swayze,,,,,,,,
can you play pepper,,,,,pepper,,,,,,,,
can you play phil coulter,,,,,phil coulter,,,,,,,,
can you play philipp poisel,,,,,philipp poisel,,,,,,,,
can you play pulp,,,,,pulp,,,,,,,,
can you play regina spektor,,,,,regina spektor,,,,,,,,
can you play rich homie quan young thug,,,,,rich homie quan young thug,,,,,,,,
can you play road demonz,,,,,road demonz,,,,,,,,
can you play robert cray,,,,,robert cray,,,,,,,,
can you play rolf harris,,,,,rolf harris,,,,,,,,
can you play room 94,,,,,room 94,,,,,,,,
can you play roscoe dash,,,,,roscoe dash,,,,,,,,
can you play run d m c,,,,,run d m c,,,,,,,,
can you play sade,,,,,sade,,,,,,,,
can you play sally can't dance,,,sally can't dance,,,,,,,,,,
can you play sam ock,,,,,sam ock,,,,,,,,
can you play second,,,,,second,,,,,,,,
can you play second,,,,,second,,,,,,,,
can you play second one,,,,,second one,,,,,,,,
can you play selena y los dinos,,,,,selena y los dinos,,,,,,,,
can you play shaan,,,,,shaan,,,,,,,,
can you play silkk the shocker,,,,,silkk the shocker,,,,,,,,
can you play singer,,,,,singer,,,,,,,,
can you play singer,,,,,singer,,,,,,,,
can you play singer,,,,,singer,,,,,,,,
can you play sister hazel,,,,,sister hazel,,,,,,,,
can you play sixth one,,,,,sixth one,,,,,,,,
can you play skip the use,,,,,skip the use,,,,,,,,
can you play some 2010s music,,,,,,,,,,2010s,,,
can you play some 90s music,,,,,,,,,,90s,,,
can you play some chicago house,,,,,,,,chicago house,,,,,
can you play some detroit rap,,,,,,,,detroit rap,,,,,
can you play some euro house,,,,,,,,euro house,,,,,
can you play some mambo,,,,,,,,mambo,,,,,
can you play some songs for a girl s night out,,,,,,,,,,,girl s night out,,
can you play some songs for a girl s night out,,,,,,,,,,,girl s night out,,
can you play some songs for a girl s night out,,,,,,,,,,,girl s night out,,
can you play some songs for a girl s night out,,,,,,,,,,,girl s night out,,
can you play some songs for a girl s night out,,,,,,,,,,,girl s night out,,
can you play something similar,,,,,,,,,,,,,similar
can you play something similar,,,,,,,,,,,,,similar
can you play songs for toddlers,,,,,songs for toddlers,,,,,,,,
can you play spring king,,,,,spring king,,,,,,,,
can you play starbomb,,,,,starbomb,,,,,,,,
can you play stevie nicks,,,,,stevie nicks,,,,,,,,
can you play storm queen,,,,,storm queen,,,,,,,,
can you play sublime with rome,,,,,sublime with rome,,,,,,,,
can you play success,,,,,success,,,,,,,,
can you play taizé,,,,,taizé,,,,,,,,
can you play tal bachman,,,,,tal bachman,,,,,,,,
can you play tenth one,,,,,tenth one,,,,,,,,
can you play tenth one,,,,,tenth one,,,,,,,,
can you play the ambassador,,,,,the ambassador,,,,,,,,
can you play the arcs,,,,,the arcs,,,,,,,,
can you play the brooklyn tabernacle choir,,,,,the brooklyn tabernacle choir,,,,,,,,
can you play the charlatans,,,,,the charlatans,,,,,,,,
can you play the crusaders,,,,,the crusaders,,,,,,,,
can you play the dave brubeck quartet,,,,,the dave brubeck quartet,,,,,,,,
can you play the fifth,,,,,the fifth,,,,,,,,
can you play the fourth,,,,,the fourth,,,,,,,,
can you play the fourth,,,,,the fourth,,,,,,,,
can you play the get up kids,,,,,the get up kids,,,,,,,,
can you play the handsome family,,,,,the handsome family,,,,,,,,
can you play the killers,,,,,the killers,,,,,,,,
can you play the killers,,,,,the killers,,,,,,,,
can you play the moody blues,,,,,the moody blues,,,,,,,,
can you play the osmonds,,,,,the osmonds,,,,,,,,
can you play the paper kites,,,,,the paper kites,,,,,,,,
can you play the pioneers,,,,,the pioneers,,,,,,,,
can you play the presidents of the united states of america,,,,,the presidents of the united states of america,,,,,,,,
can you play the second,,,,,the second,,,,,,,,
can you play the sixth,,,,,the sixth,,,,,,,,
can you play the sixth,,,,,the sixth,,,,,,,,
can you play the sixth,,,,,the sixth,,,,,,,,
can you play the tenth,,,,,the tenth,,,,,,,,
can you play the third,,,,,the third,,,,,,,,
can you play the track first,,,,first,,,,,,,,,
can you play the track kill all your friends b-side,,,,kill all your friends b-side,,,,,,,,,
can you play the track the first,,,,the first,,,,,,,,,
can you play theatre of tragedy,,,,,theatre of tragedy,,,,,,,,
can you play they,,,,,they,,,,,,,,
can you play third,,,,,third,,,,,,,,
can you play this,,,,,this,,,,,,,,
can you play this artist,,,,,this artist,,,,,,,,
can you play this band,,,,,this band,,,,,,,,
can you play this musician,,,,,this musician,,,,,,,,
can you play thomas dybdahl,,,,,thomas dybdahl,,,,,,,,
can you play tnt,,,,,tnt,,,,,,,,
can you play tom rosenthal,,,,,tom rosenthal,,,,,,,,
can you play tommy steele the steelmen,,,,,tommy steele the steelmen,,,,,,,,
can you play tove lo,,,,,tove lo,,,,,,,,
can you play trendsetter,,,,,trendsetter,,,,,,,,
can you play tv sounds unlimited,,,,,tv sounds unlimited,,,,,,,,
can you play twin shadow,,,,,twin shadow,,,,,,,,
can you play tycho,,,,,tycho,,,,,,,,
can you play tyrese,,,,,tyrese,,,,,,,,
can you play vineyard worship,,,,,vineyard worship,,,,,,,,
can you play völkerball,,,,,völkerball,,,,,,,,
can you play will downing,,,,,will downing,,,,,,,,
can you play william orbit,,,,,william orbit,,,,,,,,
can you play ying yang twins,,,,,ying yang twins,,,,,,,,
can you play young franco,,,,,young franco,,,,,,,,
can you play young scooter,,,,,young scooter,,,,,,,,
can you play zen music garden,,,,,zen music garden,,,,,,,,
can you play zomboy,,,,,zomboy,,,,,,,,
can you put on baroness song lucky ones feat rudy currence,,,,lucky ones feat rudy currence,baroness,,,,,,,,
can you put on brian culbertson song purple sky,,,,purple sky,brian culbertson,,,,,,,,
can you put on the new song by nina nesbitt,,,,,nina nesbitt,,,,,,,new,
can you put on the new song by seventh,,,,,seventh,,,,,,,new,
could you play album by current singer the album,,,,,current singer,album,,,,,,,
could you play alligator sky by the strumbellas the album,,,,,the strumbellas,alligator sky,,,,,,,
could you play american beauty american psycho by them the album,,,,,them,american beauty american psycho,,,,,,,
could you play blink-182 by tq the album,,,,,tq,blink-182,,,,,,,
could you play four by zedd the album,,,,,zedd,four,,,,,,,
could you play fun boy three top hits,,,,,fun boy three,,,,,,,,
could you play the essential stevie ray vaughan and double trouble by last dinosaurs the album,,,,,last dinosaurs,the essential stevie ray vaughan and double trouble,,,,,,,
could you play want dem all feat konshens by third the album,,,,,third,want dem all feat konshens,,,,,,,
could you put on come see me,,,come see me,,,,,,,,,,
could you put on every avenue,,,every avenue,,,,,,,,,,
could you put on jeremih,,,jeremih,,,,,,,,,,
could you put on lies greed misery dirtyphonics remix,,,lies greed misery dirtyphonics remix,,,,,,,,,,
could you put on power,,,power,,,,,,,,,,
could you put on r5,,,r5,,,,,,,,,,
could you put on some more artists like canaan smith,,,,,canaan smith,,,,,,,,like
could you put on some more artists like ricky skaggs,,,,,ricky skaggs,,,,,,,,like
could you put on souls of mischief,,,souls of mischief,,,,,,,,,,
could you put on the best of- 20 years of rock,,,the best of- 20 years of rock,,,,,,,,,,
could you put on the gym playlist,,,,,,,gym,,,,,,
do you have royalty by that performer,royalty,,,,that performer,,,,,,,,
do you have the best day by jean-yves thibaudet,the best day,,,,jean-yves thibaudet,,,,,,,,
do you have the song awooga extended mix by kiss,,,,awooga extended mix,kiss,,,,,,,,
do you have the song crazy by gza,,,,crazy,gza,,,,,,,,
do you have the song loving my jesus by bobby vinton,,,,loving my jesus,bobby vinton,,,,,,,,
do you have the song me myself i by asha bhosle mohammed rafi,,,,me myself i,asha bhosle mohammed rafi,,,,,,,,
do you have the song red wine by inger södergren,,,,red wine,inger södergren,,,,,,,,
do you have the song sons of plunder by al jarreau,,,,sons of plunder,al jarreau,,,,,,,,
do you have the song work by ben webster,,,,work,ben webster,,,,,,,,
i feel like listening to boom boxx,,,boom boxx,,,,,,,,,,
i feel like listening to greyhound,,,greyhound,,,,,,,,,,
i feel like listening to love me feat veela,,,love me feat veela,,,,,,,,,,
i feel like listening to vs,,,vs,,,,,,,,,,
i feel like some classical,,,,,,,,classical,,,,,
i wanna hear 1970s mambo,,,,,,,,mambo,,1970s,,,
i wanna hear imperiet,,,imperiet,,,,,,,,,,
i wanna hear some 1950s gospel,,,,,,,,gospel,,1950s,,,
i wanna hear some 60s australian hip hop,,,,,,,,australian hip hop,,60s,,,
i wanna hear some loud 50s chinese rock,,,,,,,,chinese rock,,50s,,,
i wanna hear the song air for free,,,,air for free,,,,,,,,,
i wanna hear the song all along the watchtower,,,,all along the watchtower,,,,,,,,,
i wanna hear the song be alright,,,,be alright,,,,,,,,,
i wanna hear the song get me,,,,get me,,,,,,,,,
i wanna hear the song kashmir live o2 arena london - december 10 2007,,,,kashmir live o2 arena london - december 10 2007,,,,,,,,,
i wanna hear the song never gonna stop the red red kroovy,,,,never gonna stop the red red kroovy,,,,,,,,,
i wanna hear the song wilderness,,,,wilderness,,,,,,,,,
i wanna listen to run,,,run,,,,,,,,,,
i want to hear 1990s chalga hits,,,,,,,,chalga,,1990s,,,
i want to hear some singers like north mississippi allstars,,,,,north mississippi allstars,,,,,,,,like
i want to listen to alexi murdoch,,,alexi murdoch,,,,,,,,,,
i want to listen to can t take my eyes off of you feat selah sue,,,can t take my eyes off of you feat selah sue,,,,,,,,,,
i want to listen to jamming,,,jamming,,,,,,,,,,
i want to listen to the song already,,,,already,,,,,,,,,
i want to listen to the song i'm broken,,,,i'm broken,,,,,,,,,
i want to listen to the song seventh one,,,,seventh one,,,,,,,,,
i'd like hear hello by ward thomas,hello,,,,ward thomas,,,,,,,,
i'd like to hear all down the line by ill nino,all down the line,,,,ill nino,,,,,,,,
i'd like to hear artists like rage against the machine,,,,,,,,,,,,,
i'd like to hear artists like rage against the machine,,,,,,,,,,,,,
i'd like to hear artists like rage against the machine,,,,,,,,,,,,,
i'd like to hear artists like rage against the machine,,,,,,,,,,,,,
i'd like to hear artists like rage against the machine,,,,,,,,,,,,,
i'd like to hear artists like rage against the machine,,,,,,,,,,,,,
i'd like to hear artists like rage against the machine,,,,,,,,,,,,,
i'd like to hear cash machine,,,cash machine,,,,,,,,,,
i'd like to hear deep cuts the doo wop years,,,deep cuts the doo wop years,,,,,,,,,,
i'd like to hear get ugly - single,,,get ugly - single,,,,,,,,,,
i'd like to hear geto boys,,,geto boys,,,,,,,,,,
i'd like to hear lene marlin,,,lene marlin,,,,,,,,,,
i'd like to hear lil bibby,,,lil bibby,,,,,,,,,,
i'd like to hear neon steeple by evanescence,neon steeple,,,,evanescence,,,,,,,,
i'd like to hear prayer,,,prayer,,,,,,,,,,
i'd like to hear some abc,,,abc,,,,,,,,,,
i'd like to hear some for club play only pt 2,,,for club play only pt 2,,,,,,,,,,
i'd like to hear some robert miles,,,robert miles,,,,,,,,,,
i'd like to hear some songs in the key of life,,,songs in the key of life,,,,,,,,,,
i'd like to hear the song i should be so lucky,,,,i should be so lucky,,,,,,,,,
i'd like to hear the song lord give me a sign,,,,lord give me a sign,,,,,,,,,
i'd like to hear the song we don't talk anymore,,,,we don't talk anymore,,,,,,,,,
i'd like to hear vince guaraldi,,,vince guaraldi,,,,,,,,,,
i'd like to listen to art of dying,,,art of dying,,,,,,,,,,
i'd like to listen to caro emerald,,,caro emerald,,,,,,,,,,
i'd like to listen to laura mvula,,,laura mvula,,,,,,,,,,
i'd like to listen to petite meller,,,petite meller,,,,,,,,,,
i'd like to listen to sweet nothing,,,sweet nothing,,,,,,,,,,
i'd like to listen to vnv nation,,,vnv nation,,,,,,,,,,
i'm in the mood for some energetic music,,,,,,,,,energetic,,,,
i'm in the mood for some energizing music,,,,,,,,,energizing,,,,
i'm in the mood for some relaxing music,,,,,,,,,relaxing,,,,
i'm in the mood for some rousing music,,,,,,,,,rousing,,,,
i'm in the mood for some trap music,,,,,,,,trap,,,,,
let s get some calm music on,,,,,,,,,calm,,,,
let s get some calm music on,,,,,,,,,calm,,,,
let s get some cheerful music on,,,,,,,,,cheerful,,,,
let s get some defiant music on,,,,,,,,,defiant,,,,
let s get some energetic music on,,,,,,,,,energetic,,,,
let s get some exciting music on,,,,,,,,,exciting,,,,
let s get some melancholy music on,,,,,,,,,melancholy,,,,
let s get some romantic music on,,,,,,,,,romantic,,,,
let s get some sad music on,,,,,,,,,sad,,,,
let s get some sensual music on,,,,,,,,,sensual,,,,
let s get some sensual music on,,,,,,,,,sensual,,,,
let s get some sexy music on,,,,,,,,,sexy,,,,
let s get some sexy music on,,,,,,,,,sexy,,,,
let s get some soothing music on,,,,,,,,,soothing,,,,
let s get some tender music on,,,,,,,,,tender,,,,
let s get some unhappy music on,,,,,,,,,unhappy,,,,
let s get some yearning music on,,,,,,,,,yearning,,,,
let s hear 80s calypso hits,,,,,,,,calypso,,80s,,,
let s hear all eyez on me by hailee steinfeld,all eyez on me,,,,hailee steinfeld,,,,,,,,
let s hear artists similar to nickelback,,,,,nickelback,,,,,,,,similar
let s hear artists similar to raised fist,,,,,raised fist,,,,,,,,similar
let s hear blind guardian,,,blind guardian,,,,,,,,,,
let s hear d12 album called runaway u i,,,,,d12,runaway u i,,,,,,,
let s hear deer tick song the mirror,,,,the mirror,deer tick,,,,,,,,
let s hear duets the final chapter by the second,duets the final chapter,,,,the second,,,,,,,,
let s hear example song mama,,,,mama,example,,,,,,,,
let s hear fourth song song,,,,song,fourth,,,,,,,,
let s hear le cose che non ho by blackberry smoke,le cose che non ho,,,,blackberry smoke,,,,,,,,
let s hear ma météo personelle by william fitzsimmons,ma météo personelle,,,,william fitzsimmons,,,,,,,,
let s hear millencolin s song feels like forever live,,,,feels like forever live,millencolin,,,,,,,,
let s hear n-dubz,,,n-dubz,,,,,,,,,,
let s hear rob bailey the hustle standard station,,,,,rob bailey the hustle standard,,,,,,,,
let s hear seventh s song warzone,,,,warzone,seventh,,,,,,,,
let s hear some delta blue music,,,,,,,,delta blue,,,,,
let s hear some louisiana blues music,,,,,,,,louisiana blues,,,,,
let s hear some more artists like coheed cambria,,,,,coheed cambria,,,,,,,,like
let s hear some more artists like hollywood vampires,,,,,hollywood vampires,,,,,,,,like
let s hear some more artists like hoobastank,,,,,hoobastank,,,,,,,,like
let s hear some rap music from the 2010s,,,,,,,,rap,,2010s,,,
let s hear some western music,,,,,,,,western,,,,,
let s hear the album ciara,,,,,,ciara,,,,,,,
let s hear the album eusa,,,,,,eusa,,,,,,,
let s hear the album gloria glee cast version feat adam lambert,,,,,,gloria glee cast version feat adam lambert,,,,,,,
let s hear the album hands all over,,,,,,hands all over,,,,,,,
let s hear the album happy song,,,,,,happy song,,,,,,,
let s hear the album the 21 project,,,,,,the 21 project,,,,,,,
let s hear the crown season one soundtrack from the netflix original series by g unit,the crown season one soundtrack from the netflix original series,,,,g unit,,,,,,,,
let s hear the enemy song the hills,,,,the hills,the enemy,,,,,,,,
let s hear the foundations song the eighth,,,,the eighth,the foundations,,,,,,,,
let s hear the lisa ekdahl song that just came out,,,,,lisa ekdahl,,,,,,,just,
let s hear the song seventh one by that singer,,,,seventh one,that singer,,,,,,,,
let s hear the song sixth by freddie the dreamers,,,,sixth,freddie the dreamers,,,,,,,,
let s hear the song the antidote by keri hilson,,,,the antidote,keri hilson,,,,,,,,
let s hear the star spangled banner america the beautiful by johnny winter,the star spangled banner america the beautiful,,,,johnny winter,,,,,,,,
let s hear the terje nilsen song that just came out,,,,,terje nilsen,,,,,,,just,
let s hear the the jacksons song that just came out,,,,,the jacksons,,,,,,,just,
let s hear veronica maggio s song eighth,,,,eighth,veronica maggio,,,,,,,,
let s listen the album 5 o'clock in the morning who'd have known remix,,,,,,5 o'clock in the morning who'd have known remix,,,,,,,
let s listen to the song dusk 2 dusk,,,,dusk 2 dusk,,,,,,,,,
let s listen to the song seventh,,,,seventh,,,,,,,,,
let s listen to the song sideways,,,,sideways,,,,,,,,,
let s listen to the song time of our lives,,,,time of our lives,,,,,,,,,
plan an acoustic curation,,,,,,,,,,,acoustic,,
plan an acoustic curation,,,,,,,,,,,acoustic,,
plan an acoustic curation,,,,,,,,,,,acoustic,,
plan an acoustic curation,,,,,,,,,,,acoustic,,
plan an island mix,,,,,,,,,,,island,,
plan an island mix,,,,,,,,,,,island,,
play 100 00 s by hard-fi,,,,,hard-fi,100 00 s,,,,,,,
play 1930s music,,,,,,,,,,1930s,,,
play 1930s songs,,,,,,,,,,1930s,,,
play 1940s decade radio,,,,,,,,,,1940s,,,
play 1940s latin rock,,,,,,,,latin rock,,1940s,,,
play 1960s music,,,,,,,,,,1960s,,,
play 1980s hits,,,,,,,,,,1980s,,,
play 1990s radio,,,,,,,,,,1990s,,,
play 2000s hits,,,,,,,,,,2000s,,,
play 2000s music,,,,,,,,,,2000s,,,
play 22 by after the burial,22,,,,after the burial,,,,,,,,
play 30 up 1986,,,,30 up 1986,,,,,,,,,
play 3lau s track god,,,,god,3lau,,,,,,,,
play 40s dangdut,,,,,,,,dangdut,,40s,,,
play 40s music,,,,,,,,,,40s,,,
play 48 by eluvium,48,,,,eluvium,,,,,,,,
play 5 studio album set by nothing but thieves,,,,,nothing but thieves,5 studio album set,,,,,,,
play 5-4-3-2-1 by stockard channing,5-4-3-2-1,,,,stockard channing,,,,,,,,
