MusicInfoConcertsResponse,MusicInfoConcertsArtist,MusicInfoConcertsLocation,MusicInfoConcertsDate
look up the third concerts near eighth one,the third,eighth one,
look up third concerts in the Doğanköy,third,Doğanköy,
look up thunder concerts,thunder,,
look up tour dates,,,
look up tour dates,,,
look up tour dates,,,
look up tour dates,,,
look up upcoming bishop briggs concerts,bishop briggs,,
look up upcoming classical christmas music songs concerts,classical christmas music songs,,
look up upcoming richard thompson concerts,richard thompson,,
look up upcoming them concerts,them,,
look up upcoming this band concerts,this band,,
look up vashawn mitchell concerts,vashawn mitchell,,
look up 슈퍼 주니어 super junior tour dates,슈퍼 주니어 super junior,,
lookup leela james concerts,leela james,,
lookup misha omar concerts,misha omar,,
robert cray next concert is in what city,robert cray,,
search amalia rodrigues concerts in seventh for twentieth May,amalia rodrigues,seventh,twentieth May
search bars and melody concerts near ninth,bars and melody,ninth,
search caro emerald concerts near Bloc Avv-V3 Nahouri,caro emerald,Bloc Avv-V3 Nahouri,
search cass mccombs concerts that,cass mccombs,that,
search chandra kamal concerts near Memmelshoffen,chandra kamal,Memmelshoffen,
search concert,,,
search concert,,,
search concert,,,
search concert of last one in Ağbənd,last one,Ağbənd,
search concert of the communards in last one,the communards,last one,
search concerts for goldlink in ninth one,goldlink,ninth one,
search concerts for him in Ratanpur Miri Gaon,him,Ratanpur Miri Gaon,
search concerts for matthew parker in that,matthew parker,that,
search concerts for the shires in that place,the shires,that place,
search deez nuts concerts in Vřesovice Jihomoravský for fifth November,deez nuts,Vřesovice Jihomoravský,fifth November
search eighth concerts for me,eighth,,
search eighth one concerts,eighth one,,
search for a concert,,,
search for a concert,,,
search for admiral p concerts,admiral p,,
search for anthem lights concerts,anthem lights,,
search for btob concerts,btob,,
search for concert dates,,,
search for concert dates,,,
search for concert dates,,,
search for dara maclean concerts,dara maclean,,
search for deorro concerts,deorro,,
search for device concerts,device,,
search for edx concert in Semwali Morogoro,edx,Semwali Morogoro,
search for grace concerts,grace,,
search for he concerts,he,,
search for junior senior concert in Durtol,junior senior,Durtol,
search for michael giacchino concert in ninth one,michael giacchino,ninth one,
search for music concerts in second,,second,
search for ninth concerts,ninth,,
search for ninth one concerts,ninth one,,
search for orishas concerts in Sukhpur Solhani,orishas,Sukhpur Solhani,
search for röyksopp concerts,röyksopp,,
search for see you again concerts,see you again,,
search for she concerts,she,,
search for she concerts,she,,
search for sixth concerts,sixth,,
search for sixth concerts,sixth,,
search for that concerts in Croy,that,Croy,
search for the diplomats concerts,the diplomats,,
search for the fourth concerts,the fourth,,
search for the latest concerts by current swell in Concord United States of America,current swell,Concord United States of America,
search for the latest concerts by fifth one in Bani,fifth one,Bani,
search for the latest concerts by he in last,he,last,
search for the minister of soundalikes concerts,the minister of soundalikes,,
search for the next fantastic negrito gig,fantastic negrito,,
search for the next jess moskaluke show,jess moskaluke,,
search for the next maldita nerea gig,maldita nerea,,
search for the next ninth gig,ninth,,
search for the next seventh show,seventh,,
search for the next singer gig in the last,singer,the last,
search for the next steve earle gig in Charentenay,steve earle,Charentenay,
search for the next the eighth show,the eighth,,
search for the next the seventh show,the seventh,,
search for the next third one gig,third one,,
search for the next twin peaks show,twin peaks,,
search for the sensational alex harvey band concerts,the sensational alex harvey band,,
search for the sixth concert in the ninth,the sixth,the ninth,
search for the tenth concerts,the tenth,,
search for the wailers concerts,the wailers,,
search for their concert in this,their,this,
search for their concerts,their,,
search for young mc concerts,young mc,,
search futuristic concerts Concord,futuristic,Concord,
search keyshia cole lil wayne Barcellona concerts,keyshia cole lil wayne,Barcellona,
search malkit singh concerts in Sorkhan Kalāteh Golestān for February twentieth,malkit singh,Sorkhan Kalāteh Golestān,February twentieth
search redfoo concerts,redfoo,,
search that musician concerts near Naşa,that musician,Naşa,
search the selecter that place concerts,the selecter,that place,
search this performer concerts for me,this performer,,
search upcoming concerts for third one,third one,,
search upcoming shows for ninth,ninth,,
search upcoming tour dates for bendik,bendik,,
search upcoming tour dates for christer sjögren,christer sjögren,,
see concerts,,,
see concerts,,,
see concerts,,,
see tour info,,,
see tour info,,,
she next show is playing where,she,,
show Villadeati Italy concert dates for marco beltrami,marco beltrami,Villadeati Italy,
show concerts,,,
show concerts,,,
show concerts,,,
show concerts for flyleaf artist in ninth one,flyleaf,ninth one,
show concerts for maná band in Dampella Burkina Faso,maná,Dampella Burkina Faso,
show concerts for rickie lee jones band in tenth,rickie lee jones,tenth,
show concerts for sixth one band in the third,sixth one,the third,
show concerts for the sixth band in Alvarenga,the sixth,Alvarenga,
show concerts in Blancafort France,,Blancafort France,
show concerts in Cavacurta,,Cavacurta,
show concerts in Cuaca Vieja,,Cuaca Vieja,
show concerts in Dhari Ghat,,Dhari Ghat,
show concerts in Pervomayskoye,,Pervomayskoye,
show concerts in Ried-Brig Switzerland,,Ried-Brig Switzerland,
show concerts in second,,second,
show current singer s concert dates for the ninth,current singer,the ninth,
show dillon concerts near me,dillon,,
show fifth one concerts in third,fifth one,third,
show grand funk railroad concerts in Alor Pongsu,grand funk railroad,Alor Pongsu,
show johnny clegg concerts near me,johnny clegg,,
show justin timberlake concerts near me,justin timberlake,,
show kay one concerts,kay one,,
show live music events in Dakshin Ulladabari,,Dakshin Ulladabari,
show live music events in Lipová Olomoucký,,Lipová Olomoucký,
show me Jīzābād Iran concerts twenty sixth December,,Jīzābād Iran,twenty sixth December
show me any boney m concerts in this,boney m,this,
show me any current singer concerts in Inalegolo Botswana,current singer,Inalegolo Botswana,
show me any glen miller concerts in Seka,glen miller,Seka,
show me any inger södergren concerts in Kafteh Rūd Gīlān,inger södergren,Kafteh Rūd Gīlān,
show me concerts,,,
show me concerts dates,,,
show me concerts dates,,,
show me dragonforce concert info,dragonforce,,
show me fourth shows coming up,fourth,,
show me her concert schedule,her,,
show me if crystal fighters is playing in seventh,crystal fighters,seventh,
show me if louis prima is playing in the seventh,louis prima,the seventh,
show me mat kearney shows coming up,mat kearney,,
show me music shows,,,
show me music shows,,,
show me music shows,,,
show me singer concert schedule,singer,,
show me some concerts,,,
show me some concerts,,,
show me some concerts,,,
show me the concert schedule for laurent garnier,laurent garnier,,
show me the concert schedule for this musician,this musician,,
show me the concert schedule for tina guo,tina guo,,
show me the concert schedule for unkle,unkle,,
show me the third concerts coming up in Mỹ Tho Đồng bằng sông Cửu Long,the third,Mỹ Tho Đồng bằng sông Cửu Long,
show me tour dates for abakus,abakus,,
show me tour dates for audiogroove,audiogroove,,
show me tour dates for fifth one,fifth one,,
show me tour dates for kings of convenience,kings of convenience,,
show me tour dates for the kinks,the kinks,,
show me tour dates for the third,the third,,
show me where dario g is playing,dario g,,
show me where protoje is playing,protoje,,
show me z concert dates,z,,
show ninth concerts,ninth,,
show ninth one s concerts,ninth one,,
show sixth concerts near me,sixth,,
show sixth one concert dates for his,his,sixth one,
show that band concerts near me,that band,,
show this band concerts in Wallenried,this band,Wallenried,
show tour dates for céline dion,céline dion,,
show tour dates for heather headley,heather headley,,
show upcoming concert listings for 44 in the seventh,44,the seventh,
show upcoming concert listings for bobby vinton in Schmorda,bobby vinton,Schmorda,
show upcoming concert listings for etana in Warsun Jammu and Kashmir,etana,Warsun Jammu and Kashmir,
show upcoming concert listings for flowers in the sixth,flowers,the sixth,
show upcoming concert listings for palace in Amūda Syria,palace,Amūda Syria,
show upcoming pegasus concerts,pegasus,,
show upcoming the rapture concerts,the rapture,,
show upcoming tim buckley concerts,tim buckley,,
show when the dells is in concert,the dells,,
show when this is in concert,this,,
show yann tiersen concerts near me,yann tiersen,,
tell me concerts for a1,a1,,
tell me concerts for blackberry smoke,blackberry smoke,,
tell me concerts for that musician,that musician,,
tell me concerts for the abyssinians,the abyssinians,,
tell me the next time that artist will be in third one,that artist,third one,
tell me the next time that singer will be in that,that singer,that,
tell me upcoming concert dates for tenth,tenth,,
tenth next show is playing where,tenth,,
the last next concert is in what city,the last,,
the tenth playing in El Bañado Catamarca anytime soon,the tenth,El Bañado Catamarca,
the veronicas next concert is in what city,the veronicas,,
the weepies next concert is in what city,the weepies,,
there any adelén concerts in Björketorp Västra Götaland,adelén,Björketorp Västra Götaland,
there any jamie xx feat romy concerts in the third,jamie xx feat romy,the third,
there any larry the cable guy concerts in first,larry the cable guy,first,
there any that singer concerts in sixth,that singer,sixth,
there any the tallest man on earth concerts in Cirey Franche-Comté,the tallest man on earth,Cirey Franche-Comté,
there any third one concerts in Sinfra Marahoué,third one,Sinfra Marahoué,
what are anne nørdsti s tour dates,anne nørdsti,,
what are broken social scene s tour dates,broken social scene,,
what are concert dates for andrew mcmahon in the wilderness,andrew mcmahon in the wilderness,,
what are concert dates for band,band,,
what are concert dates for hans petter hansen,hans petter hansen,,
what are concert dates for lamb,lamb,,
what are concert dates for los fabulosos cadillacs,los fabulosos cadillacs,,
what are concert dates for ninth,ninth,,
what are concert dates for paula fernandes,paula fernandes,,
what are concert dates for rationale,rationale,,
what are concert dates for rhonda vincent,rhonda vincent,,
what are concert dates for the fourth,the fourth,,
what are concert dates for them,them,,
what are current singer concert dates,current singer,,
what are dami im s tour dates,dami im,,
what are dej loaf concert dates,dej loaf,,
what are dj quick s tour dates,dj quick,,
what are eighth s tour dates,eighth,,
what are eighth s tour dates,eighth,,
what are guru josh s tour dates,guru josh,,
what are he s tour dates,he,,
what are kevin gates s tour dates,kevin gates,,
what are last tour dates,last,,
what are sixth one s tour dates,sixth one,,
what are sting concert dates,sting,,
what are sunrise avenue s tour dates,sunrise avenue,,
what are tenth one s tour dates,tenth one,,
what are that artist tour dates,that artist,,
what are that musician s tour dates,that musician,,
what are the concert dates,,,
what are the concert dates,,,
what are the countdown kids s tour dates,the countdown kids,,
what are the days second is on tour,second,,
what are the lonely island concert dates,the lonely island,,
what are the ninth s tour dates,the ninth,,
what are the upcoming concerts in Sukhpur Solhani India,,Sukhpur Solhani India,
what are the upcoming concerts in first,,first,
what are the upcoming concerts in tenth one,,tenth one,
what are the upcoming concerts in the fourth,,the fourth,
what are the upcoming concerts in the third,,the third,
what are the upcoming concerts in Škrjanče Slovenia,,Škrjanče Slovenia,
what are them s tour dates,them,,
what are they s tour dates,they,,
what are this band tour dates,this band,,
what are this performer s tour dates,this performer,,
what are tobacco s tour dates,tobacco,,
what artists are in that place,,that place,
what artists are playing May twenty first,,,May twenty first
what bands are in town February fourth,,,February fourth
what bands are in town twenty first February,,,twenty first February
what bands are playing in Bukit Pasir,,Bukit Pasir,
what bands are playing in Kovach Bulgaria,,Kovach Bulgaria,
what bands are playing in Radovene,,Radovene,
what bands are playing in Thurston United States of America,,Thurston United States of America,
what bands are playing in that,,that,
what concert events are on twentieth July,,,twentieth July
what concert events are on twenty sixth May,,,twenty sixth May
what concerts are Khorramshahr Khūzestān June twentieth,,Khorramshahr Khūzestān,June twentieth
what concerts are Sorkhan Kalāteh Iran first February,,Sorkhan Kalāteh Iran,first February
what concerts are coming in Kapfenberg,,Kapfenberg,
what concerts are coming to Grobnice Serbia,,Grobnice Serbia,
what concerts are coming to the first,,the first,
what concerts are playing Oyrières,,Oyrières,
what concerts are playing eighth one,,eighth one,
what concerts are playing Önnestad Sweden,,Önnestad Sweden,
what concerts are the seventh fifteenth June,,the seventh,fifteenth June
what concerts are there August fifth,,,August fifth
what concerts are there first July,,,first July
what concerts are there twenty sixth February,,,twenty sixth February
what concerts can i see July fifteenth,,,July fifteenth
what concerts can i see fifth December,,,fifth December
what concerts can i see fifth November,,,fifth November
what concerts can i see fourth October,,,fourth October
what dates are alvin stardust s tour,alvin stardust,,
what dates are chance the rapper s tour,chance the rapper,,
what dates will 44 be in Ouled Rached,44,Ouled Rached,
what day is bridgit mendler s concert,bridgit mendler,,
what day is destroyer performing,destroyer,,
what day is far east movement s concert,far east movement,,
what day is lady leshurr performing,lady leshurr,,
what day is pimpinela s concert,pimpinela,,
what day is that musician performing,that musician,,
what day is the first concert,first,,
what day is the first one concert,first one,,
what day is the gary valenciano concert,gary valenciano,,
what day is the malú concert,malú,,
what day is the next chaos chaos concert,chaos chaos,,
what day is the next that singer concert,that singer,,
what day is the paul kalkbrenner concert,paul kalkbrenner,,
what day is the she concert,she,,
what day is the stanley clarke concert,stanley clarke,,
what day is the the first concert,the first,,
what day is the the ninth concert,the ninth,,
what day is the woody guthrie concert,woody guthrie,,
what day is the young dolph concert,young dolph,,
what day is tyga chris brown performing,tyga chris brown,,
what days are gang of youths on tour,gang of youths,,
what fifth one concerts are in Bolyarovo Jambol,fifth one,Bolyarovo Jambol,
what is fourth one concert dates,fourth one,,
what is lil wyte concert dates,lil wyte,,
what is pancho barraza concert dates,pancho barraza,,
what is slam concert dates,slam,,
what live shows are playing El Rosal-El Molino fourth July,,El Rosal-El Molino,fourth July
what live shows are playing Pawari fifth October,,Pawari,fifth October
what live shows are playing last second December,,last,second December
what music events are on March second,,,March second
what musicians are in last one December twentieth,,last one,December twentieth
what musicians are in the seventh July twenty first,,the seventh,July twenty first
what s bijelo dugme s tour dates,bijelo dugme,,
what s billie holiday concert dates,billie holiday,,
what s cutting crew s concert schedule,cutting crew,,
what s dimitri vegas s tour dates,dimitri vegas,,
what s johnny logan s concert schedule,johnny logan,,
what s julia holter s tour dates,julia holter,,
what s millie jackson tour schedule,millie jackson,,
what s nick lachey s tour dates,nick lachey,,
what s seventh tour dates,seventh,,
what s singer concert schedule,singer,,
what s telepopmusik s tour dates,telepopmusik,,
what s they tour dates,they,,
what s this performer s concert schedule,this performer,,
what shows are playing in Saint-Ouen-d'Attez this week,,Saint-Ouen-d'Attez,
what shows are playing in Villemaréchal this week,,Villemaréchal,
what shows are there third October,,,third October
when and where is band touring,band,,
when are a ap mob going on tour,a ap mob,,
when are agnete playing in Zacualpan,agnete,Zacualpan,
when are artist going on tour,artist,,
when are bethel music next concertsâ,bethel music,,
when are current singer touring,current singer,,
when are gwen stefani performing in the fifth,gwen stefani,the fifth,
when are high school music band next concertsâ,high school music band,,
when are iggy the stooges playing,iggy the stooges,,
when are jeremih yg playing in the last,jeremih yg,the last,
when are jim croce touring again,jim croce,,
when are klangkarussell touring,klangkarussell,,
when are last one going on tour,last one,,
when are paulette concerts,paulette,,
when are see you again performing in La Cueva de Roa,see you again,La Cueva de Roa,
when are sufjan stevens playing,sufjan stevens,,
when are that concerts,that,,
when are the ninth playing a show here,the ninth,,
when are they going on tour,they,,
when are third one performing in fourth one,third one,fourth one,
when are yandel playing a show here,yandel,,
when cam'ron performing,cam'ron,,
when can i see artist in Kasewa,artist,Kasewa,
when can i see blackmore s night in first,blackmore s night,first,
when can i see capital kings in concert,capital kings,,
when can i see eighth one in concert,eighth one,,
when can i see i am kloot in tenth,i am kloot,tenth,
when can i see ingrid olava live,ingrid olava,,
when can i see isac elliot live,isac elliot,,
when can i see it live,it,,
when can i see james marsden in Dumra India,james marsden,Dumra India,
when can i see justin bieber live,justin bieber,,
when can i see ole ivars in concert,ole ivars,,
when can i see peabo bryson tour,peabo bryson,,
when can i see sak noel live,sak noel,,
when can i see sixth in concert,sixth,,
when can i see tgt live,tgt,,
when can i see the original in ninth one,the original,ninth one,
when can i see the raveonettes in Alhed India,the raveonettes,Alhed India,
when can i see them in concert,them,,
when can i see vince gill in concert,vince gill,,
when d o c playing in Sarro,d o c,Sarro,
when fifth on tour,fifth,,
when is ahmad jais playing Kampur Town India,ahmad jais,Kampur Town India,
when is alex adair doing a concert in fourth,alex adair,fourth,
when is alfred brendel playing in sixth one,alfred brendel,sixth one,
when is anuradha paudwal next show in the eighth,anuradha paudwal,the eighth,
when is ariel camacho y los plebes del rancho in Lede,ariel camacho y los plebes del rancho,Lede,
when is az in Gbantara,az,Gbantara,
when is baauer playing next in Rāya,baauer,Rāya,
when is band concert in Foussais-Payré Pays-de-la-Loire,band,Foussais-Payré Pays-de-la-Loire,
when is band next show in the ninth,band,the ninth,
when is band next tour,band,,
when is barnas supershow in Dzoravank,barnas supershow,Dzoravank,
when is best coast in Qal'eh Dozdān,best coast,Qal'eh Dozdān,
when is big time rush next show,big time rush,,
when is bizzle playing next,bizzle,,
when is bob marley playing in Ried-Brig,bob marley,Ried-Brig,
when is brenda russell s next tour,brenda russell,,
when is brian free assurance next show in Bakong Philippines,brian free assurance,Bakong Philippines,
when is busta rhymes concert,busta rhymes,,
when is cali y el dandee show in eighth one,cali y el dandee,eighth one,
when is caparezza on tour,caparezza,,
when is chamillionaire concert coming in Hauteville-sur-Fier,chamillionaire,Hauteville-sur-Fier,
when is chromeo playing next,chromeo,,
when is cole porter playing sixth,cole porter,sixth,
when is dato sudirman in Tatsuno Nagano,dato sudirman,Tatsuno Nagano,
when is david bisbal playing,david bisbal,,
when is donnie mcclurkin on tour,donnie mcclurkin,,
when is dustin lynch touring,dustin lynch,,
when is eddy arnold playing next in eighth,eddy arnold,eighth,
when is enter shikari on tour,enter shikari,,
when is fazidah joned on tour,fazidah joned,,
when is fifth in Dampella Soum,fifth,Dampella Soum,
when is fifth one concert in ninth,fifth one,ninth,
when is fifth one show in the third,fifth one,the third,
when is fifth playing in tenth,fifth,tenth,
when is fifth playing next in Virtsu Estonia,fifth,Virtsu Estonia,
when is fifth s Gorripudi Andhra Pradesh concert,fifth,Gorripudi Andhra Pradesh,
when is fourth one on tour,fourth one,,
when is fourth one playing in sixth,fourth one,sixth,
when is fourth touring,fourth,,
when is g-eazy on tour,g-eazy,,
when is guillemots playing next in Rapore,guillemots,Rapore,
when is haley reinhart playingâ next,haley reinhart,,
when is her tour,her,,
when is hjerteslag playing next in Dima,hjerteslag,Dima,
when is ich ich next tour,ich ich,,
when is jimi hendrix touring,jimi hendrix,,
when is joe diffie playing Parakou,joe diffie,Parakou,
when is john williams playing next in first one,john williams,first one,
when is jonathan david playing the last,jonathan david,the last,
when is joni mitchell playing in San José de Viñedo,joni mitchell,San José de Viñedo,
when is kaoma next perfomance,kaoma,,
when is karaoke all hits playing,karaoke all hits,,
when is last next show in that place,last,that place,
when is last one concert in the fourth,last one,the fourth,
when is last one next gig,last one,,
when is last one on tour,last one,,
when is last playing Escoutoux France,last,Escoutoux France,
when is los rieleros del norte playing next,los rieleros del norte,,
when is marit larsen in the second,marit larsen,the second,
when is mark vincent playing in seventh,mark vincent,seventh,
when is marshmello on tour,marshmello,,
when is martika playing next in Brasari,martika,Brasari,
when is micky modelle show in Dumra,micky modelle,Dumra,
when is miliki playing next in sixth,miliki,sixth,
when is miranda lambert playing,miranda lambert,,
when is modern baseball performing in eighth one,modern baseball,eighth one,
when is mr hudson in Los Molles,mr hudson,Los Molles,
when is mxpx playing,mxpx,,
when is nashville cast hayden panettiere s next tour,nashville cast hayden panettiere,,
when is neil davidge concert coming in first,neil davidge,first,
when is paris hilton performing in fifth,paris hilton,fifth,
when is parmalee on tour,parmalee,,
when is paul baloche next show in Berkovica,paul baloche,Berkovica,
when is primal scream in this,primal scream,this,
when is relax α wave playing in Zogodo Nigeria,relax α wave,Zogodo Nigeria,
when is relient k on tour,relient k,,
when is ricky skaggs next show in Stanton Nebraska,ricky skaggs,Stanton Nebraska,
when is robert glasper experiment performing in there,robert glasper experiment,there,
when is roots manuva in that,roots manuva,that,
when is saloma going on tour,saloma,,
when is seventh one playingâ next,seventh one,,
when is sharib toshi on tour,sharib toshi,,
when is shenandoah playing next in Yanman,shenandoah,Yanman,
when is sixth next show,sixth,,
when is sixth next show in that,sixth,that,
when is sixth one performing in Phoenix Arizona,sixth one,Phoenix Arizona,
when is sonny terry playing Virugavur,sonny terry,Virugavur,
when is spandau ballet in ninth one,spandau ballet,ninth one,
when is stars on tour,stars,,
when is tenth on tour,tenth,,
when is tenth one in the sixth,tenth one,the sixth,
when is tenth one on tour,tenth one,,
when is tenth one s next tour,tenth one,,
when is thalía touring,thalía,,
when is that artist next show in Drawsko Pomorskie,that artist,Drawsko Pomorskie,
when is that artist tour,that artist,,
when is that musician in Björketorp Sweden,that musician,Björketorp Sweden,
when is that singer next show,that singer,,
when is the adriana caselotti concert,adriana caselotti,,
when is the arijit singh show,arijit singh,,
when is the boys noize show,boys noize,,
when is the canadian tenors next tour,the canadian tenors,,
when is the concert in Ilha das Flores,,Ilha das Flores,
when is the concert in Lone Tree United States of America,,Lone Tree United States of America,
when is the concert in last,,last,
when is the country dance kings show in Kovach,the country dance kings,Kovach,
when is the eighth one show,eighth one,,
when is the first in Jongphohate Arunachal Pradesh,the first,Jongphohate Arunachal Pradesh,
when is the first show in the fourth,the first,the fourth,
when is the fourth in seventh one,the fourth,seventh one,
when is the helene bøksle show,helene bøksle,,
