MusicPlayResponse,MusicPlaySongAlbum,MusicPlayAlbumArtist,MusicPlayAlbumArtistSong,MusicPlaySong,MusicPlayArtist,MusicPlayAlbum,MusicPlayCollection,MusicPlayGenre,MusicPlayMood,MusicPlayEra,MusicPlayKeyword,MusicPlayNew,MusicPlaySimilar
play hello friday feat jason derulo by band,hello friday feat jason derulo,,,,band,,,,,,,,
play henrique juliano s go out,,,,go out,henrique juliano,,,,,,,,
play hervé s smack that bitch,,,,smack that bitch,hervé,,,,,,,,
play hiatus kaiyote s ninth one,,,,ninth one,hiatus kaiyote,,,,,,,,
play hillbilly bone feat trace adkins by macaco,,,,hillbilly bone feat trace adkins,macaco,,,,,,,,
play hit crew masters s a mess of blues,,,,a mess of blues,hit crew masters,,,,,,,,
play hits by nada surf,,,,,nada surf,,,,,,,,
play hold the heater,,,,hold the heater,,,,,,,,,
play hollow moon bad wolf by boomerang,,,,hollow moon bad wolf,boomerang,,,,,,,,
play home we'll go by claudio baglioni,,,,home we'll go,claudio baglioni,,,,,,,,
play homesick special edition,,,homesick special edition,,,,,,,,,,
play honey for the bees 2016 remastered,,,,honey for the bees 2016 remastered,,,,,,,,,
play honey love r kelly and public announcement,,,,honey love r kelly and public announcement,,,,,,,,,
play hooverphonic,,,,,hooverphonic,,,,,,,,
play horse of a different color by frank sinatra,,,,,frank sinatra,horse of a different color,,,,,,,
play hosanna by trans-siberian orchestra,,,,hosanna,trans-siberian orchestra,,,,,,,,
play how great is our god 2006 gma music awards performance,,,,,,how great is our god 2006 gma music awards performance,,,,,,,
play how to hate,,,,how to hate,,,,,,,,,
play how to save a life live by ricky skaggs,how to save a life live,,,,ricky skaggs,,,,,,,,
play howard shore s the third,,,,the third,howard shore,,,,,,,,
play hugh masekela song called fake lit,,,,fake lit,hugh masekela,,,,,,,,
play humble and kind by ted nugent,humble and kind,,,,ted nugent,,,,,,,,
play hustler musik by buckethead,hustler musik,,,,buckethead,,,,,,,,
play i always liked that by dimitri vangelis wyman,,,,,dimitri vangelis wyman,i always liked that,,,,,,,
play i believe in the man in the sky by susan tedeschi,,,,i believe in the man in the sky,susan tedeschi,,,,,,,,
play i can hear music 2001 - remaster by bobby brackins,i can hear music 2001 - remaster,,,,bobby brackins,,,,,,,,
play i can only imagine - the original accompaniment track as performed by mercyme by edoardo bennato,i can only imagine - the original accompaniment track as performed by mercyme,,,,edoardo bennato,,,,,,,,
play i don't wanna be sad by the brian setzer orchestra,,,,i don't wanna be sad,the brian setzer orchestra,,,,,,,,
play i go to extremes by patsy cline,,,,i go to extremes,patsy cline,,,,,,,,
play i gotta be by anthony callea,,,,i gotta be,anthony callea,,,,,,,,
play i knew you were trouble by billy idol,i knew you were trouble,,,,billy idol,,,,,,,,
play i know i'm not wrong 2015 remastered by papon,,,,i know i'm not wrong 2015 remastered,papon,,,,,,,,
play i need your love by girls generation,,,,,girls generation,i need your love,,,,,,,
play i should live in salt by petter,i should live in salt,,,,petter,,,,,,,,
play i slept with someone in fall out boy and all i got was this stupid song written about me by fall out boy,,,,,,,,,,,,,
play i slept with someone in fall out boy and all i got was this stupid song written about me by fall out boy,,,,,,,,,,,,,
play i'll stay me by darren hayes,i'll stay me,,,,darren hayes,,,,,,,,
play i'm back by cheap trick,i'm back,,,,cheap trick,,,,,,,,
play i'm on one by jonas blue,,,,i'm on one,jonas blue,,,,,,,,
play i've had the time of my life by finger eleven,,,,i've had the time of my life,finger eleven,,,,,,,,
play iamx,,,,,iamx,,,,,,,,
play icona pop s the dignity of labour part 3,,,,the dignity of labour part 3,icona pop,,,,,,,,
play identity disorder by spike jones,identity disorder,,,,spike jones,,,,,,,,
play idlewild blue don'tchu worry bout me main version - clean by pur,,,,idlewild blue don'tchu worry bout me main version - clean,pur,,,,,,,,
play if i die tonight by bruce hornsby,,,,if i die tonight,bruce hornsby,,,,,,,,
play if i don't know by artist,,,,if i don't know,artist,,,,,,,,
play if i lost you by mike posner,,,,if i lost you,mike posner,,,,,,,,
play if i should die before i wake feat black rob ice cube beanie sigel by the cranberries,if i should die before i wake feat black rob ice cube beanie sigel,,,,the cranberries,,,,,,,,
play if you wait by soko,,,,,soko,if you wait,,,,,,,
play in the air tonight live,,,,in the air tonight live,,,,,,,,,
play in the river by bone thugs-n-harmony,,,,,bone thugs-n-harmony,in the river,,,,,,,
play indiana s gave it all,,,,gave it all,indiana,,,,,,,,
play inferno original motion picture soundtrack,,,,,,inferno original motion picture soundtrack,,,,,,,
play innerspeaker by natalie cole,innerspeaker,,,,natalie cole,,,,,,,,
play insane in the brain by the brian jonestown massacre,insane in the brain,,,,the brian jonestown massacre,,,,,,,,
play instrumental hip hop beats crew s d g i f u,,,,d g i f u,instrumental hip hop beats crew,,,,,,,,
play interpol,,,,,interpol,,,,,,,,
play intocable s change your life,,,,change your life,intocable,,,,,,,,
play islah by method man,,,,,method man,islah,,,,,,,
play israel new breed hits,,,,,israel new breed,,,,,,,,
play it,,,,,it,,,,,,,,
play it had better be tonight meglio stasera by him,,,,it had better be tonight meglio stasera,him,,,,,,,,
play it s a man s man s man s world glee cast version by second one,,,,,second one,it s a man s man s man s world glee cast version,,,,,,,
play it s a sin 2001 remastered version by her,,,,it s a sin 2001 remastered version,her,,,,,,,,
play iz u down by asta,,,,iz u down,asta,,,,,,,,
play jack savoretti s why go,,,,why go,jack savoretti,,,,,,,,
play jacky cheung s in between live from paris 2008,,,,in between live from paris 2008,jacky cheung,,,,,,,,
play jain band,,,,,jain,,,,,,,,
play jan werner danielsen s immigrant remastered version,,,,immigrant remastered version,jan werner danielsen,,,,,,,,
play jar of hearts glee cast version by the ninth,,,,,the ninth,jar of hearts glee cast version,,,,,,,
play jason crabb s homie lover friend,,,,homie lover friend,jason crabb,,,,,,,,
play jason gray s don't trip feat ice cube dr dre will i am,,,,don't trip feat ice cube dr dre will i am,jason gray,,,,,,,,
play jatin-lalit,,,,,jatin-lalit,,,,,,,,
play jay sean s you against you,,,,you against you,jay sean,,,,,,,,
play jay-z unplugged by motörhead,,,,,motörhead,jay-z unplugged,,,,,,,
play jidenna,,,,,jidenna,,,,,,,,
play jo stafford song called long legged girl with the short dress on,,,,long legged girl with the short dress on,jo stafford,,,,,,,,
play joan of arc,,,,joan of arc,,,,,,,,,
play joe s alice,,,,alice,joe,,,,,,,,
play john williamson album seventh one,,,,,john williamson,seventh one,,,,,,,
play joy of the lord,,,,joy of the lord,,,,,,,,,
play joyride omen,,,,joyride omen,,,,,,,,,
play juicy by bebe cece winans,,,,juicy,bebe cece winans,,,,,,,,
play jukebox junction,,,,,jukebox junction,,,,,,,,
play julio bashmore s last beautiful girl,,,,last beautiful girl,julio bashmore,,,,,,,,
play julio iglesias,,,,,julio iglesias,,,,,,,,
play junkie xl,,,,,junkie xl,,,,,,,,
play just like fire from the original motion picture alice through the looking glass by eighth one,,,,,eighth one,just like fire from the original motion picture alice through the looking glass,,,,,,,
play just who i am poets pirates by the third,just who i am poets pirates,,,,the third,,,,,,,,
play juvenile band,,,,,juvenile,,,,,,,,
play jørn hoel,,,,,jørn hoel,,,,,,,,
play k j yesudas s last,,,,last,k j yesudas,,,,,,,,
play karen harding,,,,,karen harding,,,,,,,,
play keen'v s backs to the wall live in chicago,,,,backs to the wall live in chicago,keen'v,,,,,,,,
play keep watch,,,,keep watch,,,,,,,,,
play keith kristyn getty,,,,,keith kristyn getty,,,,,,,,
play kelly clarkson s eighth,,,,eighth,kelly clarkson,,,,,,,,
play khia s eighth,,,,eighth,khia,,,,,,,,
play kick in the door 2014 remastered version,,,,kick in the door 2014 remastered version,,,,,,,,,
play kids by mindless behavior,,,,,mindless behavior,kids,,,,,,,
play kiiara s honeymoon,,,,honeymoon,kiiara,,,,,,,,
play kim burrell,,,,,kim burrell,,,,,,,,
play kingdom come s silver bells feat naturally 7 bonus track,,,,silver bells feat naturally 7 bonus track,kingdom come,,,,,,,,
play kishi bashi,,,,,kishi bashi,,,,,,,,
play kisses down low by liza minnelli,,,,kisses down low,liza minnelli,,,,,,,,
play kmfdm,,,,,kmfdm,,,,,,,,
play knife party s moving mountains pokerface remix,,,,moving mountains pokerface remix,knife party,,,,,,,,
play korean radio hits,,,,,,,,korean,,,,,
play krept and konan,,,,,krept and konan,,,,,,,,
play krewella s the fifth,,,,the fifth,krewella,,,,,,,,
play kris kross s summer wind,,,,summer wind,kris kross,,,,,,,,
play kstylis,,,,,kstylis,,,,,,,,
play la lista,,,,la lista,,,,,,,,,
play la maquinaria norteña s last,,,,last,la maquinaria norteña,,,,,,,,
play lagaan original motion picture soundtrack by mew,,,,,mew,lagaan original motion picture soundtrack,,,,,,,
play lamb of god by abba,lamb of god,,,,abba,,,,,,,,
play lamb of god by jack ü,,,,lamb of god,jack ü,,,,,,,,
play landslide live,,,,landslide live,,,,,,,,,
play larry hernández,,,,,larry hernández,,,,,,,,
play last kiss by this band,,,,last kiss,this band,,,,,,,,
play last one,,,,,last one,,,,,,,,
play last one,,,,last one,,,,,,,,,
play last one s when will i be loved,,,,when will i be loved,last one,,,,,,,,
play last s self-titled album,,,,,,last,,,,,,,
play lateef the truthspeaker s blood remastered,,,,blood remastered,lateef the truthspeaker,,,,,,,,
play latin band s i'm still here,,,,i'm still here,latin band,,,,,,,,
play lauv song called team,,,,team,lauv,,,,,,,,
play le bagad de lann-bihoué live,,,,le bagad de lann-bihoué live,,,,,,,,,
play len s born again intro 2016 remastered,,,,born again intro 2016 remastered,len,,,,,,,,
play let it go,,,let it go,,,,,,,,,,
play levels by hannah montana,levels,,,,hannah montana,,,,,,,,
play life of the party by third one,,,,life of the party,third one,,,,,,,,
play like a rolling stone from en sinnsykt godt stekt pizza,,en sinnsykt godt stekt pizza,,like a rolling stone,,,,,,,,,
play lily madeleine,,,,,lily madeleine,,,,,,,,
play linnea henriksson s fourth one,,,,fourth one,linnea henriksson,,,,,,,,
play lion by kt tunstall,,,,lion,kt tunstall,,,,,,,,
play lisa ekdahl s stairway to heaven,,,,stairway to heaven,lisa ekdahl,,,,,,,,
play lisa stokke latest track,,,,,lisa stokke,,,,,,,latest,
play listen by jenni rivera,,,,,jenni rivera,listen,,,,,,,
play lita ford s sixth,,,,sixth,lita ford,,,,,,,,
play little swing by klingande,,,,,klingande,little swing,,,,,,,
play live by ronnie dunn,,,,,ronnie dunn,live,,,,,,,
play live from austin music hall by triumph,,,,,triumph,live from austin music hall,,,,,,,
play liz phair last album,,,,,liz phair,,,,,,,last,
play locash s second one,,,,second one,locash,,,,,,,,
play looking for you by roscoe dash,,,,looking for you,roscoe dash,,,,,,,,
play looks like sex by tommy trash,looks like sex,,,,tommy trash,,,,,,,,
play lost in the echo,,,,lost in the echo,,,,,,,,,
play loud clear by kensington,,,,loud clear,kensington,,,,,,,,
play lounge music the must have selection vol 3 the finest music selection deep house trip hop downtempo cool tempo lounge electro by ivete sangalo,,,,,ivete sangalo,lounge music the must have selection vol 3 the finest music selection deep house trip hop downtempo cool tempo lounge electro,,,,,,,
play love and war by glenn frey,,,,,glenn frey,love and war,,,,,,,
play love don't let me go,,,love don't let me go,,,,,,,,,,
play love me like you by he,love me like you,,,,he,,,,,,,,
play love to lay by the ninth,,,,love to lay,the ninth,,,,,,,,
play low s johnny cash,,,,johnny cash,low,,,,,,,,
play lucio dalla s need you now,,,,need you now,lucio dalla,,,,,,,,
play lucky ass bitch,,,,,,lucky ass bitch,,,,,,,
play lullabies for my kids,,,,,,,,,,,lullabies,,
play lullabies for my kids,,,,,,,,,,,lullabies,,
play lullabies for my kids,,,,,,,,,,,lullabies,,
play lullabies for my kids,,,,,,,,,,,lullabies,,
play machine gun kelly waka flocka flame s tear in my heart,,,,tear in my heart,machine gun kelly waka flocka flame,,,,,,,,
play machine head s we run the night,,,,we run the night,machine head,,,,,,,,
play madder by hellyeah,madder,,,,hellyeah,,,,,,,,
play made of scars,,,,made of scars,,,,,,,,,
play magic by korpiklaani,,,,,korpiklaani,magic,,,,,,,
play man on the moon ii the legend of mr rager by rufus wainwright,,,,,rufus wainwright,man on the moon ii the legend of mr rager,,,,,,,
play marea,,,,,marea,,,,,,,,
play mark knopfler s gold dust woman remastered version,,,,gold dust woman remastered version,mark knopfler,,,,,,,,
play mark mothersbaugh s the story of us,,,,the story of us,mark mothersbaugh,,,,,,,,
play mark of the blade by third one,,,,,third one,mark of the blade,,,,,,,
play mary did you know,,,,mary did you know,,,,,,,,,
play mary j blige s boom explicit version,,,,boom explicit version,mary j blige,,,,,,,,
play matt cardle s seventh one,,,,seventh one,matt cardle,,,,,,,,
play matt houston s the seventh,,,,the seventh,matt houston,,,,,,,,
play maurizio pollini s harvey two-face,,,,harvey two-face,maurizio pollini,,,,,,,,
play max manie s oxygene pt 6,,,,oxygene pt 6,max manie,,,,,,,,
play may s happy little pill,,,,happy little pill,may,,,,,,,,
play mayhem s cold,,,,cold,mayhem,,,,,,,,
play me i am mariah the elusive chanteuse by harold faltermeyer,me i am mariah the elusive chanteuse,,,,harold faltermeyer,,,,,,,,
play me some folk tunes,,,,,,,,folk,,,,,
play me some hits from the 1940s,,,,,,,,,,1940s,,,
play me some soul tunes,,,,,,,,soul,,,,,
play me the album dr hook - the best of by dawes,,,,,dawes,dr hook - the best of,,,,,,,
play me the album greatest hits by morphine,,,,,morphine,greatest hits,,,,,,,
play me the album made in heaven by byting,,,,,byting,made in heaven,,,,,,,
play me the album this album by alina baraz,,,,,alina baraz,this album,,,,,,,
play me the album tie it up by patton oswalt,,,,,patton oswalt,tie it up,,,,,,,
play me the rhythm by bunbury,,,,,bunbury,me the rhythm,,,,,,,
play me the song no where to hide,,,,no where to hide,,,,,,,,,
play me the track kiss me,,,,kiss me,,,,,,,,,
play me your best indian pop,,,,,,,,indian pop,,,,,
play meredith brooks s the fourth,,,,the fourth,meredith brooks,,,,,,,,
play merengue tunes from 90s,,,,,,,,merengue,,90s,,,
play merry christmas baby mastering 2011 by m pokora,merry christmas baby mastering 2011,,,,m pokora,,,,,,,,
play meurtre par strangulation by muddy waters,,,,,muddy waters,meurtre par strangulation,,,,,,,
play mf doom s interlude,,,,interlude,mf doom,,,,,,,,
play miami,,,,miami,,,,,,,,,
play michel sardou,,,,,michel sardou,,,,,,,,
play migos s voices,,,,voices,migos,,,,,,,,
play miguel bosé s war pigs,,,,war pigs,miguel bosé,,,,,,,,
play mike mago s leave me alone 2012 remaster,,,,leave me alone 2012 remaster,mike mago,,,,,,,,
play mikky ekko,,,,,mikky ekko,,,,,,,,
play miles kane s low,,,,low,miles kane,,,,,,,,
play military wives s red red wine 12 version,,,,red red wine 12 version,military wives,,,,,,,,
play missin you by mayfair philharmonic orchestra,,,,missin you,mayfair philharmonic orchestra,,,,,,,,
play mkto by woody guthrie,,,,,woody guthrie,mkto,,,,,,,
play modern talking,,,,,modern talking,,,,,,,,
play moguai s tenement funster,,,,tenement funster,moguai,,,,,,,,
play moonshine in the trunk,,,,,,moonshine in the trunk,,,,,,,
play motorcycle,,,,,motorcycle,,,,,,,,
play mount kimbie s jesus,,,,jesus,mount kimbie,,,,,,,,
play mozart variations on sonata k331 by headhunterz,,,,mozart variations on sonata k331,headhunterz,,,,,,,,
play mr brightside by their,,,,,their,mr brightside,,,,,,,
play mr johnson by the last,,,,mr johnson,the last,,,,,,,,
play mr pitiful by bob luman,mr pitiful,,,,bob luman,,,,,,,,
play mrs robinson album version by second,mrs robinson album version,,,,second,,,,,,,,
play multiply by them,,,,,them,multiply,,,,,,,
play music,,,,,,,,,,,,,
play music by jack white artist,,,,,jack white,,,,,,,,
play music by the band falco,,,,,falco,,,,,,,,
play music for a kid s party,,,,,,,,,,,kid s party,,
play music for studying,,,,,,,,,,,studying,,
play music for studying,,,,,,,,,,,studying,,
play music for studying,,,,,,,,,,,studying,,
play music for studying,,,,,,,,,,,studying,,
play music for studying,,,,,,,,,,,studying,,
play music from the album atlantic crossing by this musician,,,,,this musician,atlantic crossing,,,,,,,
play music from the album nasty freestyle by ben rector,,,,,ben rector,nasty freestyle,,,,,,,
play music from the album old by dru hill,,,,,dru hill,old,,,,,,,
play music from the album the second,,,,,,the second,,,,,,,
play music from the album ultimate dolly parton,,,,,,ultimate dolly parton,,,,,,,
play music from the clumsy soundtrack,,,,,,clumsy,,,,,,,
play music from the unknown mahogany session soundtrack,,,,,,unknown mahogany session,,,,,,,
play music like madeon,,,,,madeon,,,,,,,,like
play music like passion,,,,,passion,,,,,,,,like
play music like seventh,,,,,seventh,,,,,,,,like
play music like this musician,,,,,this musician,,,,,,,,like
play music similar to dashboard confessional,,,,,dashboard confessional,,,,,,,,similar
play mutual benefit s falling into you,,,,falling into you,mutual benefit,,,,,,,,
play my 90s r&b mix,,,,,,,90s r&b,,,,,,
play my demons,,,,my demons,,,,,,,,,
play my feel good music,,,,,,,feel good,,,,,,
play my funky collection,,,,,,,funky,,,,,,
play my girl power mix,,,,,,,girl power,,,,,,
play my greatest hits from the 80s mix,,,,,,,greatest hits from the 80s,,,,,,
play my house the soundtrack,,,,,,my house,,,,,,,
play my kinky mix,,,,,,,kinky,,,,,,
play my last mix,,,,,,,last,,,,,,
play my prerogative by tower of power,,,,my prerogative,tower of power,,,,,,,,
play my pumped up collection,,,,,,,pumped up,,,,,,
play my throwback playlist,,,,,,,throwback,,,,,,
play my way feat monty,,,,my way feat monty,,,,,,,,,
play n o r e,,,,,n o r e,,,,,,,,
play n w a greatest hits world by getter,,,,,getter,n w a greatest hits world,,,,,,,
play nathan lane,,,,,nathan lane,,,,,,,,
play naughty by nature s landscape remastered,,,,landscape remastered,naughty by nature,,,,,,,,
play nearer my god to thee,,,,nearer my god to thee,,,,,,,,,
play neo-soul from the 80s,,,,,,,,neo-soul,,80s,,,
play neutral milk hotel s long long winter,,,,long long winter,neutral milk hotel,,,,,,,,
play never be alone,,,,never be alone,,,,,,,,,
play never change by young the giant,,,,never change,young the giant,,,,,,,,
play never shout never,,,never shout never,,,,,,,,,,
play new love by hervé,,,,new love,hervé,,,,,,,,
play new mohd rafi,,,,,mohd rafi,,,,,,,new,
play new navy,,,,,new navy,,,,,,,,
play new skylar grey,,,,,skylar grey,,,,,,,new,
play new thang by tokio hotel,,,,,tokio hotel,new thang,,,,,,,
play new the sixth,,,,,the sixth,,,,,,,new,
play new tunes from karthik,,,,,karthik,,,,,,,new,
play newt says goodbye to tina jacob s bakery,,,,newt says goodbye to tina jacob s bakery,,,,,,,,,
play next go round by jim croce,,,,next go round,jim croce,,,,,,,,
play ni as in paris by steve grand,,,,ni as in paris,steve grand,,,,,,,,
play nichole nordeman,,,,,nichole nordeman,,,,,,,,
play nikita,,,,,nikita,,,,,,,,
play ninth,,,,ninth,,,,,,,,,
play ninth,,,,ninth,,,,,,,,,
play ninth,,,,,ninth,,,,,,,,
play ninth,,,,,,ninth,,,,,,,
play ninth by love the way you lie,,,,ninth,love the way you lie,,,,,,,,
play ninth by olivia holt,,,,,olivia holt,ninth,,,,,,,
play ninth by sixth one,,,,ninth,sixth one,,,,,,,,
play ninth one,,,,,ninth one,,,,,,,,
play ninth one,,,,,ninth one,,,,,,,,
play ninth one by apache indian,,,,ninth one,apache indian,,,,,,,,
play ninth one by band,,,,ninth one,band,,,,,,,,
play ninth one by craig mack,,,,ninth one,craig mack,,,,,,,,
play ninth one by mary costa,,,,ninth one,mary costa,,,,,,,,
play ninth one from nino d'angelo,,nino d'angelo,,ninth one,,,,,,,,,
play ninth one s badge and gun album version,,,,badge and gun album version,ninth one,,,,,,,,
play ninth s grrrr,,,,grrrr,ninth,,,,,,,,
play ninth s i m the best,,,,i m the best,ninth,,,,,,,,
play ninth s the last,,,,the last,ninth,,,,,,,,
play no days off feat monty by current singer,,,,no days off feat monty,current singer,,,,,,,,
play no more sad songs,,,,no more sad songs,,,,,,,,,
play no need to argue,,,,,,no need to argue,,,,,,,
play nobody feat athena cage remastered single version,,,,nobody feat athena cage remastered single version,,,,,,,,,
play nobody s fault but mine by fifth one,,,,nobody s fault but mine,fifth one,,,,,,,,
play not 4 sale by patrick hawes,,,,,patrick hawes,not 4 sale,,,,,,,
play november tale by ashlee simpson,november tale,,,,ashlee simpson,,,,,,,,
play now that s what i call music vol 48 by laurie anderson,,,,,laurie anderson,now that s what i call music vol 48,,,,,,,
play nvrlnd,,,nvrlnd,,,,,,,,,,
play o come all ye faithful,,,o come all ye faithful,,,,,,,,,,
play oddisee s never be like you,,,,never be like you,oddisee,,,,,,,,
play odessa s the first,,,,the first,odessa,,,,,,,,
play of monsters and men,,,,,of monsters and men,,,,,,,,
play of the night by stevie ray vaughan double trouble,,,,of the night,stevie ray vaughan double trouble,,,,,,,,
play oh by freddie hubbard,,,,oh,freddie hubbard,,,,,,,,
play ola nordmann by the sixth,,,,ola nordmann,the sixth,,,,,,,,
play older by ninth,,,,older,ninth,,,,,,,,
play on the road again,,,,on the road again,,,,,,,,,
play one dance by ewan maccoll,,,,one dance,ewan maccoll,,,,,,,,
play one man,,,,one man,,,,,,,,,
play one piece at a time,,,,one piece at a time,,,,,,,,,
play only you,,,,only you,,,,,,,,,
play otto knows s that girl,,,,that girl,otto knows,,,,,,,,
play outta my head,,,,outta my head,,,,,,,,,
play overdose,,,,overdose,,,,,,,,,
play overdose bonus track by music-themes,,,,overdose bonus track,music-themes,,,,,,,,
play overgrown by bernard herrmann,overgrown,,,,bernard herrmann,,,,,,,,
play p5hng me a wy live in texas,,,,p5hng me a wy live in texas,,,,,,,,,
play panda,,,,panda,,,,,,,,,
play parachute,,,,parachute,,,,,,,,,
play paradise lost band,,,,,paradise lost,,,,,,,,
play paris hilton s damn country music,,,,damn country music,paris hilton,,,,,,,,
play party feat fresh by laura veirs,,,,party feat fresh,laura veirs,,,,,,,,
play past lives,,,,past lives,,,,,,,,,
play patrick bruel s hair of the dog,,,,hair of the dog,patrick bruel,,,,,,,,
play paul anka,,,,,paul anka,,,,,,,,
play paul wilbur,,,paul wilbur,,,,,,,,,,
play pavement,,,,,pavement,,,,,,,,
play peace frog new stereo mix advanced resolution gh edit by jetta,peace frog new stereo mix advanced resolution gh edit,,,,jetta,,,,,,,,
play peanut butter jelly by fifth one,peanut butter jelly,,,,fifth one,,,,,,,,
play pearl jam s album called pearl jam,,,,,,,,,,,,,
play pearl jam s album called pearl jam,,,,,,,,,,,,,
play pearl jam s album called pearl jam,,,,,,,,,,,,,
play pegasus band,,,,,pegasus,,,,,,,,
play perfect by joe dolan,,,,perfect,joe dolan,,,,,,,,
play periphery,,,,,periphery,,,,,,,,
play peter sarstedt s yesterdays,,,,yesterdays,peter sarstedt,,,,,,,,
play petey pablo radio,,,,,petey pablo,,,,,,,,radio
play phillipa soo,,,,,phillipa soo,,,,,,,,
play phish s wouldn't change a thing,,,,wouldn't change a thing,phish,,,,,,,,
play picazzo s the eighth,,,,the eighth,picazzo,,,,,,,,
play pitbull s clued up,,,,clued up,pitbull,,,,,,,,
play poets of the fall,,,,,poets of the fall,,,,,,,,
play pretending glee cast version by second,,,,,second,pretending glee cast version,,,,,,,
play protège moi,,,,protège moi,,,,,,,,,
play punky reggae party by trisha yearwood,,,,punky reggae party,trisha yearwood,,,,,,,,
play pup s track,,,,track,pup,,,,,,,,
play purple swag by their,,,,,their,purple swag,,,,,,,
play put down that weapon 2007 remastered by them,put down that weapon 2007 remastered,,,,them,,,,,,,,
play pyotr ilyich tchaikovsky,,,,,pyotr ilyich tchaikovsky,,,,,,,,
play pyotr ilyich tchaikovsky s chemical prisoner,,,,chemical prisoner,pyotr ilyich tchaikovsky,,,,,,,,
play quit playing games with my heart,,,,quit playing games with my heart,,,,,,,,,
play r&b divas,,,,,,,,,,,r&b divas,,
play r&b divas,,,,,,,,,,,r&b divas,,
play rachel platten,,,,,rachel platten,,,,,,,,
play rack city by winger,rack city,,,,winger,,,,,,,,
play radioactive by jimmy cliff,radioactive,,,,jimmy cliff,,,,,,,,
play rage against the machine s muzzle,,,,muzzle,rage against the machine,,,,,,,,
play rainbow country by abba,,,,rainbow country,abba,,,,,,,,
play randy newman s magic ride,,,,magic ride,randy newman,,,,,,,,
play randy travis s fifth,,,,fifth,randy travis,,,,,,,,
play razor blade by third one,razor blade,,,,third one,,,,,,,,
play reality killed the video star by the album leaf,reality killed the video star,,,,the album leaf,,,,,,,,
play reckless,,,reckless,,,,,,,,,,
play red hot chili peppers by the hit co,red hot chili peppers,,,,the hit co,,,,,,,,
play refused song called frankie fell in love,,,,frankie fell in love,refused,,,,,,,,
play reincarnated deluxe version by asher roth,,,,,asher roth,reincarnated deluxe version,,,,,,,
play renée fleming s numb,,,,numb,renée fleming,,,,,,,,
play rewind feat monty by british sea power,,,,rewind feat monty,british sea power,,,,,,,,
play rhythm city volume one caught up by pierre bachelet,rhythm city volume one caught up,,,,pierre bachelet,,,,,,,,
play ricky van shelton,,,,,ricky van shelton,,,,,,,,
play right where i want you,,,,right where i want you,,,,,,,,,
play rob zombie,,,,,rob zombie,,,,,,,,
