MusicInfoConcertsResponse,MusicInfoConcertsArtist,MusicInfoConcertsLocation,MusicInfoConcertsDate
when is the mario winans show,mario winans,,
when is the next a thousand horses show in Körner,a thousand horses,Körner,
when is the next basto show in sixth one,basto,sixth one,
when is the next billy preston concert in al-Quwaysimah,billy preston,al-Quwaysimah,
when is the next bob evans concert,bob evans,,
when is the next chani gig in ninth,chani,ninth,
when is the next concert in Diloda,,Diloda,
when is the next concert in Los Molles Argentina,,Los Molles Argentina,
when is the next concert in Surazh,,Surazh,
when is the next concert in Tagas,,Tagas,
when is the next concert in Virtsu,,Virtsu,
when is the next concert in Yeşilkaya Turkey,,Yeşilkaya Turkey,
when is the next concert in that location,,that location,
when is the next dinah shore concert in seventh,dinah shore,seventh,
when is the next eighth show,eighth,,
when is the next eighth show in eighth one,eighth,eighth one,
when is the next erasure show,erasure,,
when is the next fifth show,fifth,,
when is the next fourth show in seventh one,fourth,seventh one,
when is the next goran bregovic show,goran bregovic,,
when is the next her show,her,,
when is the next jason mraz gig in Nishikata,jason mraz,Nishikata,
when is the next jesus culture chris quilala show,jesus culture chris quilala,,
when is the next jim jones performance,jim jones,,
when is the next joe concert,joe,,
when is the next johannes brahms show,johannes brahms,,
when is the next juliet simms concert,juliet simms,,
when is the next katzenjammer show in Rapore India,katzenjammer,Rapore India,
when is the next kosheen gig in last,kosheen,last,
when is the next lamb show,lamb,,
when is the next mase show in Miremont,mase,Miremont,
when is the next maze gig in Toralapa Alta,maze,Toralapa Alta,
when is the next mike mohede show,mike mohede,,
when is the next ninth show,ninth,,
when is the next orpheus chamber orchestra show in the ninth,orpheus chamber orchestra,the ninth,
when is the next seventh show,seventh,,
when is the next sixth show,sixth,,
when is the next tenth concert,tenth,,
when is the next that musician show in Kasewa Gambia,that musician,Kasewa Gambia,
when is the next the blues brothers show,the blues brothers,,
when is the next the last concert,the last,,
when is the next the third concert,the third,,
when is the next their show,their,,
when is the next they show,they,,
when is the next this concert in third one,this,third one,
when is the next this musician concert in ninth one,this musician,ninth one,
when is the nicholas hooper concert,nicholas hooper,,
when is the outlaws playing eighth one,the outlaws,eighth one,
when is the robert cray band s next tour,the robert cray band,,
when is the seventh performing in La Chapelle-d'Aurec,the seventh,La Chapelle-d'Aurec,
when is the seventh playing in the last,the seventh,the last,
when is the show coming to the seventh,,the seventh,
when is the show coming to this,,this,
when is the show in seventh,,seventh,
when is the some of that concert,some of that,,
when is the sunny cowgirls touring,the sunny cowgirls,,
when is the tad concert,tad,,
when is the tenth show in that one,the tenth,that one,
when is the the eighth concert,the eighth,,
when is the third in tenth,the third,tenth,
when is the third performing in Ennsdorf Niederösterreich,the third,Ennsdorf Niederösterreich,
when is the three days grace concert,three days grace,,
when is their next perfomance,their,,
when is them next show in West Springfield,them,West Springfield,
when is third coming to fourth one,third,fourth one,
when is third in the second,third,the second,
when is third next perfomance,third,,
when is third one in eighth one,third one,eighth one,
when is third one next gig,third one,,
when is third one show in that location,third one,that location,
when is this artist next show in Thurston,this artist,Thurston,
when is this in fourth one,this,fourth one,
when is this musician performing,this musician,,
when is this musician s Marzāno Khorāsān-e Razavī concert,this musician,Marzāno Khorāsān-e Razavī,
when is this performer on tour,this performer,,
when is this performer touring,this performer,,
when is tim mcgraw s next tour,tim mcgraw,,
when is vintage trouble playing next in Kampur Town Assam,vintage trouble,Kampur Town Assam,
when jamie foxx playing in tenth one,jamie foxx,tenth one,
when panama wedding playing in fifth,panama wedding,fifth,
when s first next concert,first,,
when s the dame concert,dame,,
when s the next concert going to be,,,
when s the next lone concert,lone,,
when s the next mills brothers concert,mills brothers,,
when s the next nick lowe show,nick lowe,,
when s the next show going to be,,,
when s the next show gonna be,,,
when s the next show gonna be,,,
when s the next show gonna be,,,
when s the next that artist show,that artist,,
when s the next that concert,that,,
when s the next that musician show,that musician,,
when s the next this performer show,this performer,,
when s the second one concert,second one,,
when s third next concert,third,,
when spider in second,spider,second,
when tevin campbell in Ottasekharamangalam,tevin campbell,Ottasekharamangalam,
when that band playing in Dakshin Ulladabari India,that band,Dakshin Ulladabari India,
when they playing in Yeşilkaya,they,Yeşilkaya,
when will joe satriani be playing in fifth one,joe satriani,fifth one,
when will jovanotti have a concert in Möhnesee,jovanotti,Möhnesee,
when will klingande have a concert in Cizos,klingande,Cizos,
when will sunrise avenue be playing in Phoenix United States of America,sunrise avenue,Phoenix United States of America,
when zion i in the sixth,zion i,the sixth,
where adrian lux playing next,adrian lux,,
where are artist playing,artist,,
where are breaking benjamin touring right now,breaking benjamin,,
where are greatest christmas songs and 1 favourite christmas music for kids touring right now,greatest christmas songs and 1 favourite christmas music for kids,,
where are randy newman performing,randy newman,,
where are sixth performing,sixth,,
where are statler brothers next showsâ,statler brothers,,
where are tal bachman next showsâ,tal bachman,,
where are the alonzo playing next,alonzo,,
where are the d d e playing next,d d e,,
where are the stooges next showsâ,the stooges,,
where are they touring right now,they,,
where are touché amoré touring right now,touché amoré,,
where can i see body head bangerz in concert,body head bangerz,,
where can i see device perform,device,,
where can i see fluke perform,fluke,,
where can i see lowkey perform,lowkey,,
where can i see luis miguel live,luis miguel,,
where can i see patton oswalt in concert,patton oswalt,,
where can i see robert plant in concert,robert plant,,
where can i see that artist perform,that artist,,
where can i see the coronas in concert,the coronas,,
where can i see the first perform,the first,,
where can i see the third in concert,the third,,
where can i see third one perform,third one,,
where can i see top 40 pop hits perform,top 40 pop hits,,
where is alela diane performing at,alela diane,,
where is amalia rodrigues next gig,amalia rodrigues,,
where is barrington levy playing,barrington levy,,
where is bethel music kids going on tour,bethel music kids,,
where is big mountain touring,big mountain,,
where is btob playing,btob,,
where is christmas touring,christmas,,
where is daddy cool going on tour,daddy cool,,
where is dance with a stranger next concert,dance with a stranger,,
where is daya touring,daya,,
where is dexter gordon touring,dexter gordon,,
where is dexys midnight runners next concert location,dexys midnight runners,,
where is eighth going on tour,eighth,,
where is eric donaldson performing at,eric donaldson,,
where is fifth playing,fifth,,
where is first performing next,first,,
where is first playing,first,,
where is gary barlow the commonwealth band singing tonight in Semwali Tanzania,gary barlow the commonwealth band,Semwali Tanzania,
where is hanne krogh playing,hanne krogh,,
where is hiatus kaiyote touring next,hiatus kaiyote,,
where is him going on tour,him,,
where is him touring next,him,,
where is his performing next,his,,
where is it next concert location,it,,
where is it touring,it,,
where is jakarta going on tour,jakarta,,
where is jurassic 5 next show,jurassic 5,,
where is kaja gunnufsen performing next,kaja gunnufsen,,
where is karaoke all hits singing tonight in this,karaoke all hits,this,
where is kleerup touring next,kleerup,,
where is krokus performing,krokus,,
where is michael bubble next gig,michael bubble,,
where is michael giacchino performing,michael giacchino,,
where is michael schenker group going on tour,michael schenker group,,
where is musique classique next concert,musique classique,,
where is mychael danna performing next,mychael danna,,
where is nick lachey performing next,nick lachey,,
where is pittsburgh symphony orchestra performing next,pittsburgh symphony orchestra,,
where is rainhard fendrich touring,rainhard fendrich,,
where is second touring,second,,
where is seventh one going on tour,seventh one,,
where is sin bandera show,sin bandera,,
where is sixth one next concert,sixth one,,
where is skindred touring,skindred,,
where is teddy pendergrass touring,teddy pendergrass,,
where is tenth one performing at,tenth one,,
where is tenth performing next,tenth,,
where is that performer performing next,that performer,,
where is that singer performing next,that singer,,
where is the dogs going on tour,the dogs,,
where is the first playing next,the first,,
where is the fourth going on tour,the fourth,,
where is the nearest concert,,,
where is the nearest concert,,,
where is the next anup jalota show,anup jalota,,
where is the next bodyrockers show,bodyrockers,,
where is the next carlos santana concert,carlos santana,,
where is the next concert,,,
where is the next concert,,,
where is the next crossfaith show,crossfaith,,
where is the next eighth one show,eighth one,,
where is the next he concert,he,,
where is the next industria del amor concert,industria del amor,,
where is the next keith whitley concert,keith whitley,,
where is the next old skool r b masters show,old skool r b masters,,
where is the next renée elise goldsberry concert,renée elise goldsberry,,
where is the next second one show,second one,,
where is the next show going to be,,,
where is the next singer show,singer,,
where is the next the second concert,the second,,
where is the next this artist show,this artist,,
where is the next vnv nation show,vnv nation,,
where is the seventh next show,the seventh,,
where is the show,,,
where is the show,,,
where is the show,,,
where is the show,,,
where is the show,,,
where is the show,,,
where is the tenth touring,the tenth,,
where is the that concert in Raúl Silva Henríquez,that,Raúl Silva Henríquez,
where is the the sixth concert in Santa María del Berrocal Spain,the sixth,Santa María del Berrocal Spain,
where is thefatrat going on tour,thefatrat,,
where is there a charles billingsley concert,charles billingsley,,
where is there a erroll garner concert,erroll garner,,
where is there a sonique concert,sonique,,
where is they performing next,they,,
where is they playing tonight in the ninth,they,the ninth,
where is third going on tour,third,,
where is third one going on tour,third one,,
where is this artist touring,this artist,,
where is thrice touring,thrice,,
where is toni childs performing at,toni childs,,
where is young franco singing tonight in Todorin Do,young franco,Todorin Do,
where jermaine dupri performing at,jermaine dupri,,
where l e j playing at,l e j,,
where s christmas party songs next show at,christmas party songs,,
where s israel houghton new breed playing,israel houghton new breed,,
where s jungle playing next,jungle,,
where s lady gaga r kelly next show at,lady gaga r kelly,,
where s living colour next show at,living colour,,
where s mark mancina playing at,mark mancina,,
where s ninth one next show at,ninth one,,
where s second next show at,second,,
where s the concert gonna be,,,
where s the concert gonna be,,,
where s the eighth concert,eighth,,
where s the next aaron shust show,aaron shust,,
where s the next alexis fido show,alexis fido,,
where s the next gig at,,,
where s the next gig at,,,
where s the next harts concert gonna be,harts,,
where s the next her concert,her,,
where s the next his concert,his,,
where s the next movie sounds unlimited concert,movie sounds unlimited,,
where s the next running wild show,running wild,,
where s the next show going to be,,,
where s the next susanne sundfør concert,susanne sundfør,,
where s the next that singer show,that singer,,
where s the next this artist show,this artist,,
where s the next yo yo honey singh show,yo yo honey singh,,
where s the tenth playing at,the tenth,,
where seventh performing at,seventh,,
where the fourth playing next,the fourth,,
where this performing at,this,,
where will a ap mob be playing in october,a ap mob,,
where will that artist be playing in october,that artist,,
where will the eighth be playing in october,the eighth,,
where will the fifth be playing in october,the fifth,,
which bands are in Bani Burkina Faso,,Bani Burkina Faso,
which bands are in Renco Mine,,Renco Mine,
which bands are in eighth one,,eighth one,
which cities will chesney hawkes play,chesney hawkes,,
which cities will first play,first,,
which cities will that musician play,that musician,,
which dates is alkaline trio performing in Rouffignac,alkaline trio,Rouffignac,
which dates is us the duo performing in Marzāno Iran,us the duo,Marzāno Iran,
which dates will local natives play in Bhadbhut,local natives,Bhadbhut,
which dates will sleeping giant play in the sixth,sleeping giant,the sixth,
will beatrice egli play Bitare Kigoma,beatrice egli,Bitare Kigoma,
will bellamy brothers play in first,bellamy brothers,first,
will gareth emery perform in Macuelizo Honduras,gareth emery,Macuelizo Honduras,
will pharrell williams play in Goryachevodskiy,pharrell williams,Goryachevodskiy,
will smallpools perform in this,smallpools,this,
will the band be coming to the eighth,band,the eighth,
will the blue rubatos play in second one,the blue rubatos,second one,
will the cheryl be coming to sixth,cheryl,sixth,
will the fourth play Cizos France,the fourth,Cizos France,
will this performer come to Cham Dungara Timta India,this performer,Cham Dungara Timta India,
