MusicPlayResponse,MusicPlaySongAlbum,MusicPlayAlbumArtist,MusicPlayAlbumArtistSong,MusicPlaySong,MusicPlayArtist,MusicPlayAlbum,MusicPlayCollection,MusicPlayGenre,MusicPlayMood,MusicPlayEra,MusicPlayKeyword,MusicPlayNew,MusicPlaySimilar
play the latest album of toto,,,,,toto,,,,,,,latest,
play the latest amos lee album,,,,,amos lee,,,,,,,latest,
play the latest morning parade album,,,,,morning parade,,,,,,,latest,
play the latest single from juvenile,,,,,juvenile,,,,,,,latest,
play the latest single from kenny chesney,,,,,kenny chesney,,,,,,,latest,
play the life of pablo by raul malo,,,,,raul malo,the life of pablo,,,,,,,
play the mahendra kapoor artist,,,,,mahendra kapoor,,,,,,,,
play the man who sold the world 1997 remastered version by the first,the man who sold the world 1997 remastered version,,,,the first,,,,,,,,
play the moody blues hits,,,,,the moody blues,,,,,,,,
play the musician tenth,,,,,tenth,,,,,,,,
play the musician zoom karaoke,,,,,zoom karaoke,,,,,,,,
play the new original motion picture soundtrack song,,,,,original motion picture soundtrack,,,,,,,new,
play the new sixth album,,,,,sixth,,,,,,,new,
play the new song by candy dulfer,,,,,candy dulfer,,,,,,,new,
play the new song by fais,,,,,fais,,,,,,,new,
play the new song by gallows,,,,,gallows,,,,,,,new,
play the new song by jls,,,,,jls,,,,,,,new,
play the new song by little texas,,,,,little texas,,,,,,,new,
play the new top 40 album,,,,,top 40,,,,,,,new,
play the newest song from alfie boe,,,,,alfie boe,,,,,,,newest,
play the night before life goes on,,,,the night before life goes on,,,,,,,,,
play the night is still young by susanne sundfør,,,,the night is still young,susanne sundfør,,,,,,,,
play the night josh tillman came to our apt by air supply,,,,the night josh tillman came to our apt,air supply,,,,,,,,
play the ninth,,,,the ninth,,,,,,,,,
play the ninth by buffy sainte-marie,,,,the ninth,buffy sainte-marie,,,,,,,,
play the ninth by dr hook the medicine show,,,,,dr hook the medicine show,the ninth,,,,,,,
play the nitty gritty dirt band s mysterious girl,,,,mysterious girl,the nitty gritty dirt band,,,,,,,,
play the overtones,,,,,the overtones,,,,,,,,
play the oxford trinity choir s big fat bass,,,,big fat bass,the oxford trinity choir,,,,,,,,
play the past the present the future by hardwell armin van buuren,the past the present the future,,,,hardwell armin van buuren,,,,,,,,
play the path that divides,,,,the path that divides,,,,,,,,,
play the people vs,,,,,,the people vs,,,,,,,
play the pharcyde s trumpets,,,,trumpets,the pharcyde,,,,,,,,
play the pogues strut album,,,,,the pogues,strut,,,,,,,
play the polar express original motion picture soundtrack by sing karaoke sing,the polar express original motion picture soundtrack,,,,sing karaoke sing,,,,,,,,
play the primitives,,,,,the primitives,,,,,,,,
play the r in r b collection volume 1,,,,,,the r in r b collection volume 1,,,,,,,
play the record basil poledouris did called fever,,,,,basil poledouris,fever,,,,,,,
play the record see you again did called high on you,,,,,see you again,high on you,,,,,,,
play the record sonny james did called in the name of love remixes,,,,,sonny james,in the name of love remixes,,,,,,,
play the right time 2016 mono remastered by mahalia,the right time 2016 mono remastered,,,,mahalia,,,,,,,,
play the road and the radio by nick cave the bad seeds,,,,,nick cave the bad seeds,the road and the radio,,,,,,,
play the screaming jets,,,,,the screaming jets,,,,,,,,
play the second,,,,the second,,,,,,,,,
play the second,,,,the second,,,,,,,,,
play the second by giorgio moroder,,,,,giorgio moroder,the second,,,,,,,
play the second by them,,,,,them,the second,,,,,,,
play the second s read my mind,,,,read my mind,the second,,,,,,,,
play the second the album by skylar grey,,,,,skylar grey,the second,,,,,,,
play the set the world on fire album,,,,,,set the world on fire,,,,,,,
play the seventh,,,,,,the seventh,,,,,,,
play the seventh by augie march,,,,the seventh,augie march,,,,,,,,
play the seventh by elvis,,,,,elvis,the seventh,,,,,,,
play the seventh one station,,,,,seventh one,,,,,,,,station
play the seventh s heartless,,,,heartless,the seventh,,,,,,,,
play the seventh s hit em up,,,,hit em up,the seventh,,,,,,,,
play the seventh s the lady is a tramp from pal joey,,,,the lady is a tramp from pal joey,the seventh,,,,,,,,
play the show is over by kali uchis,,,,the show is over,kali uchis,,,,,,,,
play the singer alain souchon,,,,,alain souchon,,,,,,,,
play the singer jack jezzro,,,,,jack jezzro,,,,,,,,
play the singer tom misch,,,,,tom misch,,,,,,,,
play the singles 81-85 by caifanes,,,,,caifanes,the singles 81-85,,,,,,,
play the sixth by r kelly,,,,,r kelly,the sixth,,,,,,,
play the song broadway,,,,broadway,,,,,,,,,
play the song lovers in japan,,,,lovers in japan,,,,,,,,,
play the song piece of me remastered,,,,piece of me remastered,,,,,,,,,
play the song that track,,,,that track,,,,,,,,,
play the song the first,,,,the first,,,,,,,,,
play the song thin ice,,,,thin ice,,,,,,,,,
play the song titled shipwreck love,,,,shipwreck love,,,,,,,,,
play the sound of silence overdubbed version track,,,,the sound of silence overdubbed version,,,,,,,,,
play the soundtrack of our lives s unobstructed views,,,,unobstructed views,the soundtrack of our lives,,,,,,,,
play the spirit indestructible by the ninth,,,,,the ninth,the spirit indestructible,,,,,,,
play the tenth by joan jett,,,,,joan jett,the tenth,,,,,,,
play the tenth by the fifth,,,,the tenth,the fifth,,,,,,,,
play the tenth s sweet nothing diplo grandtheft remix,,,,sweet nothing diplo grandtheft remix,the tenth,,,,,,,,
play the the bravest man in the universe by kanye west god,,,,,kanye west god,the bravest man in the universe,,,,,,,
play the third,,,,,the third,,,,,,,,
play the third by jon foreman,,,,,jon foreman,the third,,,,,,,
play the third s you can't make this up,,,,you can't make this up,the third,,,,,,,,
play the thrill by anggun,,,,the thrill,anggun,,,,,,,,
play the thrill is gone by katrina the waves,,,,the thrill is gone,katrina the waves,,,,,,,,
play the time warp by manfred mann,the time warp,,,,manfred mann,,,,,,,,
play the top of the pops,,,,,,,,,,,top of the pops,,
play the top of the pops,,,,,,,,,,,top of the pops,,
play the track only the loot can make me happy by fifth one,,,,only the loot can make me happy,fifth one,,,,,,,,
play the track the mirror by mega,,,,the mirror,mega,,,,,,,,
play the track the negative one from david arkenstone,,david arkenstone,,the negative one,,,,,,,,,
play the troggs s tenth one,,,,tenth one,the troggs,,,,,,,,
play the twang,,,,,the twang,,,,,,,,
play the unmaking,,,the unmaking,,,,,,,,,,
play the until the end of time by tamela mann,,,,,tamela mann,until the end of time,,,,,,,
play the vapors s the third,,,,the third,the vapors,,,,,,,,
play the ventures s don't look back in anger,,,,don't look back in anger,the ventures,,,,,,,,
play the ventures s should've kissed you,,,,should've kissed you,the ventures,,,,,,,,
play the walls group,,,,,the walls group,,,,,,,,
play the weight of these wings,,,,,,the weight of these wings,,,,,,,
play the winchester s s it,,,,it,the winchester s,,,,,,,,
play their s fade into darkness vocal edit,,,,fade into darkness vocal edit,their,,,,,,,,
play their s panty wetter,,,,panty wetter,their,,,,,,,,
play their s track,,,,track,their,,,,,,,,
play their s wild for the night,,,,wild for the night,their,,,,,,,,
play them changes live by eighth,,,,them changes live,eighth,,,,,,,,
play them girls be like by fifth,,,,them girls be like,fifth,,,,,,,,
play themes - volume 2,,,,,,themes - volume 2,,,,,,,
play theodore shapiro s should ve been us,,,,should ve been us,theodore shapiro,,,,,,,,
play there is a hell believe me i've seen it there is a heaven let s keep it a secret by michael w smith,,,,,michael w smith,there is a hell believe me i've seen it there is a heaven let s keep it a secret,,,,,,,
play there you go,,,,there you go,,,,,,,,,
play these city streets,,,,these city streets,,,,,,,,,
play they s lax files,,,,lax files,they,,,,,,,,
play they s let it ride,,,,let it ride,they,,,,,,,,
play they s more than this,,,,more than this,they,,,,,,,,
play thieves by fourth one,,,,thieves,fourth one,,,,,,,,
play third,,,,third,,,,,,,,,
play third by rey ruiz,,,,,rey ruiz,third,,,,,,,
play third one by gmpresents jocelyn scofield,,,,third one,gmpresents jocelyn scofield,,,,,,,,
play third s money honey rerecorded,,,,money honey rerecorded,third,,,,,,,,
play thiruda thiruda original motion picture soundtrack by that band,thiruda thiruda original motion picture soundtrack,,,,that band,,,,,,,,
play this,,,,,this,,,,,,,,
play this album by the brooklyn tabernacle choir,,,,,the brooklyn tabernacle choir,this album,,,,,,,
play this artist s i swear,,,,i swear,this artist,,,,,,,,
play this artist s last,,,,last,this artist,,,,,,,,
play this girl kungs vs cookin on 3 burners by lmfao,,,,this girl kungs vs cookin on 3 burners,lmfao,,,,,,,,
play this musician,,,,,this musician,,,,,,,,
play this musician s alright album version,,,,alright album version,this musician,,,,,,,,
play this s rebirthing,,,,rebirthing,this,,,,,,,,
play this song,,,,this song,,,,,,,,,
play this song,,,,this song,,,,,,,,,
play this song by felix da housecat,,,,this song,felix da housecat,,,,,,,,
play three days grace song called suttogják a fák a lázas nemecsek és boka,,,,suttogják a fák a lázas nemecsek és boka,three days grace,,,,,,,,
play throw away your television by the tenth,,,,throw away your television,the tenth,,,,,,,,
play thunder s it,,,,it,thunder,,,,,,,,
play tim curry s no money,,,,no money,tim curry,,,,,,,,
play time on earth by mxpx,time on earth,,,,mxpx,,,,,,,,
play tinchy stryder s rise,,,,rise,tinchy stryder,,,,,,,,
play tko by ronnie milsap,,,,tko,ronnie milsap,,,,,,,,
play tobias jesso jr s bolo tie feat yg,,,,bolo tie feat yg,tobias jesso jr,,,,,,,,
play tobtok,,,,,tobtok,,,,,,,,
play today s hits,,,,,,,,,,,today s hits,,
play today s hits,,,,,,,,,,,today s hits,,
play tom misch s fifth one,,,,fifth one,tom misch,,,,,,,,
play top hip hop djs s that,,,,that,top hip hop djs,,,,,,,,
play top hits of keith sweat,,,,,keith sweat,,,,,,,,
play top hits of michael crawford,,,,,michael crawford,,,,,,,,
play totally enormous extinct dinosaurs s tenth,,,,tenth,totally enormous extinct dinosaurs,,,,,,,,
play touché amoré s the way we ride,,,,the way we ride,touché amoré,,,,,,,,
play travis greene s over and out,,,,over and out,travis greene,,,,,,,,
play trillmatic,,,trillmatic,,,,,,,,,,
play true colors film version by andre nickatina,,,,true colors film version,andre nickatina,,,,,,,,
play trust in you by devlin,,,,trust in you,devlin,,,,,,,,
play try it on my own pound boys mix by ice mc,,,,try it on my own pound boys mix,ice mc,,,,,,,,
play tvc15 by t-pain,,,,,t-pain,tvc15,,,,,,,
play two door cinema club hits please,,,,,two door cinema club,,,,,,,,
play two hearts by thirsty merc,two hearts,,,,thirsty merc,,,,,,,,
play tyler the creator s whole thang,,,,whole thang,tyler the creator,,,,,,,,
play u d o s mama,,,,mama,u d o,,,,,,,,
play ummagumma us radio ad by israel houghton new breed,,,,ummagumma us radio ad,israel houghton new breed,,,,,,,,
play under the sea from the little mermaid,,,,under the sea from the little mermaid,,,,,,,,,
play underground e p by maria bethânia,underground e p,,,,maria bethânia,,,,,,,,
play unkle s new song,,,,,unkle,,,,,,,new,
play unorthodox jukebox by john mayall,unorthodox jukebox,,,,john mayall,,,,,,,,
play until the world goes cold by henrique juliano,,,,until the world goes cold,henrique juliano,,,,,,,,
play until you were gone skrux saturn remix,,,,until you were gone skrux saturn remix,,,,,,,,,
play untouchables by the pioneers,untouchables,,,,the pioneers,,,,,,,,
play valentine by september,,,,valentine,september,,,,,,,,
play van der graaf generator,,,,,van der graaf generator,,,,,,,,
play vanessa amorosi s back to black glee cast version,,,,back to black glee cast version,vanessa amorosi,,,,,,,,
play vanessa bell armstrong band,,,,,vanessa bell armstrong,,,,,,,,
play vanessa hudgens top songs,,,,,vanessa hudgens,,,,,,,,
play velvet revolver,,,,,velvet revolver,,,,,,,,
play village crazy lady by british sea power,,,,village crazy lady,british sea power,,,,,,,,
play violent pornography by seventh one,violent pornography,,,,seventh one,,,,,,,,
play voice of the voiceless album version by john barry,,,,voice of the voiceless album version,john barry,,,,,,,,
play voodoo doll satellites remix,,,,voodoo doll satellites remix,,,,,,,,,
play wale,,,,,wale,,,,,,,,
play walk away,,,,walk away,,,,,,,,,
play walk unafraid by harold melvin the blue notes,,,,walk unafraid,harold melvin the blue notes,,,,,,,,
play walter trout,,,,,walter trout,,,,,,,,
play want to want me by pete rock c l smooth,,,,want to want me,pete rock c l smooth,,,,,,,,
play wardruna s feelin way too damn good,,,,feelin way too damn good,wardruna,,,,,,,,
play warumpi band s never be like you feat kai disclosure remix,,,,never be like you feat kai disclosure remix,warumpi band,,,,,,,,
play waste of time by charlie landsborough,,,,,charlie landsborough,waste of time,,,,,,,
play we are one ole ola the official 2014 fifa world cup song opening ceremony version,,,,,,we are one ole ola the official 2014 fifa world cup song opening ceremony version,,,,,,,
play we are your friends,,,,,,we are your friends,,,,,,,
play we belong as one feat tobymac by alphaville,,,,we belong as one feat tobymac,alphaville,,,,,,,,
play we dem boyz,,,,we dem boyz,,,,,,,,,
play we don't talk anymore feat selena gomez album,,,,,,we don't talk anymore feat selena gomez,,,,,,,
play what i do,,,,what i do,,,,,,,,,
play what s love got to do with it by it,,,,,,,,,,,,,
play what s love got to do with it by it,,,,,,,,,,,,,
play what s love got to do with it by it,,,,,,,,,,,,,
play what s love got to do with it by it,,,,,,,,,,,,,
play whatever,,,,,,,,,,,,,
play whatever,,,,,,,,,,,,,
play whatever,,,,,,,,,,,,,
play wheel in the sky by josh gad,wheel in the sky,,,,josh gad,,,,,,,,
play whenever you call,,,,whenever you call,,,,,,,,,
play where did the party go by sergio dalma,,,,where did the party go,sergio dalma,,,,,,,,
play while she sleeps s album record,,,,,while she sleeps,record,,,,,,,
play white december by this band,white december,,,,this band,,,,,,,,
play white riot by vishal dadlani,,,,white riot,vishal dadlani,,,,,,,,
play wild world,,,wild world,,,,,,,,,,
play wit it this christmas,,,wit it this christmas,,,,,,,,,,
play within temptation s wonderful tonight,,,,wonderful tonight,within temptation,,,,,,,,
play wolf parade s all in one,,,,all in one,wolf parade,,,,,,,,
play wolves at the gate,,,,,wolves at the gate,,,,,,,,
play worakls s i believe in a thing called love,,,,i believe in a thing called love,worakls,,,,,,,,
play work it feat 50 cent remix by we are scientists,,,,work it feat 50 cent remix,we are scientists,,,,,,,,
play work song live in america by him,,,,work song live in america,him,,,,,,,,
play working on the highway by marisela,working on the highway,,,,marisela,,,,,,,,
play yeah boy,,,,yeah boy,,,,,,,,,
play yeezy playlist,,,,,,,yeezy,,,,,,
play yelawolf s this song,,,,this song,yelawolf,,,,,,,,
play yoko ono s estoy aquí en vivo,,,,estoy aquí en vivo,yoko ono,,,,,,,,
play you asked me to take 3a by matrix futurebound,you asked me to take 3a,,,,matrix futurebound,,,,,,,,
play you don't own me thrill remix,,,,you don't own me thrill remix,,,,,,,,,
play you got it by that,,,,you got it,that,,,,,,,,
play young as the morning old as the sea,,,,,,young as the morning old as the sea,,,,,,,
play your favorite songs from 100 disney channel original movies,,,,,,your favorite songs from 100 disney channel original movies,,,,,,,
play zella day s dancing in the dark,,,,dancing in the dark,zella day,,,,,,,,
play zella day s runnin interlude,,,,runnin interlude,zella day,,,,,,,,
play zero and blind terry album version by spin doctors,zero and blind terry album version,,,,spin doctors,,,,,,,,
plays some cloud nothings tunes,,,,,cloud nothings,,,,,,,,
plays some last one tunes,,,,,last one,,,,,,,,
plays some the rock masters tunes,,,,,the rock masters,,,,,,,,
please play greater than all live,,,greater than all live,,,,,,,,,,
please play indestructible album,,,,,,indestructible,,,,,,,
please play people are like suns,,,people are like suns,,,,,,,,,,
please play the beat,,,the beat,,,,,,,,,,
please play the ronettes s splitting the atom album,,,,,the ronettes,splitting the atom,,,,,,,
please play their s magpies on fire victorian machinery album,,,,,their,magpies on fire victorian machinery,,,,,,,
please play trip switch album,,,,,,trip switch,,,,,,,
please play wannabe album,,,,,,wannabe,,,,,,,
pull up my my favorites collection,,,,,,,my favorites,,,,,,
put 44 on,,,44,,,,,,,,,,
put atlas genius on,,,atlas genius,,,,,,,,,,
put baby k music on,,,,,baby k,,,,,,,,
put drive-by truckers on,,,drive-by truckers,,,,,,,,,,
put flipsyde music on,,,,,flipsyde,,,,,,,,
put foghat music on,,,,,foghat,,,,,,,,
put gene pitney music on,,,,,gene pitney,,,,,,,,
put his music on,,,,,his,,,,,,,,
put i'm gonna be 500 miles on,,,i'm gonna be 500 miles,,,,,,,,,,
put kiiara music on,,,,,kiiara,,,,,,,,
put laura welsh music on,,,,,laura welsh,,,,,,,,
put mtv unplugged in new york on,,,mtv unplugged in new york,,,,,,,,,,
put on 1st day out tha feds by alfred brendel,1st day out tha feds,,,,alfred brendel,,,,,,,,
put on a 1940s station,,,,,,,,,,1940s,,,
put on a 2000s station,,,,,,,,,,2000s,,,
put on a 30s station,,,,,,,,,,30s,,,
put on a rainy day mix,,,,,,,,,,,rainy day,,
put on a rainy day mix,,,,,,,,,,,rainy day,,
put on alex turner,,,alex turner,,,,,,,,,,
put on an folktronica station,,,,,,,,folktronica,,,,,
put on an metal station,,,,,,,,metal,,,,,
put on desire by the rolling stones,desire,,,,the rolling stones,,,,,,,,
put on dirty heads s song that track,,,,that track,dirty heads,,,,,,,,
put on do you wanna come over by craig douglas,do you wanna come over,,,,craig douglas,,,,,,,,
put on follow the sun song,,,,follow the sun,,,,,,,,,
put on hands like houses,,,hands like houses,,,,,,,,,,
put on hold each other,,,hold each other,,,,,,,,,,
put on look her in the eye and lie,,,look her in the eye and lie,,,,,,,,,,
put on lounge act song,,,,lounge act,,,,,,,,,
put on more,,,more,,,,,,,,,,
put on my cantopop playlist,,,,,,,cantopop,,,,,,
put on my playlist called faves,,,,,,,faves,,,,,,
put on my playlist called sixth one,,,,,,,sixth one,,,,,,
put on my yoga playlist,,,,,,,yoga,,,,,,
put on similar artists to az,,,,,az,,,,,,,,similar
put on similar artists to goanna,,,,,goanna,,,,,,,,similar
put on similar artists to lars winnerbäck,,,,,lars winnerbäck,,,,,,,,similar
put on similar artists to nyanse,,,,,nyanse,,,,,,,,similar
put on similar artists to the doobie brothers,,,,,the doobie brothers,,,,,,,,similar
put on some 2000s electronica,,,,,,,,electronica,,2000s,,,
put on some 2010s folktronica,,,,,,,,folktronica,,2010s,,,
put on some 80s old school hip hop,,,,,,,,old school hip hop,,80s,,,
put on some 90s rhythm and blues,,,,,,,,rhythm and blues,,90s,,,
put on some dark music,,,,,,,,,dark,,,,
put on some energetic music,,,,,,,,,energetic,,,,
put on some heard em say by sixpence none the richer,heard em say,,,,sixpence none the richer,,,,,,,,
put on some lit feat bas k-quick by jeremy camp,lit feat bas k-quick,,,,jeremy camp,,,,,,,,
put on some music by james brown,,,,,james brown,,,,,,,,
put on some music by paula cole,,,,,paula cole,,,,,,,,
put on some music for a romantic dinner,,,,,,,,,,,romantic dinner,,
put on some music for a romantic dinner,,,,,,,,,,,romantic dinner,,
put on some music for a romantic dinner,,,,,,,,,,,romantic dinner,,
put on some music for a romantic dinner,,,,,,,,,,,romantic dinner,,
put on some music for a romantic dinner,,,,,,,,,,,romantic dinner,,
put on some music for a romantic dinner,,,,,,,,,,,romantic dinner,,
put on some music for a romantic dinner,,,,,,,,,,,romantic dinner,,
put on some music for the drive home,,,,,,,,,,,drive home,,
put on some music for the drive home,,,,,,,,,,,drive home,,
put on some of bebe cece winans music,,,,,bebe cece winans,,,,,,,,
put on some of generation x music,,,,,generation x,,,,,,,,
put on some of maurice williams the zodiacs music,,,,,maurice williams the zodiacs,,,,,,,,
put on some of that artist music,,,,,that artist,,,,,,,,
put on some serious music,,,,,,,,,serious,,,,
put on some upbeat music,,,,,,,,,upbeat,,,,
put on something by dannii minogue,,,,,dannii minogue,,,,,,,,
put on something similar,,,,,,,,,,,,,similar
put on something similar,,,,,,,,,,,,,similar
put on something similar,,,,,,,,,,,,,similar
put on something similar,,,,,,,,,,,,,similar
put on something similar,,,,,,,,,,,,,similar
put on something similar,,,,,,,,,,,,,similar
put on something similar,,,,,,,,,,,,,similar
put on something similar,,,,,,,,,,,,,similar
put on songs from 1980s,,,,,,,,,,1980s,,,
put on songs from 1990s,,,,,,,,,,1990s,,,
put on songs from 2000s,,,,,,,,,,2000s,,,
put on that band s song us forces remastered version,,,,us forces remastered version,that band,,,,,,,,
put on that song by current singer that just came out,,,,,current singer,,,,,,,just,
put on that song by dimmu borgir that just came out,,,,,dimmu borgir,,,,,,,just,
put on that song by giorgio moroder that just came out,,,,,giorgio moroder,,,,,,,just,
put on that song by mann that just came out,,,,,mann,,,,,,,just,
put on that song by shaman s harvest that just came out,,,,,shaman s harvest,,,,,,,just,
put on the album album,,,,,,album,,,,,,,
put on the album called staind,,,,,,staind,,,,,,,
put on the album mad,,,,,,mad,,,,,,,
put on the album the first,,,,,,the first,,,,,,,
put on the album the sweet escape,,,,,,the sweet escape,,,,,,,
put on the cardio workout crew record back to back,,,,,cardio workout crew,back to back,,,,,,,
put on the graduation playlist,,,,,,,graduation,,,,,,
put on the lee ann womack record dirty mind,,,,,lee ann womack,dirty mind,,,,,,,
put on the new single by loreena mckennitt,,,,,loreena mckennitt,,,,,,,new,
put on the nyla record rhino hi-five naughty by nature,,,,,nyla,rhino hi-five naughty by nature,,,,,,,
put on the record feel,,,,,,feel,,,,,,,
put on the record fetty wap by fetty wap,,,,,,,,,,,,,
put on the record fetty wap by fetty wap,,,,,,,,,,,,,
put on the record learning to crawl expanded and remastered,,,,,,learning to crawl expanded and remastered,,,,,,,
put on the song current playing song,,,,current playing song,,,,,,,,,
put on the song last fair deal gone down,,,,last fair deal gone down,,,,,,,,,
put on the song stand by me 2010 - remaster,,,,stand by me 2010 - remaster,,,,,,,,,
put on the songs from andrew gold s the ninth album,,,,,andrew gold,the ninth,,,,,,,
put on the songs from dame joan sutherland s sex and love album,,,,,dame joan sutherland,sex and love,,,,,,,
put on the songs from howard carpendale s 6 foot 7 foot album,,,,,howard carpendale,6 foot 7 foot,,,,,,,
put on the songs from ringo starr s closer remixes album,,,,,ringo starr,closer remixes,,,,,,,
put on the songs from that band s paper trail album,,,,,that band,paper trail,,,,,,,
put on the songs from the first s rascal flatts album,,,,,the first,rascal flatts,,,,,,,
put on the susan boyle record the best of,,,,,susan boyle,the best of,,,,,,,
put on the the third record the wrong side of heaven and the righteous side of hell,,,,,the third,the wrong side of heaven and the righteous side of hell,,,,,,,
put on the track give me everything adam f dutch step remix,,,,give me everything adam f dutch step remix,,,,,,,,,
put on the track if you don't know me by now,,,,if you don't know me by now,,,,,,,,,
put on we the best forever the album,,,,,,we the best forever,,,,,,,
put on what happened to you,,,what happened to you,,,,,,,,,,
put on when disaster strikes,,,when disaster strikes,,,,,,,,,,
put ryan leslie music on,,,,,ryan leslie,,,,,,,,
put technotronic music on,,,,,technotronic,,,,,,,,
put the all we know record on,,,,,,all we know,,,,,,,
put the johnny cash the best of sun years record on,,,,,,johnny cash the best of sun years,,,,,,,
put the sixth one record on,,,,,,sixth one,,,,,,,
put therion music on,,,,,therion,,,,,,,,
set the mood with some 1930s music,,,,,,,,,,1930s,,,
set the mood with some 1950s music,,,,,,,,,,1950s,,,
set the mood with some 30s music,,,,,,,,,,30s,,,
set the mood with some 80s music,,,,,,,,,,80s,,,
set the mood with some 90s music,,,,,,,,,,90s,,,
spin some gary glitter,,,gary glitter,,,,,,,,,,
spin some happy,,,happy,,,,,,,,,,
spin some red lights,,,red lights,,,,,,,,,,
spin some water fall interluuube,,,water fall interluuube,,,,,,,,,,
start a brian doerksen radio,,,,,brian doerksen,,,,,,,,radio
start a drowning pool radio,,,,,drowning pool,,,,,,,,radio
start a dwight yoakam radio,,,,,dwight yoakam,,,,,,,,radio
start a heather headley radio,,,,,heather headley,,,,,,,,radio
start a karaoke all hits radio,,,,,karaoke all hits,,,,,,,,radio
start a sam brown radio,,,,,sam brown,,,,,,,,radio
start a seventh one radio,,,,,seventh one,,,,,,,,radio
start a wet wet wet radio,,,,,wet wet wet,,,,,,,,radio
start an celtic spirit station,,,,,celtic spirit,,,,,,,,station
start an kajagoogoo station,,,,,kajagoogoo,,,,,,,,station
start my guilty pleasures collection,,,,,,,guilty pleasures,,,,,,
start my third radio,,,,,third,,,,,,,,radio
start my this radio,,,,,this,,,,,,,,radio
start my walk the runway collection,,,,,,,walk the runway,,,,,,
start playing 57th 9th,,,57th 9th,,,,,,,,,,
start playing a million,,,a million,,,,,,,,,,
start playing grace jones,,,grace jones,,,,,,,,,,
