MusicInfoConcertsResponse,MusicInfoConcertsArtist,MusicInfoConcertsLocation,MusicInfoConcertsDate
any concerts by remi in tenth in July twentieth,remi,tenth,July twentieth
any current singer concerts in fourth one,current singer,fourth one,
any tour dates for andrae crouch in tenth,andrae crouch,tenth,
any tour dates for asta in second one,asta,second one,
are artist going on tour,artist,,
are brooke fraser touring in Škrjanče,brooke fraser,Škrjanče,
are deluxe on tour,deluxe,,
are he on tour,he,,
are o a r touring in second,o a r,second,
are slow club playing in Touka-Ouro Nalla,slow club,Touka-Ouro Nalla,
are that artist on tour,that artist,,
are the eighth in concert right now,the eighth,,
are the fourth playing somewhere,the fourth,,
are therapy in concert right now,therapy,,
are there any concerts coming up in Kozhukhartsi Kărdžali featuring melissa,melissa,Kozhukhartsi Kărdžali,
are there any concerts coming up in ninth one featuring dj mustard,dj mustard,ninth one,
are there any dawn richard concerts coming up,dawn richard,,
are there any eighth one concerts in the second coming up,eighth one,the second,
are there any ninth shows on the that band tour,that band,ninth,
are there any rozalla concerts coming up,rozalla,,
are there any seventh one shows on the the second tour,the second,seventh one,
are there any the fifth concerts coming up,the fifth,,
are there any the strumbellas concerts coming up,the strumbellas,,
are there any third one shows on the lucenzo tour,lucenzo,third one,
bring up benjamin dube tour dates,benjamin dube,,
bring up that band tour dates,that band,,
can i see all performances by that performer in first one,that performer,first one,
can i see all performances by this in seventh one,this,seventh one,
can i see concerts info,,,
can i see concerts info,,,
can you find concerts,,,
can you find concerts Nturen,,Nturen,
can you find concerts Villadeati,,Villadeati,
can you find concerts in first,,first,
can you find concerts ninth,,ninth,
can you look up concerts for first,first,,
can you look up concerts for first,first,,
can you look up concerts for them,them,,
can you look up the pussycat dolls concerts,the pussycat dolls,,
can you show me concerts for jeff beck,jeff beck,,
can you show me concerts for mike stud,mike stud,,
can you show me concerts for the second,the second,,
can you show me concerts in Macuelizo,,Macuelizo,
can you show me upcoming concerts in Roslyn Harbor New York,,Roslyn Harbor New York,
can you show me upcoming concerts in that location,,that location,
check if kip moore is playing any concerts,kip moore,,
check if nivea is playing any concerts,nivea,,
check whether hinder is playing any concerts,hinder,,
check whether they is playing any concerts,they,,
check whether urban cone is playing any concerts,urban cone,,
cocorosie playing in Lone Tree anytime soon,cocorosie,Lone Tree,
dma s next concert is in what city,dma s,,
do you have concert dates for arthur brown,arthur brown,,
do you have concert dates for chino nacho,chino nacho,,
do you have concert dates for sixth one,sixth one,,
do you have concerts,,,
do you have concerts,,,
do you have concerts,,,
do you know first one s concert schedule,first one,,
do you know little dragon s tour schedule,little dragon,,
do you know mikael wiehe s tour schedule,mikael wiehe,,
do you know parov stelar s tour schedule,parov stelar,,
do you know powerman 5000 s tour schedule,powerman 5000,,
do you know that band s concert schedule,that band,,
do you know they s concert schedule,they,,
do you know when the taj mahal concert is,taj mahal,,
do you know when the tito el bambino concert is,tito el bambino,,
do you know where s ameritz audio karaoke on tour,ameritz audio karaoke,,
does against me have shows in Amūda,against me,Amūda,
does england dan seals have any upcoming concerts,england dan seals,,
does filter have any upcoming concerts,filter,,
does future r b hitmakers have shows in Poblado Dos Mexico,future r b hitmakers,Poblado Dos Mexico,
does the lox have shows in Zacualpan Mexico,the lox,Zacualpan Mexico,
find 38 special concerts in Mazraqah,38 special,Mazraqah,
find a concert,,,
find a concert,,,
find a concert,,,
find a concert,,,
find a concert,,,
find a concert,,,
find abc concerts in sixth one,abc,sixth one,
find american authors concerts in the General Maynard Brazil area,american authors,General Maynard Brazil,
find an second concert in Vézins-de-Lévézou,second,Vézins-de-Lévézou,
find anime kei s concert schedule,anime kei,,
find anirudh ravichander concerts,anirudh ravichander,,
find big deal shows in eighth,big deal,eighth,
find black oak arkansas concerts,black oak arkansas,,
find cold s concert in ninth,cold,ninth,
find concert,,,
find concert events,,,
find concert events fourth September in ninth,,ninth,fourth September
find concert events in Beaux Arts Village,,Beaux Arts Village,
find concert events in San Juan Chilateca Mexico,,San Juan Chilateca Mexico,
find concert events in that place,,that place,
find concert info,,,
find concert info,,,
find concert info,,,
find concert info,,,
find concert of guano apes in last,guano apes,last,
find concert of mother s finest in fifth,mother s finest,fifth,
find concerts,,,
find concerts Bhajiya India twentieth September,,Bhajiya India,twentieth September
find concerts February first,,,February first
find concerts January fifth,,,January fifth
find concerts June fifth,,,June fifth
find concerts May fifteenth,,,May fifteenth
find concerts November first,,,November first
find concerts September twenty sixth,,,September twenty sixth
find concerts Zogodo,,Zogodo,
find concerts by daddy yankee lil jon pitbull noriega in Agonès,daddy yankee lil jon pitbull noriega,Agonès,
find concerts featuring the ninth,the ninth,,
find concerts fifth July,,,fifth July
find concerts for alyssa reid location that,alyssa reid,that,
find concerts for axwell ingrosso in this,axwell ingrosso,this,
find concerts for caravan palace,caravan palace,,
find concerts for casey james,casey james,,
find concerts for current singer,current singer,,
find concerts for fifth one location the third,fifth one,the third,
find concerts for first one,first one,,
find concerts for frou frou,frou frou,,
find concerts for infernal location Sombrin France,infernal,Sombrin France,
find concerts for james last and his orchestra,james last and his orchestra,,
find concerts for lifehouse in seventh one,lifehouse,seventh one,
find concerts for london philharmonic orchestra and andrew skeet,london philharmonic orchestra and andrew skeet,,
find concerts for nicki minaj,nicki minaj,,
find concerts for ninth one location Neufmanil,ninth one,Neufmanil,
find concerts for paddy reilly location there,paddy reilly,there,
find concerts for pulp,pulp,,
find concerts for r i o in the first,r i o,the first,
find concerts for slim dusty location Önnestad,slim dusty,Önnestad,
find concerts for stray cats,stray cats,,
find concerts for that band,that band,,
find concerts for the first,the first,,
find concerts for the pharcyde in there,the pharcyde,there,
find concerts for the second,the second,,
find concerts for the sixth in tenth,the sixth,tenth,
find concerts for the third,the third,,
find concerts for third,third,,
find concerts for tori kelly in seventh,tori kelly,seventh,
find concerts in Marinča vas Slovenia,,Marinča vas Slovenia,
find concerts in Nimblak,,Nimblak,
find concerts in Oyrières France,,Oyrières France,
find concerts in Potharlanka,,Potharlanka,
find concerts in fourth one,,fourth one,
find concerts in seventh,,seventh,
find concerts in the last,,the last,
find concerts the last September second,,the last,September second
find concerts twenty first December,,,twenty first December
find concerts twenty first January,,,twenty first January
find denzel curry concerts in the Nyamisati area,denzel curry,Nyamisati,
find dino merlin concerts in West Springfield United States of America,dino merlin,West Springfield United States of America,
find eighth concert in Jammā'īn,eighth,Jammā'īn,
find falling up concerts,falling up,,
find fifth concerts,fifth,,
find fifth one concerts,fifth one,,
find first one concerts,first one,,
find first one shows in sixth one,first one,sixth one,
find florida georgia line luke bryan s tour dates,florida georgia line luke bryan,,
find gerardo ortiz concerts the seventh,gerardo ortiz,the seventh,
find gigs for fourth in the Salton Sea Beach,fourth,Salton Sea Beach,
find gigs for johnny mathis in the fifth,johnny mathis,fifth,
find grand funk railroad concert in San José de Manantiales,grand funk railroad,San José de Manantiales,
find hybrid concerts in this,hybrid,this,
find jackson 5 concerts,jackson 5,,
find jamie xx feat romy concerts,jamie xx feat romy,,
find jim croce concerts seventh,jim croce,seventh,
find jovanotti concerts,jovanotti,,
find julianna barwick concert dates,julianna barwick,,
find kastelruther spatzen concerts,kastelruther spatzen,,
find koi child shows,koi child,,
find last one concert in the third,last one,the third,
find last one concerts in Bhajiya,last one,Bhajiya,
find last one s concert in third,last one,third,
find lateef the truthspeaker concerts,lateef the truthspeaker,,
find marina and the diamonds concert in Grobnice,marina and the diamonds,Grobnice,
find matt cardle shows in Diloda Tanzania,matt cardle,Diloda Tanzania,
find me a andrea bocelli concert near Chonan,andrea bocelli,Chonan,
find me a little boots concert near Naşa Turkey,little boots,Naşa Turkey,
find me a lucas lucco concert near Alhed,lucas lucco,Alhed,
find me a michael schenker group concert near Altenhof,michael schenker group,Altenhof,
find me a paul mc clure concert near Escoutoux,paul mc clure,Escoutoux,
find me a that band concert near Todorin Do Serbia,that band,Todorin Do Serbia,
find me eighth concerts in ninth,eighth,ninth,
find me gracie fields concerts in Touare,gracie fields,Touare,
find me music concerts,,,
find me music concerts,,,
find me music concerts,,,
find me music concerts,,,
find me music concerts,,,
find me natalie cole concerts in Wallenried Switzerland,natalie cole,Wallenried Switzerland,
find me the xx concerts in Nonaspe Aragonien,the xx,Nonaspe Aragonien,
find me this artist concerts in Mount Vernon,this artist,Mount Vernon,
find mega tracks karaoke band concerts Cham Dungara Timta Uttarakhand,mega tracks karaoke band,Cham Dungara Timta Uttarakhand,
find mother mother concerts in sixth,mother mother,sixth,
find music tour,,,
find music tour,,,
find my morning jacket concerts dates,my morning jacket,,
find new found glory concerts in Jammā'īn Palestine,new found glory,Jammā'īn Palestine,
find ninth one concerts in second,ninth one,second,
find ninth s tour dates,ninth,,
find ninth shows in Dhari Ghat India,ninth,Dhari Ghat India,
find ohio players concerts in Jīzābād,ohio players,Jīzābād,
find out the next fifth one show,fifth one,,
find out the next first show,first,,
find out the next goldfrapp show,goldfrapp,,
find out the next his show,his,,
find out the next lera lynn show,lera lynn,,
find out the next liz phair show,liz phair,,
find out the next sixth show,sixth,,
find out the next that musician show,that musician,,
find out the next the breeders show,the breeders,,
find out the next the o'neill brothers group show,the o'neill brothers group,,
find out the next this band show,this band,,
find out the next this show,this,,
find out the next this show,this,,
find out where fifth is performing,fifth,,
find out where this is performing,this,,
find second concert dates in the ninth,second,the ninth,
find second one concerts,second one,,
find shows,,,
find shows,,,
find shows,,,
find silje nergaard concerts,silje nergaard,,
find singer concerts,singer,,
find snowgoons concerts in the as-Sars area,snowgoons,as-Sars,
find some concerts,,,
find some concerts,,,
find some concerts to check out March twenty sixth,,,March twenty sixth
find some concerts to check out twenty first July,,,twenty first July
find tanya tucker concert in Rāmpur Hāt,tanya tucker,Rāmpur Hāt,
find tenth one concerts dates,tenth one,,
find that artist concerts in second one,that artist,second one,
find that band concerts,that band,,
find that concerts the first,that,the first,
find that musician concerts in Java Shida Kartli,that musician,Java Shida Kartli,
find that singer concerts in Sarenda Uttar Pradesh,that singer,Sarenda Uttar Pradesh,
find the b-52 s concerts in the sixth,the b-52 s,the sixth,
find the coasters s tour dates,the coasters,,
find the first s concert in Potharlanka India,the first,Potharlanka India,
find the latest concerts by benjamin dube in last,benjamin dube,last,
find the latest concerts by john p kee in the second,john p kee,the second,
find the latest concerts by ninth one in Cuaca Vieja Honduras,ninth one,Cuaca Vieja Honduras,
find the latest concerts by the oak ridge boys in Qaryat Qārāt al-Jabal al-Garbī,the oak ridge boys,Qaryat Qārāt al-Jabal al-Garbī,
find the manhattan transfer shows,the manhattan transfer,,
find the next david zowie gig,david zowie,,
find the next emery show in that place,emery,that place,
find the next first concert in Lagonoy Philippines,first,Lagonoy Philippines,
find the next his gig,his,,
find the next his show,his,,
find the next kurt nilsen gig,kurt nilsen,,
find the next lalo schifrin show,lalo schifrin,,
find the next mindless behavior gig in eighth one,mindless behavior,eighth one,
find the next ry cooder gig,ry cooder,,
find the next saving abel show,saving abel,,
find the next stereolab show,stereolab,,
find the next the call concert in Bibir Abad,the call,Bibir Abad,
find the next the jezabels show in Warsun India,the jezabels,Warsun India,
find the next they show,they,,
find the next this artist show,this artist,,
find the next this concert in tenth,this,tenth,
find the next this gig,this,,
find the next this performer show,this performer,,
find the next wafia gig in that one,wafia,that one,
find the ninth concert dates in San Juan Chilateca Oaxaca,the ninth,San Juan Chilateca Oaxaca,
find the ninth concert in Bloc Avv-V3 Burkina Faso,ninth,Bloc Avv-V3 Burkina Faso,
find the second concerts in this,the second,this,
find the seventh concerts in the fifth,the seventh,the fifth,
find the tenth concerts,the tenth,,
find the tenth concerts,the tenth,,
find the tenth concerts in tenth,the tenth,tenth,
find them concerts in Guapí,them,Guapí,
find third one s concert in Sombrin Nord-Pas-de-Calais,third one,Sombrin Nord-Pas-de-Calais,
find this band concerts,this band,,
find this musician concerts in that,this musician,that,
find tour dates for artist,artist,,
find ty dolla ign concerts,ty dolla ign,,
find ultra naté s concerts,ultra naté,,
find upcoming concerts for sixth in Marinča vas,sixth,Marinča vas,
find upcoming this performer concerts,this performer,,
find womack womack concerts,womack womack,,
find worship together shows in last,worship together,last,
get armand van helden concert dates,armand van helden,,
get bad company concert schedule,bad company,,
get barry gibb concert schedule,barry gibb,,
get cherish concert schedule,cherish,,
get concert,,,
get concert,,,
get concert dates for al jarreau,al jarreau,,
get concert dates for connie britton,connie britton,,
get concert dates for dumdum boys,dumdum boys,,
get concert dates for first one,first one,,
get concert dates for jenni rivera,jenni rivera,,
get concert dates for that performer,that performer,,
get concert dates for the fifth,the fifth,,
get concert dates for the first,the first,,
get concert dates for them,them,,
get concert info,,,
get concert info,,,
get concert info,,,
get concerts,,,
get craig david concert schedule,craig david,,
get eighth concert dates,eighth,,
get me concert dates,,,
get me concert dates,,,
get me concert dates,,,
get me concert listings,,,
get me concert listings,,,
get me concert listings,,,
get me concert listings,,,
get me concert listings,,,
get me concert listings,,,
get me concerts please,,,
get me concerts please,,,
get me the concert schedule of her,her,,
get me upcoming shows for daniel avery,daniel avery,,
get me upcoming shows for that band,that band,,
get the concert dates for kongos,kongos,,
get the concert dates for the fourth,the fourth,,
get the concert dates for this band,this band,,
get the concert schedule for his,his,,
get the concert schedule for the sixth,the sixth,,
get this concert dates,this,,
help find conrad sewell shows,conrad sewell,,
help find jay sean shows,jay sean,,
help find lorrie morgan shows,lorrie morgan,,
help find second shows,second,,
help find that shows,that,,
help find troy ave shows,troy ave,,
help find zac brown band shows,zac brown band,,
help me search for that band s concerts,that band,,
i am looking for concerts,,,
i am looking for concerts,,,
i am looking for concerts,,,
i need concerts,,,
i need concerts,,,
i need some concerts info,,,
i need some concerts info,,,
i need the list of concerts that will be taking place in Guapí Colombia,,Guapí Colombia,
i need to know when new radicals is on tour,new radicals,,
i wanna see 90s rock in Bolyarovo Bulgaria,90s rock,Bolyarovo Bulgaria,
i wanna see dj spinking in sixth one,dj spinking,sixth one,
i want concert dates,,,
i want concert dates,,,
i want concert dates,,,
i want concert dates,,,
i want concert dates,,,
i want concert dates,,,
i want concert dates,,,
i want concert days,,,
i want to go to a concert,,,
i want to go to an charlie landsborough show,charlie landsborough,,
i want to know when earl sweatshirt is coming to Golubinci,earl sweatshirt,Golubinci,
i want to know where meditation spa is playing,meditation spa,,
i want to know where the avener is playing,the avener,,
i want to know where vaya con dios is playing,vaya con dios,,
i want to search for this performer concerts,this performer,,
i want to see a motorpsycho show in Poblado Dos,motorpsycho,Poblado Dos,
i want to see ameritz - tribute in concert,ameritz - tribute,,
i want to see concerts,,,
i want to see concerts,,,
i want to see concerts,,,
i want to see concerts,,,
i want to see concerts,,,
i want to see first one,first one,,
i want to see linkin park in concert,linkin park,,
i want to see mavado live,mavado,,
i want to see mogwai live,mogwai,,
i want to see ninth,ninth,,
i want to see perfume in concert,perfume,,
i want to see seventh live,seventh,,
i want to see that live,that,,
i want to see the fifth live,the fifth,,
i want to see the rubens,the rubens,,
i want to see this musician live,this musician,,
i wonder when bent is going on tour,bent,,
i wonder when this performer is going on tour,this performer,,
i wonder where sixth one is performing,sixth one,,
i wonder where this performer is performing,this performer,,
i would like to know when artist is touring again,artist,,
i would like to know when bad manners is touring again,bad manners,,
i would like to know when junainah is touring again,junainah,,
i'd like to see this band perform,this band,,
i'm looking for concerts,,,
i'm trying to find brian doerksen concerts,brian doerksen,,
i'm trying to find jidenna concerts,jidenna,,
i'm trying to find michael ray concerts,michael ray,,
i'm trying to find mustafa zahid concerts,mustafa zahid,,
i'm trying to find out when fourth is in concert,fourth,,
i'm trying to find out when plumbo is in concert,plumbo,,
i'm trying to find out when vikingarna is in concert,vikingarna,,
i'm trying to see where gordon lightfoot is playing,gordon lightfoot,,
i'm wondering where her is playing,her,,
i'm wondering where sia is playing,sia,,
i'm wondering where the presets is playing,the presets,,
i'm wondering where them is playing,them,,
i'm wondering where this is playing,this,,
ideal playing in Hylla Nord-Trøndelag anytime soon,ideal,Hylla Nord-Trøndelag,
is ameritz karaoke band in concert Nyarero Mara,ameritz karaoke band,Nyarero Mara,
is artist playing in Makongorosi,artist,Makongorosi,
is bernard fanning playing first one,bernard fanning,first one,
is cliff edwards on tour,cliff edwards,,
is dame kiri te kanawa going on tour,dame kiri te kanawa,,
is eighth one playing in the ninth,eighth one,the ninth,
is electric light orchestra playing in eighth,electric light orchestra,eighth,
is first playing Laho Arunachal Pradesh,first,Laho Arunachal Pradesh,
is fourth one playing in Gambisara,fourth one,Gambisara,
is g herbo playing in first,g herbo,first,
is glenn frey in concert fifth one,glenn frey,fifth one,
is her going on tour,her,,
is him playing sixth,him,sixth,
is jason derülo coming to Bakong Muslim Mindanao,jason derülo,Bakong Muslim Mindanao,
is keyshia cole coming to Mwanzoya Shinyanga,keyshia cole,Mwanzoya Shinyanga,
is kiko bun coming to Marsoli Bhat,kiko bun,Marsoli Bhat,
is last one performing in Pozo Colorado,last one,Pozo Colorado,
is last one performing in Ţibăneşti,last one,Ţibăneşti,
is london philharmonic orchestra and andrew skeet performing in Bhadarva,london philharmonic orchestra and andrew skeet,Bhadarva,
is luniz playing in Megina,luniz,Megina,
is michael bolton playing Nyamisati Tanzania,michael bolton,Nyamisati Tanzania,
is ninth one coming to fourth,ninth one,fourth,
is nusrat fateh ali kahn performing in tenth,nusrat fateh ali kahn,tenth,
is patti page playing Trouville,patti page,Trouville,
is rose royce playing fifth,rose royce,fifth,
is schoolboy q coming to last,schoolboy q,last,
is second one playing in Purbaliyan,second one,Purbaliyan,
is sixth one playing in Makongorosi Tanzania,sixth one,Makongorosi Tanzania,
is some of that in concert Kapuvár Győr-Moson-Sopron,some of that,Kapuvár Győr-Moson-Sopron,
is tenth one in concert Mazra'ah Hajjah,tenth one,Mazra'ah Hajjah,
is that coming to seventh,that,seventh,
is that in concert the tenth,that,the tenth,
is that playing Qal'eh Dozdān Iran,that,Qal'eh Dozdān Iran,
is that playing in Chichiltepec Guerrero,that,Chichiltepec Guerrero,
is the chemical brothers playing in Inalegolo Kgalagadi North,the chemical brothers,Inalegolo Kgalagadi North,
is their playing in the ninth,their,the ninth,
is their playing in the seventh,their,the seventh,
is there any concert of i prevail in tenth,i prevail,tenth,
is this performer playing in General Maynard Sergipe,this performer,General Maynard Sergipe,
isn't avatar on tour,avatar,,
isn't ben webster on tour,ben webster,,
isn't eighth on a concert tour,eighth,,
isn't midnight choir on a concert tour,midnight choir,,
isn't panda bear on a concert tour,panda bear,,
isn't the fourth on tour,the fourth,,
isn't this musician on a concert tour,this musician,,
it next concert is in what city,it,,
jose feliciano next concert is when,jose feliciano,,
list concerts of bonnie tyler near Santa María del Berrocal,bonnie tyler,Santa María del Berrocal,
list concerts of dj casper near Barnum Island,dj casper,Barnum Island,
list places where rob base is performing,rob base,,
look for beach house concert in first one,beach house,first one,
look for concerts by combichrist in the last,combichrist,the last,
look for concerts by dollie de luxe in Cirey France,dollie de luxe,Cirey France,
look for concerts by lion babe in Naz,lion babe,Naz,
look for concerts by raheem devaughn in Sahuwala-I,raheem devaughn,Sahuwala-I,
look for concerts by third in seventh one,third,seventh one,
look for concerts by this in Fanano Emilia-Romagna,this,Fanano Emilia-Romagna,
look for concerts by thrift shop in that location,thrift shop,that location,
look for concerts by yuna in Renco Mine Zimbabwe,yuna,Renco Mine Zimbabwe,
look for concerts by yung lean in the third,yung lean,the third,
look for concerts in Lagonoy this year,,Lagonoy,
look for concerts in there this year,,there,
look up 2 milly concerts in the first one,2 milly,first one,
look up babylon zoo concerts,babylon zoo,,
look up band concerts in Pervomayskoye Russia,band,Pervomayskoye Russia,
look up big l concerts in Raúl Silva Henríquez Chile,big l,Raúl Silva Henríquez Chile,
look up concerts,,,
look up concerts,,,
look up concerts,,,
look up eighth one concerts,eighth one,,
look up fee concerts in there,fee,there,
look up first one concerts in the that location,first one,that location,
look up free concerts,free,,
look up gaia tour dates,gaia,,
look up gloria estefan concerts near seventh,gloria estefan,seventh,
look up harold melvin the blue notes concerts,harold melvin the blue notes,,
look up he concerts in Saint-Pierre-la-Palud Rhône-Alpes,he,Saint-Pierre-la-Palud Rhône-Alpes,
look up information for chiddy bang concert in seventh one,chiddy bang,seventh one,
look up information for jamie xx concert in Bory,jamie xx,Bory,
look up joel adams concert near the ninth,joel adams,the ninth,
look up last one concerts near Memmelshoffen France,last one,Memmelshoffen France,
look up lena tour dates,lena,,
look up malika ayane concerts,malika ayane,,
look up matt wertz concerts,matt wertz,,
look up midge ure concerts in Khorramshahr Iran,midge ure,Khorramshahr Iran,
look up midnight choir concerts,midnight choir,,
look up procol harum concerts in ninth one,procol harum,ninth one,
look up randy travis concerts,randy travis,,
look up seventh one concerts,seventh one,,
look up sølvguttene concerts,sølvguttene,,
look up tenth one concerts,tenth one,,
look up tenth one concerts in Blancafort,tenth one,Blancafort,
look up the eighth concerts,the eighth,,
look up the eighth concerts in the Bhadarva India,the eighth,Bhadarva India,
look up the second concerts,the second,,
