MusicPlayResponse,MusicPlaySongAlbum,MusicPlayAlbumArtist,MusicPlayAlbumArtistSong,MusicPlaySong,MusicPlayArtist,MusicPlayAlbum,MusicPlayCollection,MusicPlayGenre,MusicPlayMood,MusicPlayEra,MusicPlayKeyword,MusicPlayNew,MusicPlaySimilar
play 50 masterworks - glenn gould by the supremes,50 masterworks - glenn gould,,,,the supremes,,,,,,,,
play 500 degreez by fifth one,,,,,fifth one,500 degreez,,,,,,,
play 60s maloya jams,,,,,,,,maloya,,60s,,,
play 60s music,,,,,,,,,,60s,,,
play 60s songs,,,,,,,,,,60s,,,
play 69 main version - explicit by debbie harry,,,,69 main version - explicit,debbie harry,,,,,,,,
play 70s hits,,,,,,,,,,70s,,,
play 70s music,,,,,,,,,,70s,,,
play 8-track - etta james - ep by rival sons,8-track - etta james - ep,,,,rival sons,,,,,,,,
play 9 teen 90 nine by stella mwangi,,,,9 teen 90 nine,stella mwangi,,,,,,,,
play 90s rock s dig,,,,dig,90s rock,,,,,,,,
play a 1950s j-rock music station,,,,,,,,j-rock,,1950s,,,
play a hot night in paris,,,a hot night in paris,,,,,,,,,,
play a katy or a gaga music from the episode,,,,,,a katy or a gaga music from the episode,,,,,,,
play a messenger by love the way you lie,,,,,love the way you lie,a messenger,,,,,,,
play a seat at the table by the band the rippingtons,a seat at the table,,,,the rippingtons,,,,,,,,
play a sky full of stars by colonel reyel,a sky full of stars,,,,colonel reyel,,,,,,,,
play a view of burning empires by childish gambino,,,,a view of burning empires,childish gambino,,,,,,,,
play a-team by mgk machine gun kelly,,,,a-team,mgk machine gun kelly,,,,,,,,
play aaron gillespie,,,,,aaron gillespie,,,,,,,,
play aaron zigman,,,,,aaron zigman,,,,,,,,
play abba gold by abba,,,,,,,,,,,,,
play accelerate by chaka khan,accelerate,,,,chaka khan,,,,,,,,
play accept s eighth,,,,eighth,accept,,,,,,,,
play admiral p radio,,,,,admiral p,,,,,,,,radio
play aerosmith s track,,,,track,aerosmith,,,,,,,,
play after 7 s long time lie,,,,long time lie,after 7,,,,,,,,
play again by the vaccines,,,,again,the vaccines,,,,,,,,
play ain't 2 proud 2 beg u s 7 edit by the tornados,,,,ain't 2 proud 2 beg u s 7 edit,the tornados,,,,,,,,
play ajr s 19-2000 soulchild remix,,,,19-2000 soulchild remix,ajr,,,,,,,,
play alabama 3 s first,,,,first,alabama 3,,,,,,,,
play alabama song whisky bar by victorious cast,alabama song whisky bar,,,,victorious cast,,,,,,,,
play alborosie s who dat,,,,who dat,alborosie,,,,,,,,
play alec baldwin,,,,,alec baldwin,,,,,,,,
play alex gaudino s marx and engels,,,,marx and engels,alex gaudino,,,,,,,,
play all alone by two steps from hell thomas bergersen,,,,all alone,two steps from hell thomas bergersen,,,,,,,,
play all i want by rob thomas,,,,,rob thomas,all i want,,,,,,,
play all white everything by the bravery,,,,all white everything,the bravery,,,,,,,,
play all-time faves playlist,,,,,,,all-time faves,,,,,,
play alone ea6 by cheap trick,,,,alone ea6,cheap trick,,,,,,,,
play aly aj s take a bow live from wembley stadium,,,,take a bow live from wembley stadium,aly aj,,,,,,,,
play amazing grace my chains are gone performance track in key of g with background vocals,,,,amazing grace my chains are gone performance track in key of g with background vocals,,,,,,,,,
play amen feat drake by avant,,,,amen feat drake,avant,,,,,,,,
play ameritz - karaoke s over the rainbow,,,,over the rainbow,ameritz - karaoke,,,,,,,,
play amii stewart s hits,,,,,amii stewart,,,,,,,,
play an 1930s music station,,,,,,,,,,1930s,,,
play an 2000s music station,,,,,,,,,,2000s,,,
play an album called some girls by fourth,,,,,fourth,some girls,,,,,,,
play an artist named the second,,,,,the second,,,,,,,,
play an disco station,,,,,,,,disco,,,,,
play an pop rock station,,,,,,,,pop rock,,,,,
play an tenth one station,,,,,tenth one,,,,,,,,station
play anarbor s save my night,,,,save my night,anarbor,,,,,,,,
play anchor by sido,,,,,sido,anchor,,,,,,,
play and so it goes by current singer,,,,and so it goes,current singer,,,,,,,,
play andrew peterson s bad boys live,,,,bad boys live,andrew peterson,,,,,,,,
play andrew w k s whatever you like,,,,whatever you like,andrew w k,,,,,,,,
play angels airwaves songs,,,,,angels airwaves,,,,,,,,
play anji by alison moyet,,,,anji,alison moyet,,,,,,,,
play antonio carlos jobim s that,,,,that,antonio carlos jobim,,,,,,,,
play aquilo s current dope song,,,,current dope song,aquilo,,,,,,,,
play are u there by gloriana,,,,are u there,gloriana,,,,,,,,
play are you experienced by martin jensen,are you experienced,,,,martin jensen,,,,,,,,
play are you satisfied,,,,are you satisfied,,,,,,,,,
play armin van buuren feat trevor guthrie artist,,,,,armin van buuren feat trevor guthrie,,,,,,,,
play artist s the second,,,,the second,artist,,,,,,,,
play artist tito rojas,,,,,tito rojas,,,,,,,,
play artists like dj assad,,,,,dj assad,,,,,,,,like
play atlantic city live in dublin by pussycat,,,,atlantic city live in dublin,pussycat,,,,,,,,
play atmosphere ciara album,,,,,atmosphere,ciara,,,,,,,
play audrey horne s the happiest days of our lives live,,,,the happiest days of our lives live,audrey horne,,,,,,,,
play auld wives by future hitmakers,auld wives,,,,future hitmakers,,,,,,,,
play axel tony,,,,,axel tony,,,,,,,,
play baby feat mnek sinead harnett,,,,baby feat mnek sinead harnett,,,,,,,,,
play baby i love you by taylor dayne,baby i love you,,,,taylor dayne,,,,,,,,
play baby it s cold outside feat meghan trainor by tennessee ernie ford,baby it s cold outside feat meghan trainor,,,,tennessee ernie ford,,,,,,,,
play baby lullaby s thinkin bout my ex,,,,thinkin bout my ex,baby lullaby,,,,,,,,
play babyfather by the ready set,,,,babyfather,the ready set,,,,,,,,
play back home,,,,back home,,,,,,,,,
play back like that remix by shaman s harvest,,,,back like that remix,shaman s harvest,,,,,,,,
play backseat freestyle,,,,backseat freestyle,,,,,,,,,
play bad to the bone by cloud control,bad to the bone,,,,cloud control,,,,,,,,
play baddest girl in town by terror squad,,,,,terror squad,baddest girl in town,,,,,,,
play badlands by tristam,,,,,tristam,badlands,,,,,,,
play bakermat s eighth,,,,eighth,bakermat,,,,,,,,
play band album 20th century masters the millennium collection best of the jackson 5,,,,,band,20th century masters the millennium collection best of the jackson 5,,,,,,,
play band of brothers by blackjack billy,,,,,blackjack billy,band of brothers,,,,,,,
play bands similar to manowar,,,,,manowar,,,,,,,,similar
play bands similar to wafia,,,,,wafia,,,,,,,,similar
play bands that are similar to eazy-e,,,,,eazy-e,,,,,,,,
play bandz a make her dance remix by twisted insane,bandz a make her dance remix,,,,twisted insane,,,,,,,,
play baroness s amarillo by morning,,,,amarillo by morning,baroness,,,,,,,,
play beautiful liar,,,beautiful liar,,,,,,,,,,
play beauty and the beast duet with peabo bryson from the soundtrack beauty and the beast by siouxsie and the banshees,,,,beauty and the beast duet with peabo bryson from the soundtrack beauty and the beast,siouxsie and the banshees,,,,,,,,
play beauty school by bethel music kids,,,,beauty school,bethel music kids,,,,,,,,
play because you're mine by randy houser,,,,because you're mine,randy houser,,,,,,,,
play believers never die - greatest hits by hælos,,,,,hælos,believers never die - greatest hits,,,,,,,
play beloved,,,,beloved,,,,,,,,,
play below my feet by becky g,,,,below my feet,becky g,,,,,,,,
play best of blondie by eighth one,best of blondie,,,,eighth one,,,,,,,,
play beyonce s album beyonce,,,,,,,,,,,,,
play beyonce s album beyonce,,,,,,,,,,,,,
play beyonce s album beyonce,,,,,,,,,,,,,
play beyonce s album beyonce,,,,,,,,,,,,,
play beyonce s album beyonce,,,,,,,,,,,,,
play big daddy weave,,,,,big daddy weave,,,,,,,,
play big k r i t s the ninth,,,,the ninth,big k r i t,,,,,,,,
play big river by cover pop,big river,,,,cover pop,,,,,,,,
play bill withers,,,,,bill withers,,,,,,,,
play biosphere,,,,,biosphere,,,,,,,,
play birdman s immortals,,,,immortals,birdman,,,,,,,,
play bishop paul s morton s roses,,,,roses,bishop paul s morton,,,,,,,,
play black america again by south park mexican,,,,,south park mexican,black america again,,,,,,,
play black label society zakk wylde s alive,,,,alive,black label society zakk wylde,,,,,,,,
play black market by amorphis,,,,,amorphis,black market,,,,,,,
play black star elephant by les misérables - original london cast,,,,,les misérables - original london cast,black star elephant,,,,,,,
play blackout by charlene soraia,,,,blackout,charlene soraia,,,,,,,,
play blackpool sixth and friends s tenth one,,,,tenth one,blackpool sixth and friends,,,,,,,,
play blake neely s candy perfume girl,,,,candy perfume girl,blake neely,,,,,,,,
play blake shelton,,,,,blake shelton,,,,,,,,
play blame remixes by udo lindenberg,blame remixes,,,,udo lindenberg,,,,,,,,
play blood red,,,,blood red,,,,,,,,,
play blue hawaii,,,,blue hawaii,,,,,,,,,
play bo kaspers orkester,,,,,bo kaspers orkester,,,,,,,,
play bollywood star - ajay devgn by the first,,,,,the first,bollywood star - ajay devgn,,,,,,,
play bomb the bass s breathe,,,,breathe,bomb the bass,,,,,,,,
play borderline an ode to self care by smokey robinson,,,,borderline an ode to self care,smokey robinson,,,,,,,,
play born in the u s a,,,,,,born in the u s a,,,,,,,
play boston,,,,,,boston,,,,,,,
play brad pitt s cousin feat xperience by third one,,,,brad pitt s cousin feat xperience,third one,,,,,,,,
play break on through to the other side by jon lajoie,,,,break on through to the other side,jon lajoie,,,,,,,,
play british blues from the 70s,,,,,,,,british blues,,70s,,,
play broken back s kitty kat album version,,,,kitty kat album version,broken back,,,,,,,,
play brother by funk,,,,brother,funk,,,,,,,,
play bruce reitherman s that s all right the afternoon show 2012 mix,,,,that s all right the afternoon show 2012 mix,bruce reitherman,,,,,,,,
play bryson tiller,,,,,bryson tiller,,,,,,,,
play buttons by moloko,buttons,,,,moloko,,,,,,,,
play buy me a boat,,,,,,buy me a boat,,,,,,,
play bye bye blackbird by pimp c,bye bye blackbird,,,,pimp c,,,,,,,,
play californication by pat metheny,,,,californication,pat metheny,,,,,,,,
play canadian blues music please,,,,,,,,canadian blues,,,,,
play caravan,,,,,caravan,,,,,,,,
play carlos santana song band of brothers,,,,band of brothers,carlos santana,,,,,,,,
play carola song just my imagination running away with me,,,,just my imagination running away with me,carola,,,,,,,,
play cats in the cradle by the chipmunks the chipettes,,,,cats in the cradle,the chipmunks the chipettes,,,,,,,,
play cavern by rich gang,cavern,,,,rich gang,,,,,,,,
play chance the rapper s burnin alive,,,,burnin alive,chance the rapper,,,,,,,,
play chandra kamal,,,,,chandra kamal,,,,,,,,
play changing faces s imperial attack,,,,imperial attack,changing faces,,,,,,,,
play chant of the ever circling skeletal family 2016 remastered version by guns n roses,,,,chant of the ever circling skeletal family 2016 remastered version,guns n roses,,,,,,,,
play charged up by pistol annies,,,,,pistol annies,charged up,,,,,,,
play charles brown s i know somebody,,,,i know somebody,charles brown,,,,,,,,
play chase by brigitte bardot,chase,,,,brigitte bardot,,,,,,,,
play cheerleader,,,cheerleader,,,,,,,,,,
play chief keef hits,,,,,chief keef,,,,,,,,
play chrisette michele s real love 2006 remastered version,,,,real love 2006 remastered version,chrisette michele,,,,,,,,
play christian hip hop from the 1960s,,,,,,,,christian hip hop,,1960s,,,
play christmas don't be late by this musician,christmas don't be late,,,,this musician,,,,,,,,
play christmas lights by melody gardot,,,,christmas lights,melody gardot,,,,,,,,
play chumbawamba s make the world go away,,,,make the world go away,chumbawamba,,,,,,,,
play circa survive song called spanish rose,,,,spanish rose,circa survive,,,,,,,,
play citizen cope,,,,,citizen cope,,,,,,,,
play clmd s dear no one,,,,dear no one,clmd,,,,,,,,
play club des belugas s track the fourth,,,,the fourth,club des belugas,,,,,,,,
play coastline by eighth one,,,,coastline,eighth one,,,,,,,,
play coexist by lenny cooper,coexist,,,,lenny cooper,,,,,,,,
play collabro s u ur hand,,,,u ur hand,collabro,,,,,,,,
play collection collection,,,,,,,collection,,,,,,
play come thou long expected jesus feat christy nockels,,,,come thou long expected jesus feat christy nockels,,,,,,,,,
play complicated by this,,,,,this,complicated,,,,,,,
play confessions on a dance floor by these kids wear crowns,,,,,these kids wear crowns,confessions on a dance floor,,,,,,,
play control freak by dj sammy,,,,control freak,dj sammy,,,,,,,,
play control myself by rittz,,,,control myself,rittz,,,,,,,,
play cookie by the overtones,,,,,the overtones,cookie,,,,,,,
play cool water 2016 remastered,,,,cool water 2016 remastered,,,,,,,,,
play cosculluela song snoop s upside ya head,,,,snoop s upside ya head,cosculluela,,,,,,,,
play country club by planet countdown,country club,,,,planet countdown,,,,,,,,
play country hits s me too,,,,me too,country hits,,,,,,,,
play coventry carol by vijay prakash,,,,coventry carol,vijay prakash,,,,,,,,
play cradle of filth s end of days,,,,end of days,cradle of filth,,,,,,,,
play crash and burn by editors,,,,crash and burn,editors,,,,,,,,
play crazier,,,,crazier,,,,,,,,,
play creedence clearwater revival by spongebob squarepants,,,,,spongebob squarepants,creedence clearwater revival,,,,,,,
play cristiano araújo s hits,,,,,cristiano araújo,,,,,,,,
play crown me,,,,crown me,,,,,,,,,
play crying for no reason,,,,crying for no reason,,,,,,,,,
play cuando me enamoro,,,,cuando me enamoro,,,,,,,,,
play current dope song by marcus martinus,,,,current dope song,marcus martinus,,,,,,,,
play current singer,,,,,current singer,,,,,,,,
play curtis mayfield s memories featuring kid cudi jp candela remix,,,,memories featuring kid cudi jp candela remix,curtis mayfield,,,,,,,,
play dame joan sutherland s born to run,,,,born to run,dame joan sutherland,,,,,,,,
play damon albarn s fourth,,,,fourth,damon albarn,,,,,,,,
play dance a by that artist,dance a,,,,that artist,,,,,,,,
play dance party by ben cocks feat nikisha reyes-pile,dance party,,,,ben cocks feat nikisha reyes-pile,,,,,,,,
play dancing makes us brave,,,,,,dancing makes us brave,,,,,,,
play dangerous man by young thug,dangerous man,,,,young thug,,,,,,,,
play daniel johns,,,,,daniel johns,,,,,,,,
play darius rucker,,,,,darius rucker,,,,,,,,
play datuk sharifah aini,,,,,datuk sharifah aini,,,,,,,,
play david arkenstone s feel something,feel something,,,,david arkenstone,,,,,,,,
play deana carter,,,deana carter,,,,,,,,,,
play death angel s fourth,,,,fourth,death angel,,,,,,,,
play debbie gibson s enth e nd,,,,enth e nd,debbie gibson,,,,,,,,
play declan mckenna,,,,,declan mckenna,,,,,,,,
play deee-lite s that song,,,,that song,deee-lite,,,,,,,,
play deep house music please,,,,,,,,deep house,,,,,
play definition of a thug nigga,,,,definition of a thug nigga,,,,,,,,,
play deitrick haddon,,,,,deitrick haddon,,,,,,,,
play dej loaf s satisfy you featuring r kelly,,,,satisfy you featuring r kelly,dej loaf,,,,,,,,
play departure by the sixth,departure,,,,the sixth,,,,,,,,
play derek the dominos,,,derek the dominos,,,,,,,,,,
play destroyer s american honey,,,,american honey,destroyer,,,,,,,,
play dexys midnight runners song called stardust,,,,stardust,dexys midnight runners,,,,,,,,
play diamond,,,,diamond,,,,,,,,,
play diamond rio s it,,,,it,diamond rio,,,,,,,,
play diana krall s this song,,,,this song,diana krall,,,,,,,,
play diary of a madman by sixth one,diary of a madman,,,,sixth one,,,,,,,,
play dietrich fischer-dieskau,,,,,dietrich fischer-dieskau,,,,,,,,
play digital underground s rise above feat pharrell tuki carter amber rose,,,,rise above feat pharrell tuki carter amber rose,digital underground,,,,,,,,
play dillon,,,,,dillon,,,,,,,,
play dion the belmonts s this,,,,this,dion the belmonts,,,,,,,,
play dirt by jon english,,,,dirt,jon english,,,,,,,,
play dirt off your shoulder lying from you by amanda seyfried,,,,dirt off your shoulder lying from you,amanda seyfried,,,,,,,,
play disarm you feat ilsey,,,disarm you feat ilsey,,,,,,,,,,
play disco fever,,,,,disco fever,,,,,,,,
play dj cassidy,,,,,dj cassidy,,,,,,,,
play dj s k t artist,,,,,dj s k t,,,,,,,,
play dj ötzi s country song,,,,country song,dj ötzi,,,,,,,,
play django and jimmie by les misérables - 10th anniversary concert cast,,,,,les misérables - 10th anniversary concert cast,django and jimmie,,,,,,,
play do you want the truth or something beautiful,,,,,,do you want the truth or something beautiful,,,,,,,
play dogs of war by gary puckett the union gap,,,,dogs of war,gary puckett the union gap,,,,,,,,
play don omar,,,,,don omar,,,,,,,,
play don't matter by adriana caselotti,,,,don't matter,adriana caselotti,,,,,,,,
play don't say goodnight by puhdys,,,,don't say goodnight,puhdys,,,,,,,,
play don't stop glee cast version by choirboys,,,,don't stop glee cast version,choirboys,,,,,,,,
play donald lawrence s a thousand years,,,,a thousand years,donald lawrence,,,,,,,,
play dragonforce,,,,,dragonforce,,,,,,,,
play drake kyla wizkid,,,,,drake kyla wizkid,,,,,,,,
play dreamer by los inquietos del norte,,,,dreamer,los inquietos del norte,,,,,,,,
play dru hill s the last,,,,the last,dru hill,,,,,,,,
play dub tunes from 70s,,,,,,,,dub,,70s,,,
play dust bowl,,,,dust bowl,,,,,,,,,
play eason chan s it is you,,,,it is you,eason chan,,,,,,,,
play ed harcourt s toxic remastered,,,,toxic remastered,ed harcourt,,,,,,,,
play eden kane,,,,,eden kane,,,,,,,,
play edge of glory glee cast version by goanna,edge of glory glee cast version,,,,goanna,,,,,,,,
play egoist by air supply,,,,egoist,air supply,,,,,,,,
play eighth,,,,eighth,,,,,,,,,
play eighth by color me badd,,,,eighth,color me badd,,,,,,,,
play eighth one,,,,eighth one,,,,,,,,,
play eighth one by singer,,,,,singer,eighth one,,,,,,,
play eighth one s warning call,,,,warning call,eighth one,,,,,,,,
play eighth s you mine,,,,you mine,eighth,,,,,,,,
play eko fresh,,,,,eko fresh,,,,,,,,
play elvin bishop s lying from you live lp underground tour 2003,,,,lying from you live lp underground tour 2003,elvin bishop,,,,,,,,
play empire music from unto the breach by redman,,,,,redman,empire music from unto the breach,,,,,,,
play empire part 2 by los huracanes del norte,empire part 2,,,,los huracanes del norte,,,,,,,,
play energetic songs,,,,,,,,,energetic,,,,
play enjoy the ride by energy 52,,,,,energy 52,enjoy the ride,,,,,,,
play epic rap battles of history s the jean genie live 2016 remastered version,,,,the jean genie live 2016 remastered version,epic rap battles of history,,,,,,,,
play eric benét s current song,,,,current song,eric benét,,,,,,,,
play eric carmen s overture the magic flute k 620,,,,overture the magic flute k 620,eric carmen,,,,,,,,
play eriksen s certified,,,,certified,eriksen,,,,,,,,
play evanescence,,,,,evanescence,,,,,,,,
play evans blue,,,,,evans blue,,,,,,,,
play eve 6,,,,,eve 6,,,,,,,,
play every teardrop is a waterfall by amy winehouse,every teardrop is a waterfall,,,,amy winehouse,,,,,,,,
play existen los ángeles by john mark mcmillan,,,,existen los ángeles,john mark mcmillan,,,,,,,,
play exit by the fifth,exit,,,,the fifth,,,,,,,,
play experiencia religiosa,,,,experiencia religiosa,,,,,,,,,
play f kin problems by first,f kin problems,,,,first,,,,,,,,
play f me i'm famous 2013,,,,,,f me i'm famous 2013,,,,,,,
play fake plastic trees acoustic version by space,,,,fake plastic trees acoustic version,space,,,,,,,,
play famous last words album version by jesse cook,,,,famous last words album version,jesse cook,,,,,,,,
play father of lights,,,,father of lights,,,,,,,,,
play fats waller s sober,,,,sober,fats waller,,,,,,,,
play fear factory s panic station live at rome olympic stadium,,,,panic station live at rome olympic stadium,fear factory,,,,,,,,
play feel,,,,,,feel,,,,,,,
play feel the tide by sound ideas,,,,feel the tide,sound ideas,,,,,,,,
play feliz navidad by young mc,,,,feliz navidad,young mc,,,,,,,,
play fifth,,,,,fifth,,,,,,,,
play fifth one,,,,,,fifth one,,,,,,,
play fifth one by eighth one,,,,,eighth one,fifth one,,,,,,,
play fifth one by fifth,,,,fifth one,fifth,,,,,,,,
play fifth one by them,,,,,them,fifth one,,,,,,,
play fifth one s current playing song,,,,current playing song,fifth one,,,,,,,,
play fifth one s kill all your friends live demo,,,,kill all your friends live demo,fifth one,,,,,,,,
play fifth one s love illumination,,,,love illumination,fifth one,,,,,,,,
play fifth one s truck yeah,,,,truck yeah,fifth one,,,,,,,,
play finna get loose feat pharrell williams - single,,,,,,finna get loose feat pharrell williams - single,,,,,,,
play first,,,,first,,,,,,,,,
play first,,,,,first,,,,,,,,
play first,,,,first,,,,,,,,,
play first,,,,first,,,,,,,,,
play first s red light spells danger,,,,red light spells danger,first,,,,,,,,
play first s yellow stone,,,,yellow stone,first,,,,,,,,
play flashpoint,,,,,,flashpoint,,,,,,,
play flights skype by first one,,,,flights skype,first one,,,,,,,,
play flow remastered version,,,flow remastered version,,,,,,,,,,
play flyleaf,,,,,,flyleaf,,,,,,,
play follow the leader by eighth one,,,,,eighth one,follow the leader,,,,,,,
play forever the sickest kids,,,,,forever the sickest kids,,,,,,,,
play forever the soundtrack,,,,,,forever,,,,,,,
play forget what you look like,,,,forget what you look like,,,,,,,,,
play fourth one,,,,fourth one,,,,,,,,,
play fourth one by yuna,,,,,yuna,fourth one,,,,,,,
play fourth s thinking of you,,,,thinking of you,fourth,,,,,,,,
play fourth s what do i have to do,what do i have to do,,,,fourth,,,,,,,,
play framing hanley s megaman,,,,megaman,framing hanley,,,,,,,,
play frank wilson s zouk-la-sé medikaman nou ni,,,,zouk-la-sé medikaman nou ni,frank wilson,,,,,,,,
play franz schubert s trapped in the closet chapter 11,,,,trapped in the closet chapter 11,franz schubert,,,,,,,,
play freebase by freddie mcgregor,freebase,,,,freddie mcgregor,,,,,,,,
play frisco album ninth one,,,,,frisco,ninth one,,,,,,,
play from ashes to new,,,,,from ashes to new,,,,,,,,
play from the inside by love affair,,,,,love affair,from the inside,,,,,,,
play from yesterday by second,from yesterday,,,,second,,,,,,,,
play front door by the white buffalo,,,,front door,the white buffalo,,,,,,,,
play future hearts by henrique juliano,,,,,henrique juliano,future hearts,,,,,,,
play g v prakash kumar,,,g v prakash kumar,,,,,,,,,,
play games,,,,games,,,,,,,,,
play gasoline by seventh,,,,gasoline,seventh,,,,,,,,
play george formby s ice cream man 2015 remastered version,,,,ice cream man 2015 remastered version,george formby,,,,,,,,
play get away by miranda lambert,,,,get away,miranda lambert,,,,,,,,
play get sum by the wolfe tones,,,,,the wolfe tones,get sum,,,,,,,
play ghost nets by george thorogood the destroyers,,,,ghost nets,george thorogood the destroyers,,,,,,,,
play ghost town by showtek,,,,,showtek,ghost town,,,,,,,
play ghosttown by elvin bishop,ghosttown,,,,elvin bishop,,,,,,,,
play glad you came by natasha bedingfield,glad you came,,,,natasha bedingfield,,,,,,,,
play glory days by riton,glory days,,,,riton,,,,,,,,
play go andrew claristidge remix by game,,,,,game,go andrew claristidge remix,,,,,,,
play go get it by mystery jets,,,,,mystery jets,go get it,,,,,,,
play good charlotte s album the best of canned heat,,,,,good charlotte,the best of canned heat,,,,,,,
play good grief by five for fighting,good grief,,,,five for fighting,,,,,,,,
play goodbye yellow brick road by big brother the holding company,goodbye yellow brick road,,,,big brother the holding company,,,,,,,,
play gorilla feat r kelly and pharrell,,,,,,gorilla feat r kelly and pharrell,,,,,,,
play grace legacy edition by jay rock,,,,,jay rock,grace legacy edition,,,,,,,
play gracie fields s feel the light,,,,feel the light,gracie fields,,,,,,,,
play greatest hits,,,,,,greatest hits,,,,,,,
play greatest hits by sash,,,,,sash,greatest hits,,,,,,,
play green light by sixth,,,,green light,sixth,,,,,,,,
play green valley by sovereign grace music,green valley,,,,sovereign grace music,,,,,,,,
play groove is in the heart by new years day,,,,groove is in the heart,new years day,,,,,,,,
play guardians of the galaxy awesome mix vol 1 by tone-loc,guardians of the galaxy awesome mix vol 1,,,,tone-loc,,,,,,,,
play guillotine iv the final chapter by first one,,,,guillotine iv the final chapter,first one,,,,,,,,
play gusgus fourth album,,,,,gusgus,fourth,,,,,,,
play happy up here by the last,,,,,the last,happy up here,,,,,,,
play hardcore radio hits,,,,,,,,hardcore,,,,,
play hark the herald angels sing by aaron gillespie,hark the herald angels sing,,,,aaron gillespie,,,,,,,,
play harry belafonte s talk to em,,,,talk to em,harry belafonte,,,,,,,,
play harry nilsson,,,,,harry nilsson,,,,,,,,
play hate me now,,,,hate me now,,,,,,,,,
play hate to see you go by the presidents of the united states of america,,,,hate to see you go,the presidents of the united states of america,,,,,,,,
play have you met miss jones swing when version by steps,,,,have you met miss jones swing when version,steps,,,,,,,,
play have yourself a merry little christmas by black dyke band,,,,have yourself a merry little christmas,black dyke band,,,,,,,,
play hawthorne heights,,,,,hawthorne heights,,,,,,,,
play he s killpop,,,,killpop,he,,,,,,,,
play he s mind of mindd intro,,,,mind of mindd intro,he,,,,,,,,
play he s pop style,,,,pop style,he,,,,,,,,
play heartbeat,,,,heartbeat,,,,,,,,,
play heathens by sébastien tellier,,,,heathens,sébastien tellier,,,,,,,,
play heatwave feat akon deepend remix by cliff richard and the shadows,,,,heatwave feat akon deepend remix,cliff richard and the shadows,,,,,,,,
play heavy heart by intro,,,,heavy heart,intro,,,,,,,,
