RemoveServiceQ,RemoveServiceA
assistant remove current twitter account,twitter
buddy please remove gmail service,gmail
can you remove my Twitter account?,Twitter
cancel my netflix account please,netflix
Choose Pocket app from your list and uninstall it.,Pocket
close my account on facebook,facebook
Deactivate my Twitter account now.,Twitter
delete account twitter,twitter
Delete account,
delete email app,email
delete fb messenger,fb messenger
delete gmail account,gmail
Delete gmail account.,gmail
delete my Facebook account,Facebook
Delete my gmail account,gmail
Delete my Instagram account.,Instagram
Delete my Instagram,Instagram
Delete my twitter account,twitter
delete my uber account,uber
Delete my Uber account.,Uber
Delete the Facebook service,Facebook
delete my hotmail cinamon_heart@hotmail.com,hotmail
Delete the Uber app,Uber
delete the uber app,uber
delete the uber app,uber
Delete Twitter account,Twitter
Delete twitter app.,twitter
delete twitter,twitter
Delete Uber Account,Uber
Delete Uber app,Uber
Delete Uber app.,Uber
Delete Uber from my list of services,Uber
delete uber from my phone,uber
Delete uber services from my phone.,uber
Delete Uber,Uber
Delete Yahoo email app,Yahoo
delete yahoo from my account,yahoo
Erase my Twitter account. Erase all associated files.,Twitter
Erase Twitter,Twitter
Get rid of my uber account.,uber
go to settings and remove the gmail app.,gmail
goto settings and remove my twitter account,twitter
hey remove uber app,uber
I want to remove my firefox account,firefox
I want to remove my gmail account,gmail
I want to remove my gmail account.,gmail
I want to remove my Twitter account,Twitter
I want to remove my twitter account.,twitter
I want to remove Uber from the automated voice assistant.,Uber
I would like Twitter deleted from my iPhone.,Twitter
PLEASE ASSISTANT REMOVE EMAIL SERVICE,EMAIL
Please delete my Facebook account.,Facebook
Please delete my gmail account.,gmail
Please delete my Hotmail account.,Hotmail
Please delete my twitter account.,twitter
Please delete my yahoo email account,yahoo
Please delete twitter from my phone.,twitter
Please do remover my email account from yahoo.,yahoo
please kindly remove this account for me,this
please remove GMAIL from my mail accounts,GMAIL
please remove gmail,gmail
Please remove lyft from my phone,lyft
Please remove my email,email
please remove my gmail account,gmail
Please remove my google mail account,google mail
Please remove my Twitter account from your voice assistance list,Twitter
Please remove my uber account from this device,uber
Please remove my YMail account from this phone.,YMail
please remove the account ciccio@hotmail.com from twitter,twitter
please remove the chat on application for i don't use it much,chat on
Please remove the uber app from my device,Uber
Please remove twitter account,twitter
Please remove twitter from my cell.,twitter
please remove twitter from my phone,twitter
Please remove twitter username maxamillion from my stored twitter accounts.,twitter
Please remove twitter,twitter
please remove Uber account,Uber
Please uninstall Facebook,Facebook
Remove account: email,email
Remove an email account from my phone,email
Remove application Gmail,Gmail
Remove e-mail account,e-mail
Remove email account lmlfancy@gmail.com from Gmail.,Gmail
Remove email account,email
remove email from my account,email
Remove facebook from the phone.,facebook
remove gmail account from email,gmail
remove gmail account from this device,gmail
remove gmail account from this phone,gmail
Remove Gmail Account,Gmail
remove gmail from email accounts,gmail
Remove Gmail,Gmail
Remove hotmail account from phone.,hotmail
remove hotmail account,hotmail
Remove hotmail account.,hotmail
remove hotmail from my device,hotmail
remove linkedin,linkedin
Remove my Aol account from the phone,Aol
Remove my facebook account from device with username tarunmahajan34.,facebook
remove my gmail account,gmail
Remove my Gmail account,Gmail
Remove my Gmail account,Gmail
Remove my gmail account,gmail
remove my gmail account,gmail
remove my personal email account,email
Remove my personal GMail account,GMail
remove my twitter account @turkerm,twitter
remove my twitter account from the device,twitter
Remove my twitter account from the home screen,twitter
Remove my Twitter account,Twitter
Remove my Twitter account,Twitter
Remove my twitter account,twitter
Remove my twitter account.,twitter
Remove my uber account,uber
Remove my uber account,uber
REMOVE MY UBER ACCOUNT,UBER
Remove my uber account,uber
Remove my yahoo account.,yahoo
Remove my yahoo account.,yahoo
Remove my Yahoo email address I added.,Yahoo
remove or delete gmail account,gmail
Remove service twitter confirm,twitter
Remove the account of email,email
Remove the app Twitter.,Twitter
Remove the Facebook app from my phone,Facebook
Remove the gmail email account newuser@gmail.com,gmail
Remove the outlook account,outlook
remove the service amazon,amazon
Remove the service twitter from the menu.,twitter
Remove the twitter service.,twitter
Remove the uber app,uber
Remove the uber application.,uber
REMOVE THE UBER SERVICE,UBER
Remove twitter account,twitter
remove twitter account,twitter
remove twitter account,twitter
Remove twitter,twitter
REMOVE TWITTER,TWITTER
Remove Twitter.,Twitter
Remove uber account,uber
Remove Uber account,Uber
Remove Uber app from phone.,Uber
Remove uber app,uber
remove uber from my phone,uber
Remove uber from the list,uber
remove uber on my device,uber
remove uber service,uber
Remove Uber,Uber
remove uber,uber
remove uber,uber
Remove Viber from Services,Viber
remove yahoo account,yahoo
Remove my Uber app account from phone.,Uber
uninstall gmail application.,gmail
Uninstall Ola Cabs,Ola Cabs
Uninstall the Uber app,Uber
uninstall Twitter,Twitter
Uninstall twitter,twitter
uninstall twitter,twitter
Uninstall Uber.,Uber
