TransportTaxiEstimateTravelFareQ,TransportTaxiEstimateTravelFareTaxiType,TransportTaxiEstimateTravelFareOrigin,TransportTaxiEstimateTravelFareDestination
please list cost for uber fast lane ride to sixth one,uber fast lane,,sixth one
please list cost for uber x ride to Aniar,uber x,,Aniar
please list cost for uber x ride to that location,uber x,,that location
please list cost for uberselect ride to that location,uberselect,,that location
please list cost for uberx ride to Historic Core,uberx,,Historic Core
please search for me the estimated fare by exec large to reach Bank of the South,exec large,,Bank of the South
please search for me the estimated fare by taxi to reach the fifth,taxi,,the fifth
please search for me the estimated fare by uber fast lane to reach Westfarms Mall,uber fast lane,,Westfarms Mall
please search for me the estimated fare by ubert to reach Cosanti,ubert,,Cosanti
please search for me the estimated fare by uberxl to reach the first,uberxl,,the first
please tell me what the estimated fare will be to use an uber plus car to get to the home,uber plus,,home
please tell me what the estimated fare will be to use an uber pool car to get to the the third,uber pool,,the third
please tell me what the estimated fare will be to use an uber t car to get to the The Lab,uber t,,The Lab
please tell me what the estimated fare will be to use an uber x car to get to the Pizza Inn,uber x,,Pizza Inn
please tell me what the estimated fare will be to use an uber xl car to get to the second,uber xl,,second
please tell me what the estimated fare will be to use an uberfamily car to get to the Jasper Mall,uberfamily,,Jasper Mall
please tell me what the estimated fare will be to use an uberpool car to get to the home,uberpool,,home
please tell me what the estimated fare will be to use an uberselect car to get to the Papa Cristo s,uberselect,,Papa Cristo s
please tell me what the estimated fare will be to use an ubersuv car to get to the Tyler Park,ubersuv,,Tyler Park
please tell me what the estimated fare will be to use an uberxl car to get to the fifth,uberxl,,fifth
please tell me what the estimated fare will be to use an wav car to get to the Flemings Hotel,wav,,Flemings Hotel
pool car service fare to the work,pool,,work
pool fare from Jake s Wayback Burgers to Vossius,pool,Jake s Wayback Burgers,Vossius
pool how much does it cost to go from Junior s Grill to South Ozone Park,pool,Junior s Grill,South Ozone Park
prices of execlarge services to the second,execlarge,,the second
prices of uber pool services to Outback Steakhouse,uber pool,,Outback Steakhouse
prices of uber xl services to Disney s Persian Resort,uber xl,,Disney s Persian Resort
prices of uberfastlane services to Beef O'Brady s,uberfastlane,,Beef O'Brady s
provide the estimate fare for lux to drop me off at the the ninth from Lone Star Steakhouse & Saloon,lux,Lone Star Steakhouse & Saloon,the ninth
provide the estimate fare for taxi to drop me off at the Penrose from fifth,taxi,fifth,Penrose
provide the estimate fare for uber airport to drop me off at the home from fifth,uber airport,fifth,home
provide the estimate fare for uber black to drop me off at the Parmatown Mall from Signature Bank,uber black,Signature Bank,Parmatown Mall
provide the estimate fare for uber fast lane to drop me off at the Blue Ribbon Barbecue from home,uber fast lane,home,Blue Ribbon Barbecue
provide the estimate fare for uber fast lane to drop me off at the that from the fourth,uber fast lane,the fourth,that
provide the estimate fare for uber fastlane to drop me off at the the tenth from West Hotel,uber fastlane,West Hotel,the tenth
provide the estimate fare for uber pool to drop me off at the that from work,uber pool,work,that
provide the estimate fare for uber select to drop me off at the Indianapolis Museum of Contemporary Art from Austin Airport,uber select,Austin Airport,Indianapolis Museum of Contemporary Art
provide the estimate fare for uberblack to drop me off at the Acquavella Galleries from Naval Air Station Brunswick,uberblack,Naval Air Station Brunswick,Acquavella Galleries
provide the estimate fare for uberfastlane to drop me off at the work from first one,uberfastlane,first one,work
provide the estimate fare for uberplus to drop me off at the SITE Santa Fe from Spotsylvania Towne Centre,uberplus,Spotsylvania Towne Centre,SITE Santa Fe
provide the estimate fare for ubert to drop me off at the work from Fairbanks International Airport,ubert,Fairbanks International Airport,work
provide the estimate fare for uberxl to drop me off at the Cheba Hut from Branchville,uberxl,Branchville,Cheba Hut
request estimated fare uberxl to Paris Gibson Square Museum of Art,uberxl,,Paris Gibson Square Museum of Art
result estimated fare uber select to home,uber select,,home
result estimated fare uberplus to the tenth,uberplus,,the tenth
search for the estimated fare by uber plus to reach home,uber plus,,home
search for the estimated fare by uber suv to reach Indianapolis Executive Airport,uber suv,,Indianapolis Executive Airport
search for the estimated fare by ubergo to reach second,ubergo,,second
show estimated execlarge fare to home from Austin Museum of Digital Art,execlarge,Austin Museum of Digital Art,home
show estimated lux fare to the sixth from Southeastern Center for Contemporary Art,lux,Southeastern Center for Contemporary Art,the sixth
show estimated taxi fare to that location,taxi,,that location
show estimated uber family fare to Naval Air Station Point Mugu from Governor s Residence,uber family,Governor s Residence,Naval Air Station Point Mugu
show exec large charge to Lum s,exec large,,Lum s
show exec large charge to Pine Tavern,exec large,,Pine Tavern
show execlarge charge to Bank of the South from home,execlarge,home,Bank of the South
show execlarge charge to eighth one from Wells Fargo,execlarge,Wells Fargo,eighth one
show fare for ninth with uberlux,uberlux,,ninth
show fare for tenth one with exec,exec,,tenth one
show fare for this with LIVEUP VIP,LIVEUP VIP,,this
show me the best price of LIVEUPVIP for a travel from Boca Raton Airport to MetroCentre Mall,LIVEUPVIP,Boca Raton Airport,MetroCentre Mall
show me the best price of uber x for a travel from L'Atelier de Joël Robuchon to Pimlico,uber x,L'Atelier de Joël Robuchon,Pimlico
show me the best price of uberpool for a travel from fourth one to Bohemian National Home,uberpool,fourth one,Bohemian National Home
show me the best price of uberx for a travel from Jen Bekman Gallery to BNC Bank,uberx,Jen Bekman Gallery,BNC Bank
show me the best price of uberx for a travel from The Nosh Bar to the last,uberx,The Nosh Bar,the last
show me the estimated fare of exec to reach sixth one,exec,,sixth one
show me the estimated fare of uber select to reach tenth,uber select,,tenth
show uber black charge to Springdale Mall from second,uber black,second,Springdale Mall
show uber español charge to Caesar Park,uber español,,Caesar Park
show uber exec charge to that one,uber exec,,that one
show uber fast lane charge to Nyländska Jaktklubben from ninth one,uber fast lane,ninth one,Nyländska Jaktklubben
show uber fastlane show fare to eighth one,uber fastlane,,eighth one
show uber fastlane show fare to the ninth,uber fastlane,,the ninth
show uber plus charge to Cheeseburger in Paradise,uber plus,,Cheeseburger in Paradise
show uber select charge to Baltimore/Washington International Thurgood Marshall Airport,uber select,,Baltimore/Washington International Thurgood Marshall Airport
show uber select charge to Fairmont Monte Carlo from the first,uber select,the first,Fairmont Monte Carlo
show uber select charge to ninth one,uber select,,ninth one
show uber x show fare to Iverson Mall,uber x,,Iverson Mall
show uberairport show fare to the fourth,uberairport,,the fourth
show uberespañol charge to Modern Diner from Le Calandre,uberespañol,Le Calandre,Modern Diner
show uberespañol show fare to Del Amo Fashion Center,uberespañol,,Del Amo Fashion Center
show uberexec charge to Century Bank,uberexec,,Century Bank
show uberfamily show fare to First Nebraska Bank,uberfamily,,First Nebraska Bank
show ubergo show fare to tenth,ubergo,,tenth
show uberlux show fare to Plummers Hotel,uberlux,,Plummers Hotel
show uberplus charge to home from Moody National Bank,uberplus,Moody National Bank,home
show uberselect show fare to the eighth,uberselect,,the eighth
taxi estimate fare from Lumen Eclipse to ninth,taxi,Lumen Eclipse,ninth
taxi estimated price from that to Kerns,taxi,that,Kerns
taxi fare from Cross County Shopping Center to Ray s Hell Burger,taxi,Cross County Shopping Center,Ray s Hell Burger
taxi fare from The Mall at Lexington Green to Apple Bank for Savings,taxi,The Mall at Lexington Green,Apple Bank for Savings
taxi fee to the second,taxi,,the second
taxi how much to go to the Bank of North Dakota,taxi,,Bank of North Dakota
taxi service prices to eighth,taxi,,eighth
taxi taxi fare for Habib s,taxi,,Habib s
taxi what would be the approximate cost to travel from Bank of the South to first one,taxi,Bank of the South,first one
taxi what would be the approximate cost to travel from work to Bird-in-Hand Hotel,taxi,work,Bird-in-Hand Hotel
tell me how much it costs to exec large work from Kinston Regional Jetport,exec large,Kinston Regional Jetport,work
tell me how much it costs to uber x Bay Plaza Shopping Center from Hooters,uber x,Hooters,Bay Plaza Shopping Center
tell me the cost of uber family to West Ashley,uber family,,West Ashley
tell me the cost of uber fastlane to Workshop Kitchen + Bar,uber fastlane,,Workshop Kitchen + Bar
tell me the fare of LIVEUPVIP cabs between Fidelity Bank to fifth,LIVEUPVIP,Fidelity Bank,fifth
tell me the fare of LIVEUPVIP cabs between my location to the tenth,LIVEUPVIP,,the tenth
tell me the fare of lux cabs between my location to Orlando Sanford International Airport,lux,,Orlando Sanford International Airport
tell me the fare of the car service LIVEUP VIP to the destination first,LIVEUP VIP,,first
tell me the fare of the car service exec large to the destination James Clements Municipal Airport,exec large,,James Clements Municipal Airport
tell me the fare of the car service exec to the destination E.M Stanton Catchment,exec,,E.M Stanton Catchment
tell me the fare of the car service taxi to the destination Spirit Valley,taxi,,Spirit Valley
tell me the fare of the car service uber suv to the destination Pengwern Arms Hotel,uber suv,,Pengwern Arms Hotel
tell me the fare of the car service uberblack to the destination that location,uberblack,,that location
tell me the fare of the car service ubergo to the destination Allston-Brighton,ubergo,,Allston-Brighton
tell me the fare of the car service uberpool to the destination Asia Bank,uberpool,,Asia Bank
tell me the fare of the car service uberxl to the destination Amber,uberxl,,Amber
tell me the fare of the car service uberxl to the destination Bombay Bicycle Club,uberxl,,Bombay Bicycle Club
tell me the fare of uber pool cabs between my location to there,uber pool,,there
tell me the fare of uberblack cabs between Indian Creek USFS Airport to second one,uberblack,Indian Creek USFS Airport,second one
tell me the fare of uberespañol cabs between New Image Art to Nampa Municipal Airport,uberespañol,New Image Art,Nampa Municipal Airport
tell me the fare of uberselect cabs between Battle of the Hotel Nacional of Cuba to tenth one,uberselect,Battle of the Hotel Nacional of Cuba,tenth one
tell me the fare of uberx cabs between Puerto Rico Museum of Contemporary Art to Creston-Kenilworth,uberx,Puerto Rico Museum of Contemporary Art,Creston-Kenilworth
tell me the price of an lux ride to Security Square Mall from First Bank of the United States,lux,First Bank of the United States,Security Square Mall
tell me the price of an uber exec ride to tenth one from Bakersfield Municipal Airport,uber exec,Bakersfield Municipal Airport,tenth one
tell me the price of an uber go ride to Wilshire Center from Reliance Bank,uber go,Reliance Bank,Wilshire Center
tell me the price of an uberlux ride to Exchange coffee house from third,uberlux,third,Exchange coffee house
tell me the price of an uberpool ride to the fourth from Hotel New Otani Makuhari,uberpool,Hotel New Otani Makuhari,the fourth
tell me what the estimated fare would be to go to the De Kersentuin for uber go,uber go,,De Kersentuin
tell me what the estimated fare would be to go to the First National Bank of Charlotte for execlarge,execlarge,,First National Bank of Charlotte
tell me what the estimated fare would be to go to the Lighthouse Inn for uber x,uber x,,Lighthouse Inn
tell me what the estimated fare would be to go to the Señor Frog s for uber x,uber x,,Señor Frog s
to reach Albany International Airport how much i have to pay in uber go,uber go,,Albany International Airport
to reach Bank of North Dakota how much i have to pay in uberblack,uberblack,,Bank of North Dakota
to reach Bemis Park Landmark Heritage District how much i have to pay in uberpool,uberpool,,Bemis Park Landmark Heritage District
to reach Big Town Mall how much i have to pay in uberxl,uberxl,,Big Town Mall
to reach first one how much i have to pay in uberfastlane,uberfastlane,,first one
to reach second one how much i have to pay in uberfastlane,uberfastlane,,second one
to reach tenth how much i have to pay in uberespañol,uberespañol,,tenth
to reach the tenth how much i have to pay in wav,wav,,the tenth
to reach there how much i have to pay in exec,exec,,there
uber airport car service fare to the home,uber airport,,home
uber airport how much will the fare be to get from Hotel New Otani Makuhari to Hotel Baker,uber airport,Hotel New Otani Makuhari,Hotel Baker
uber airport how much will the fare be to get from first one to the ninth,uber airport,first one,the ninth
uber airport taxi fare for The Maine Mall,uber airport,,The Maine Mall
uber black service prices to Bitforms gallery,uber black,,Bitforms gallery
uber black taxi fare for Childress Municipal Airport,uber black,,Childress Municipal Airport
uber black what would be the approximate cost to travel from Middleton Field to Royal Castle Hotel,uber black,Middleton Field,Royal Castle Hotel
uber español fare from Mall at Green Hills to last one,uber español,Mall at Green Hills,last one
uber español fare from that location to tenth,uber español,that location,tenth
uber español how much to go to the Los Angeles Contemporary Exhibitions,uber español,,Los Angeles Contemporary Exhibitions
uber español taxi fare for Bel Canto,uber español,,Bel Canto
uber exec fare from Albus Cavus to Foxy Production,uber exec,Albus Cavus,Foxy Production
uber exec fare from third to home,uber exec,third,home
uber exec fee to seventh one,uber exec,,seventh one
uber exec what would be the approximate cost to travel from home to that place,uber exec,home,that place
uber family car service fare to the that,uber family,,that
uber family cost to reach Hotel Kinston,uber family,,Hotel Kinston
uber family how much will the fare be to get from Bronwyn Keenan Gallery to the first,uber family,Bronwyn Keenan Gallery,the first
uber family service prices to second one,uber family,,second one
uber fast lane fare from The Manor House Hotel to Charles Egan Gallery,uber fast lane,The Manor House Hotel,Charles Egan Gallery
uber fast lane fare from the fifth to ninth one,uber fast lane,the fifth,ninth one
uber fast lane fare from the third to Florian Papp,uber fast lane,the third,Florian Papp
uber fast lane fare from there to sixth one,uber fast lane,there,sixth one
uber fast lane service prices to third,uber fast lane,,third
uber fastlane car service fare to the Burnt District,uber fastlane,,Burnt District
uber fastlane car service fare to the the sixth,uber fastlane,,the sixth
uber fastlane fare from the seventh to SculptureCenter,uber fastlane,the seventh,SculptureCenter
uber go can i get a ride estimate to Pine Street Art Works,uber go,,Pine Street Art Works
uber go estimate fare from Mutual Bank to Lehman Brothers,uber go,Mutual Bank,Lehman Brothers
uber go estimate fare from Studio to Cracker Barrel,uber go,Studio,Cracker Barrel
uber go fare from Schwarz Gallery to Parkrose,uber go,Schwarz Gallery,Parkrose
uber go how much to go to the First Financial Bank,uber go,,First Financial Bank
uber plus Grove Park estimation of fare,uber plus,,Grove Park
uber plus car service fare to the North Park,uber plus,,North Park
uber plus car service fare to the eighth,uber plus,,eighth
uber plus how much does it cost to go from Chuck-A-Rama to Hammond Heights,uber plus,Chuck-A-Rama,Hammond Heights
uber plus how much does it cost to go from tenth one to fifth one,uber plus,tenth one,fifth one
uber plus how much will the fare be to get from the third to there,uber plus,the third,there
uber plus taxi fare for Hard Rock Cafe,uber plus,,Hard Rock Cafe
uber pool service prices to Stonestown Galleria,uber pool,,Stonestown Galleria
uber select fare from that location to Katonah Museum of Art,uber select,that location,Katonah Museum of Art
uber select fee to eighth,uber select,,eighth
uber suv estimate fare from Greenville Mall to Valley Station,uber suv,Greenville Mall,Valley Station
uber suv fare to Branson Airport,uber suv,,Branson Airport
uber suv how much to go to the First Federal Bank,uber suv,,First Federal Bank
uber suv how much to go to the first,uber suv,,first
uber suv how much to go to the work,uber suv,,work
uber suv service prices to Lumière,uber suv,,Lumière
uber t Orange Park Mall estimation of fare,uber t,,Orange Park Mall
uber t estimate fare from Puerto Rico Museum of Contemporary Art to the fourth,uber t,Puerto Rico Museum of Contemporary Art,the fourth
uber t estimated price from Gardner Municipal Airport to New Image Art,uber t,Gardner Municipal Airport,New Image Art
uber t fare from the second to River City Marketplace,uber t,the second,River City Marketplace
uber t how much will the fare be to get from The Art Gallery at the University of Maryland to Tenkaippin,uber t,The Art Gallery at the University of Maryland,Tenkaippin
uber x car service fare to the W Hong Kong,uber x,,W Hong Kong
uber x car service fare to the the second,uber x,,the second
uber x cost to reach Davis Field,uber x,,Davis Field
uber x cost to reach the second,uber x,,the second
uber x how much will the fare be to get from The Forum Shops at Caesars to eighth,uber x,The Forum Shops at Caesars,eighth
uber x service prices to Conchas Lake Airport,uber x,,Conchas Lake Airport
uber x service prices to fifth one,uber x,,fifth one
uber xl NorthPark Mall estimated fare,uber xl,,NorthPark Mall
uber xl car service fare to the Borough Park,uber xl,,Borough Park
uber xl estimate fare from ninth one to Vandenberg Air Force Base,uber xl,ninth one,Vandenberg Air Force Base
uber xl fare from Beaver Valley Mall to Burbank,uber xl,Beaver Valley Mall,Burbank
uber xl how much does it cost to go from ninth to South Square Mall,uber xl,ninth,South Square Mall
uberairport car service fare to the that location,uberairport,,that location
uberairport fare from Fuddruckers to work,uberairport,Fuddruckers,work
uberairport fare from Kimpton Hotel Vintage Portland to seventh,uberairport,Kimpton Hotel Vintage Portland,seventh
uberairport how much to go to the Westfield Southlake,uberairport,,Westfield Southlake
uberairport how much will the fare be to get from tenth one to The Alternative Museum,uberairport,tenth one,The Alternative Museum
uberblack can i get a ride estimate to seventh one,uberblack,,seventh one
uberblack car service fare to the Molen de Dikkert,uberblack,,Molen de Dikkert
uberblack car service fare to the the tenth,uberblack,,the tenth
uberblack estimated price from Edsbacka krog to that,uberblack,Edsbacka krog,that
uberblack estimated price from the first to Center Hill,uberblack,the first,Center Hill
uberblack fee to the last,uberblack,,the last
uberblack service prices to Korchma Taras Bulba,uberblack,,Korchma Taras Bulba
uberespañol estimate fare from first one to Apple Bank for Savings,uberespañol,first one,Apple Bank for Savings
uberespañol fee to Los Cerritos Center,uberespañol,,Los Cerritos Center
uberespañol how much does it cost to go from fifth to Long Island Bank,uberespañol,fifth,Long Island Bank
uberespañol service prices to eighth,uberespañol,,eighth
uberespañol service prices to fifth,uberespañol,,fifth
uberespañol service prices to that location,uberespañol,,that location
uberespañol what would be the approximate cost to travel from Dillon Read & Co to Point Richmond,uberespañol,Dillon Read & Co,Point Richmond
uberexec fare from The Cambridge Hotel to second one,uberexec,The Cambridge Hotel,second one
uberexec fare from the seventh to fifth,uberexec,the seventh,fifth
uberfamily how much does it cost to go from First National Bank of Charlotte to Gurnet Point Massachusetts,uberfamily,First National Bank of Charlotte,Gurnet Point Massachusetts
uberfamily how much to go to the Tahoe Valley,uberfamily,,Tahoe Valley
uberfamily how much will the fare be to get from first one to Rochester Contemporary Art Center,uberfamily,first one,Rochester Contemporary Art Center
uberfastlane fare from tenth one to the eighth,uberfastlane,tenth one,the eighth
uberfastlane how much will the fare be to get from La Luz de Jesus to The Galleria,uberfastlane,La Luz de Jesus,The Galleria
ubergo fare from sixth to San Agustin de Laredo Historic District,ubergo,sixth,San Agustin de Laredo Historic District
ubergo fee to that location,ubergo,,that location
ubergo taxi fare for Tadich Grill,ubergo,,Tadich Grill
uberlux fare from The Monticello Hotel to the seventh,uberlux,The Monticello Hotel,the seventh
uberlux fare from work to tenth,uberlux,work,tenth
uberlux fee to tenth,uberlux,,tenth
uberlux how much does it cost to go from Godfather s Pizza to Bullfeathers,uberlux,Godfather s Pizza,Bullfeathers
uberlux what would be the approximate cost to travel from Dickey s Barbecue Pit to Great Lakes Mall,uberlux,Dickey s Barbecue Pit,Great Lakes Mall
uberplus Angus Steakhouse estimation of fare,uberplus,,Angus Steakhouse
uberplus estimated price from the fourth to Loring Park,uberplus,the fourth,Loring Park
uberplus fare from work to Bayview-Hunters Point,uberplus,work,Bayview-Hunters Point
uberplus how much to go to the home,uberplus,,home
uberplus how much will the fare be to get from Martin County Airport to Valuas,uberplus,Martin County Airport,Valuas
uberpool cost to reach Rose Park,uberpool,,Rose Park
uberpool fare from The Mall at Mill Creek to Shreveport Downtown Airport,uberpool,The Mall at Mill Creek,Shreveport Downtown Airport
uberpool service prices to third,uberpool,,third
uberselect can i get a ride estimate to Soil Art Gallery,uberselect,,Soil Art Gallery
uberselect estimate fare from Peninsula Town Center to Grodzinski Bakery,uberselect,Peninsula Town Center,Grodzinski Bakery
uberselect fee to home,uberselect,,home
ubersuv taxi fare for Bank of Hartland,ubersuv,,Bank of Hartland
ubert estimated price from ninth one to Lehman Brothers,ubert,ninth one,Lehman Brothers
ubert how much to go to the seventh one,ubert,,seventh one
ubert taxi fare for The Andover Inn,ubert,,The Andover Inn
uberx can i get a ride estimate to Naval Auxiliary Landing Field San Clemente Island,uberx,,Naval Auxiliary Landing Field San Clemente Island
uberx can i get a ride estimate to the eighth,uberx,,the eighth
uberx fare to Century Bank,uberx,,Century Bank
uberx service prices to second one,uberx,,second one
uberxl Soaring Eagle Casino & Resort estimated fare,uberxl,,Soaring Eagle Casino & Resort
uberxl car service fare to the Lygon Arms Hotel,uberxl,,Lygon Arms Hotel
uberxl estimated price from Urban Center to ninth,uberxl,Urban Center,ninth
uberxl fare to Florian Papp,uberxl,,Florian Papp
uberxl fee to Moody National Bank,uberxl,,Moody National Bank
wav fare from McDonald s sign to the last,wav,McDonald s sign,the last
wav fare from Quail Hollow to National Hotel,wav,Quail Hollow,National Hotel
wav fare from that location to The Streets of Woodfield,wav,that location,The Streets of Woodfield
wav how much will the fare be to get from The Citadel to sixth,wav,The Citadel,sixth
what does LIVEUP VIP charge to drive me to Buddha Bar,LIVEUP VIP,,Buddha Bar
what does LIVEUPVIP cost from the seventh to Bank of the South,LIVEUPVIP,the seventh,Bank of the South
what does exec large charge to take me to Live Oaks Square,exec large,,Live Oaks Square
what does execlarge cost from Big Chief Restaurant to fourth,execlarge,Big Chief Restaurant,fourth
what does it cost to uber airport to David s Airport,uber airport,,David s Airport
what does it cost to uber xl to First American Bank,uber xl,,First American Bank
what does it cost to uberairport to Godfather s Pizza,uberairport,,Godfather s Pizza
what does it cost to uberespañol to First National Bank,uberespañol,,First National Bank
what does it cost to ubert to Guanajibo,ubert,,Guanajibo
what does uber black charge to drive me to home,uber black,,home
what does uber fastlane charge to go to the fourth one,uber fastlane,,fourth one
what does uber go charge to take me to third,uber go,,third
what does uber t charge to drive me to home,uber t,,home
what does uber x charge to take me to Reliance Bank,uber x,,Reliance Bank
what does uber x charge to take me to fifth one,uber x,,fifth one
what does uber xl cost from Medieval Times to Francisville,uber xl,Medieval Times,Francisville
what does uberblack charge to take me to Art in General,uberblack,,Art in General
what does uberblack charge to take me to Maryland Art Place,uberblack,,Maryland Art Place
what does uberfamily charge to take me to there,uberfamily,,there
