TransportTaxiEstimateTravelFareQ,TransportTaxiEstimateTravelFareTaxiType,TransportTaxiEstimateTravelFareOrigin,TransportTaxiEstimateTravelFareDestination
find fare to Metropolitan Bank for LIVEUPVIP,LIVEUPVIP,,Metropolitan Bank
find fare to Mount Airy for wav,wav,,Mount Airy
find fare to Orell for exec large,exec large,,Orell
find fare to Signature Bank for uberblack,uberblack,,Signature Bank
find fare to that location for uberplus,uberplus,,that location
find fare to the third for execlarge,execlarge,,the third
find for me the estimated fare by uber pool to reach Traffic Zone Center for Visual Art,uber pool,,Traffic Zone Center for Visual Art
find for me the estimated fare by uber select to reach that,uber select,,that
find for me the estimated fare by uber xl to reach eighth,uber xl,,eighth
find for me the estimated fare by uber xl to reach second one,uber xl,,second one
find for me the estimated fare by uberplus to reach the fourth,uberplus,,the fourth
find me the cost of uberplus to Richmond Town Square,uberplus,,Richmond Town Square
find me the cost of wav to Fidelity Trust Company,wav,,Fidelity Trust Company
find me the cost of wav to the last,wav,,the last
find out the estimated charge of LIVEUP VIP car service from Tollbooth Gallery to work,LIVEUP VIP,Tollbooth Gallery,work
find out the estimated charge of uber airport car service from Cherokee County Airport to Walter and McBean Galleries,uber airport,Cherokee County Airport,Walter and McBean Galleries
find out the estimated charge of uber black car service from Daniel Boone Hotel to Baker City Municipal Airport,uber black,Daniel Boone Hotel,Baker City Municipal Airport
find out the estimated charge of uber pool car service from first to seventh one,uber pool,first,seventh one
find out the estimated charge of uber suv car service from River North Gallery District to Monett Municipal Airport,uber suv,River North Gallery District,Monett Municipal Airport
find out the estimated charge of uberplus car service from that location to JPMorgan Chase,uberplus,that location,JPMorgan Chase
find out the estimated charge of uberx car service from Samuel P Harn Museum of Art to home,uberx,Samuel P Harn Museum of Art,home
find out the estimated charge of wav car service from Treasury Casino to second one,wav,Treasury Casino,second one
find the estimated fare in lux to reach tenth one,lux,,tenth one
find the estimated fare in taxi to reach Bamiyan,taxi,,Bamiyan
find the estimated fare in taxi to reach Exposition Park Dallas,taxi,,Exposition Park Dallas
find the estimated fare in uber español to reach the last,uber español,,the last
find the estimated fare in uber family to reach North Point Breeze,uber family,,North Point Breeze
find the estimated fare in uber fastlane to reach Green Gallery,uber fastlane,,Green Gallery
find the estimated fare in uber select to reach Lehman Brothers,uber select,,Lehman Brothers
find the estimated fare in uber suv to reach fifth one,uber suv,,fifth one
find the estimated fare in uber t to reach there,uber t,,there
find the estimated fare in uber xl to reach the last,uber xl,,the last
find the estimated fare in uberairport to reach fourth,uberairport,,fourth
find the estimated fare in uberfastlane to reach Reliance Bank,uberfastlane,,Reliance Bank
find the estimated fare in uberlux to reach Grand Hotel et de Milan,uberlux,,Grand Hotel et de Milan
find the estimated fare in uberpool to reach tenth one,uberpool,,tenth one
find the estimated fare in ubert to reach Hotel Lodi,ubert,,Hotel Lodi
get estimated fare for lux to home,lux,,home
get estimated fare for uber español to eighth one,uber español,,eighth one
get estimated fare for uber pool to the first,uber pool,,the first
get estimated fare for uber suv to fourth one,uber suv,,fourth one
get estimated fare for uber x to Museum of Contemporary Art of Georgia,uber x,,Museum of Contemporary Art of Georgia
get estimated fare for uberexec to Prien Lake Mall,uberexec,,Prien Lake Mall
get estimated fare for uberfamily to Central Hillside,uberfamily,,Central Hillside
get estimated fare for uberplus to Aljira a Center for Contemporary Art,uberplus,,Aljira a Center for Contemporary Art
get fare price of uber fastlane till Contemporary Arts Museum Houston,uber fastlane,,Contemporary Arts Museum Houston
get fare price of uberlux till Kensington,uberlux,,Kensington
get fare price of uberselect till that location,uberselect,,that location
get me a details of uber select travel charge to travel theni to Cedar Park,uber select,,Cedar Park
get me a details of uber t travel charge to travel theni to Wildwood,uber t,,Wildwood
get me a details of uberexec travel charge to travel theni to work,uberexec,,work
get me a details of uberfamily travel charge to travel theni to Chapeau,uberfamily,,Chapeau
get me a details of ubergo travel charge to travel theni to Tim Ho Wan,ubergo,,Tim Ho Wan
get me a estimate for LIVEUPVIP to the The Dunstane,LIVEUPVIP,,The Dunstane
get me a estimate for taxi to the Maggie Rita s,taxi,,Maggie Rita s
get me a estimate for uber xl to the Middleton Field,uber xl,,Middleton Field
get me a estimate for ubergo to the Hotel Andaluz,ubergo,,Hotel Andaluz
get me estimated fare for execlarge from Nobu Berkeley St to Indianapolis Museum of Contemporary Art,execlarge,Nobu Berkeley St,Indianapolis Museum of Contemporary Art
get me estimated fare for taxi from fourth to Idaho Falls Regional Airport,taxi,fourth,Idaho Falls Regional Airport
get me estimated fare for uber airport to New Town,uber airport,,New Town
get me estimated fare for uber suv from eighth to the eighth,uber suv,eighth,the eighth
get me estimated fare for uber x to fifth,uber x,,fifth
get me estimated fare for uberairport to work,uberairport,,work
get me estimated fare for uberexec to last,uberexec,,last
get me estimated fare for uberpool from first one to Temple Crest,uberpool,first one,Temple Crest
get me the approximate fare for LIVEUPVIP to Garvanza,LIVEUPVIP,,Garvanza
get me the approximate fare for pool to Barnes Municipal Airport,pool,,Barnes Municipal Airport
get me the approximate fare for uber fast lane to Hard Rock Cafe,uber fast lane,,Hard Rock Cafe
get me the estimated cost for uber airport to Joliet Regional Airport,uber airport,,Joliet Regional Airport
get me the estimated cost for uber fastlane to Ruby Tuesday,uber fastlane,,Ruby Tuesday
get me the fare in exec from Nut Tree Airport to Veeraswamy,exec,Nut Tree Airport,Veeraswamy
get me the fare in exec to Ingersoll Airport,exec,,Ingersoll Airport
get me the fare in taxi to Bel Mar Shores,taxi,,Bel Mar Shores
get me the fare in uber x from Garberville Airport to ninth one,uber x,Garberville Airport,ninth one
get me the fare in uber x to Houston Fort Bend Airport,uber x,,Houston Fort Bend Airport
get me the fare in uberplus to home,uberplus,,home
get me the fare in uberpool from that one to first one,uberpool,that one,first one
get me the fare in uberpool to fourth one,uberpool,,fourth one
get me the fare in uberxl to Merchants Bank,uberxl,,Merchants Bank
get me the fare in wav to this,wav,,this
get me the travel fare to Barnum using uberblack,uberblack,,Barnum
get me the travel fare to Chili John s using uber black,uber black,,Chili John s
get me the travel fare to Julius using uber go,uber go,,Julius
get me the travel fare to Ramona Gardens using uberblack,uberblack,,Ramona Gardens
get me the travel fare to York Steak House using uber go,uber go,,York Steak House
get me the travel fare to first one using uberblack,uberblack,,first one
get me the travel fare to ninth using taxi,taxi,,ninth
get me the travel fare to that using uberx,uberx,,that
get me the travel fare to the tenth using execlarge,execlarge,,the tenth
get the estimated fare of exec large to reach the tenth,exec large,,the tenth
get the estimated fare of uber family to reach East Gate Bel Air,uber family,,East Gate Bel Air
give me an estimate for an taxi to Burlingame Terrace,taxi,,Burlingame Terrace
give me an estimate for an taxi to Coventry Mall,taxi,,Coventry Mall
give me an estimate for an uber family to the last,uber family,,the last
give me an estimate for an uber go to home,uber go,,home
give me an estimate for an uber plus to Contemporary Arts Center,uber plus,,Contemporary Arts Center
give me an estimate for an uber xl to eighth,uber xl,,eighth
give me an estimate for an uberblack to Lilongwe Hotel,uberblack,,Lilongwe Hotel
give me an estimate for an ubergo to Kahala Mall,ubergo,,Kahala Mall
give me an estimate for an uberpool to tenth one,uberpool,,tenth one
give me an estimate for an ubert to König von Portugal,ubert,,König von Portugal
give me an estimate for an wav to work,wav,,work
give me estimated fare from Bank of North Dakota to the Alexandria Museum of Art by uber t,uber t,Bank of North Dakota,Alexandria Museum of Art
give me estimated fare from Burlingame to the that by LIVEUP VIP,LIVEUP VIP,Burlingame,that
give me estimated fare from ninth to the Arby s by ubert,ubert,ninth,Arby s
give me estimated fare from that to the Ouro Verde Hotel by uber exec,uber exec,that,Ouro Verde Hotel
give me uber go fares for tenth one,uber go,,tenth one
give me ubergo fares for Sherwood Mall,ubergo,,Sherwood Mall
give me uberx fares for Fairland,uberx,,Fairland
help me calculate the price from Camille s Sidewalk Cafe to work for uberairport car service,uberairport,Camille s Sidewalk Cafe,work
help me calculate the price from Chronic Tacos to that one for uber plus car service,uber plus,Chronic Tacos,that one
help me calculate the price from Covent Garden Hotel to Pizza Inn for execlarge car service,execlarge,Covent Garden Hotel,Pizza Inn
help me calculate the price from Grand Central Art Galleries to Milford House Hotel for uber family car service,uber family,Grand Central Art Galleries,Milford House Hotel
help me calculate the price from Institute of Contemporary Art to Michael Army Airfield for uber suv car service,uber suv,Institute of Contemporary Art,Michael Army Airfield
help me calculate the price from Lumen Eclipse to Gallions Hotel for pool car service,pool,Lumen Eclipse,Gallions Hotel
help me calculate the price from home to C Grimaldis Gallery for ubersuv car service,ubersuv,home,C Grimaldis Gallery
hey aneeda get me the estimated fare of LIVEUPVIP to reach that place,LIVEUPVIP,,that place
hey aneeda get me the estimated fare of uber t to reach Minus Space,uber t,,Minus Space
hey aneeda get me the estimated fare of uberpool to reach Buffalo Wild Wings,uberpool,,Buffalo Wild Wings
hey aneeda get me the estimated fare of ubersuv to reach Mattituck Airport,ubersuv,,Mattituck Airport
hey aneeda get me the estimated fare of uberx to reach that one,uberx,,that one
hey aneeda how much will LIVEUP VIP cost to drive me from work to the Cosanti,LIVEUP VIP,work,Cosanti
hey aneeda how much will exec cost to drive me from Edwynn Houk Gallery to the that place,exec,Edwynn Houk Gallery,that place
hey aneeda how much will exec large cost to drive me from Locust Point to the Meridian Bank,exec large,Locust Point,Meridian Bank
hey aneeda how much will execlarge cost to drive me from Devon Avenue to the tenth one,execlarge,Devon Avenue,tenth one
hey aneeda how much will lux cost to drive me from Rhinelander–Oneida County Airport to the the second,lux,Rhinelander–Oneida County Airport,the second
hey aneeda how much will pool cost to drive me from the seventh to the the last,pool,the seventh,the last
hey aneeda how much will uber airport cost to drive me from work to the seventh,uber airport,work,seventh
hey aneeda how much will uber black cost to drive me from Front Burner Brands to the Laughlin/Bullhead International Airport,uber black,Front Burner Brands,Laughlin/Bullhead International Airport
hey aneeda how much will uber exec cost to drive me from Nyac Airport to the East Side Mario s,uber exec,Nyac Airport,East Side Mario s
hey aneeda how much will uber fastlane cost to drive me from third one to the Kings Arms Royal Hotel,uber fastlane,third one,Kings Arms Royal Hotel
hey aneeda how much will uber select cost to drive me from Colony to the Idylle,uber select,Colony,Idylle
hey aneeda how much will uber xl cost to drive me from the first to the ninth one,uber xl,the first,ninth one
hey aneeda how much will ubersuv cost to drive me from home to the Banbury Moat House Hotel,ubersuv,home,Banbury Moat House Hotel
hey aneeda show me the details of estimated fare of LIVEUP VIP to reach home,LIVEUP VIP,,home
hey aneeda show me the details of estimated fare of exec to reach first one,exec,,first one
hey aneeda show me the details of estimated fare of uber family to reach fifth,uber family,,fifth
hey aneeda show me the details of estimated fare of uber go to reach first,uber go,,first
hey aneeda show me the details of estimated fare of uber pool to reach Lenox Square,uber pool,,Lenox Square
hey aneeda show me the details of estimated fare of uber t to reach Toine Hermsen,uber t,,Toine Hermsen
hey aneeda which car service will cost the least to go from Athens Municipal Airport to Basement 414,,Athens Municipal Airport,Basement 414
hey aneeda which car service will cost the least to go from BNC Bank to Greenbrier Mall,,BNC Bank,Greenbrier Mall
hey aneeda which car service will cost the least to go from First Bank of the United States to Llao Llao Hotel,,First Bank of the United States,Llao Llao Hotel
hey aneeda which car service will cost the least to go from last one to Mueller Community,,last one,Mueller Community
hey aneeda which car service will cost the least to go from work to the tenth,,work,the tenth
how does the trip to Acquavella Galleries cost with uberxl,uberxl,,Acquavella Galleries
how does the trip to Black River Falls Area Airport cost with uber black,uber black,,Black River Falls Area Airport
how does the trip to Carthage cost with execlarge,execlarge,,Carthage
how does the trip to Denny s cost with LIVEUPVIP,LIVEUPVIP,,Denny s
how does the trip to fourth one cost with uber fastlane,uber fastlane,,fourth one
how does the trip to seventh one cost with uber black,uber black,,seventh one
how does the trip to that place cost with LIVEUPVIP,LIVEUPVIP,,that place
how does the trip to the first cost with uberxl,uberxl,,the first
how much does LIVEUP VIP will charge from Northern Hotel to Mall 205,LIVEUP VIP,Northern Hotel,Mall 205
how much does execlarge cost from Fidelity Trust Company to James Cohan Gallery,execlarge,Fidelity Trust Company,James Cohan Gallery
how much does it cost for an lux to take me to fifth one,lux,,fifth one
how much does it cost for an lux to take me to fourth one,lux,,fourth one
how much does it cost for an uber black to take me to Quapaw Quarter,uber black,,Quapaw Quarter
how much does it cost for an wav to take me to seventh,wav,,seventh
how much does it cost for me to uber go to the Birger Sandzén Memorial Gallery,uber go,,Birger Sandzén Memorial Gallery
how much does it cost for me to uber t to the the ninth,uber t,,the ninth
how much does it cost for me to uber xl to the La Paix,uber xl,,La Paix
how much does it cost for me to uberairport to the there,uberairport,,there
how much does it cost for me to uberblack to the ninth one,uberblack,,ninth one
how much does it cost for me to ubert to the Hotel Bareiss,ubert,,Hotel Bareiss
how much does it cost for me to uberx to the Hotel Rouge,uberx,,Hotel Rouge
how much does it cost for me to wav to the home,wav,,home
how much does it cost to get an uberblack ride to Southeast San Diego,uberblack,,Southeast San Diego
how much does it cost to get an uberexec ride to Byberry,uberexec,,Byberry
how much does it cost to get an uberexec ride to the eighth,uberexec,,the eighth
how much does it cost to get an ubergo ride to there,ubergo,,there
how much does it cost to get to Winter Saloon by uberx,uberx,,Winter Saloon
how much does it cost to reach Adak Airport by uber fastlane,uber fastlane,,Adak Airport
how much does it cost to reach CoBank from the last by uber go,uber go,the last,CoBank
how much does it cost to reach Concord Mills by uberespañol,uberespañol,,Concord Mills
how much does it cost to reach Crossroads Plaza by uber fastlane,uber fastlane,,Crossroads Plaza
how much does it cost to reach First National Bank by uber family,uber family,,First National Bank
how much does it cost to reach Forest Mall from Asia Bank by uberairport,uberairport,Asia Bank,Forest Mall
how much does it cost to reach IDT Megabite Cafe by uberblack,uberblack,,IDT Megabite Cafe
how much does it cost to reach Mall of Abilene by uberblack,uberblack,,Mall of Abilene
how much does it cost to reach McCreary County Airport from First Women s Bank of California by uberpool,uberpool,First Women s Bank of California,McCreary County Airport
how much does it cost to reach Modified Arts by exec,exec,,Modified Arts
how much does it cost to reach Oakland Hills by uber family,uber family,,Oakland Hills
how much does it cost to reach RBC Bank by uber x,uber x,,RBC Bank
how much does it cost to reach Redstone American Grill by uberpool,uberpool,,Redstone American Grill
how much does it cost to reach Springwells Hotel by uber pool,uber pool,,Springwells Hotel
how much does it cost to reach Texas Roadhouse from Northlake Mall by execlarge,execlarge,Northlake Mall,Texas Roadhouse
how much does it cost to reach The Centre at Forestville from Shoppingtown Mall by uber t,uber t,Shoppingtown Mall,The Centre at Forestville
how much does it cost to reach The Forum Shops at Caesars from Dairy Queen by exec large,exec large,Dairy Queen,The Forum Shops at Caesars
how much does it cost to reach fifth by uber select,uber select,,fifth
how much does it cost to reach home by uberfastlane,uberfastlane,,home
how much does it cost to reach home by uberfastlane,uberfastlane,,home
how much does it cost to reach last one by uberx,uberx,,last one
how much does it cost to reach second by uber x,uber x,,second
how much does it cost to reach second one from Pastamania by uber suv,uber suv,Pastamania,second one
how much does it cost to reach sixth from Diego Rivera Gallery by uber xl,uber xl,Diego Rivera Gallery,sixth
how much does it cost to reach the fifth by exec large,exec large,,the fifth
how much does it cost to reach the first by lux,lux,,the first
how much does it cost to reach the first by uber plus,uber plus,,the first
how much does it cost to reach this from the seventh by uber select,uber select,the seventh,this
how much does it cost to reach work by exec,exec,,work
how much does it cost to reach work by uberfastlane,uberfastlane,,work
how much does it cost to reach work from New Image Art by uber pool,uber pool,New Image Art,work
how much does it cost to ride an taxi from Belmond Hotel Rio Sagrado to second,taxi,Belmond Hotel Rio Sagrado,second
how much does it cost to ride an uber black from work to fourth one,uber black,work,fourth one
how much does it cost to ride an uber español from Insomnia Cookies to third,uber español,Insomnia Cookies,third
how much does it cost to ride an uber go from fifth one to Banning Municipal Airport,uber go,fifth one,Banning Municipal Airport
how much does it cost to ride an uberfamily from eighth to Indianapolis Downtown Heliport,uberfamily,eighth,Indianapolis Downtown Heliport
how much does it cost to travel to BravinLee programs with uber español,uber español,,BravinLee programs
how much does it cost to travel to the seventh with uberairport,uberairport,,the seventh
how much does it cost with LIVEUPVIP to the Crabtree Valley Mall,LIVEUPVIP,,Crabtree Valley Mall
how much does it cost with exec large to the Wells Fargo,exec large,,Wells Fargo
how much does it cost with pool to the Weathervane Restaurant,pool,,Weathervane Restaurant
how much does it cost with uber español to the Meridian Bank,uber español,,Meridian Bank
how much does it cost with uber español to the Times Square Hotel,uber español,,Times Square Hotel
how much does it cost with uber plus to the fifth one,uber plus,,fifth one
how much does it cost with uberfastlane to the last,uberfastlane,,last
how much does it cost with uberplus to the KOURAKUEN,uberplus,,KOURAKUEN
how much does it cost with uberxl to the eighth one,uberxl,,eighth one
how much does it costs to get to the Collin Creek Mall using uberplus,uberplus,,Collin Creek Mall
how much does it costs to get to the Hotel Habana Riviera using uberespañol,uberespañol,,Hotel Habana Riviera
how much does uber fast lane cost from Lents to Carl Sandburg Village,uber fast lane,Lents,Carl Sandburg Village
how much does uber fastlane cost from Museum of Contemporary Art Jacksonville to Phillips Foods Inc and Seafood Restaurants,uber fastlane,Museum of Contemporary Art Jacksonville,Phillips Foods Inc and Seafood Restaurants
how much does uber fastlane cost to Grant Hill,uber fastlane,,Grant Hill
how much does uber plus cost from eighth one to Mercury Plaza Mall,uber plus,eighth one,Mercury Plaza Mall
how much does uber suv cost from home to home,uber suv,home,home
how much does uber suv will charge from Laughlin/Bullhead International Airport to eighth,uber suv,Laughlin/Bullhead International Airport,eighth
how much does uberfamily will charge from eighth to the ninth,uberfamily,eighth,the ninth
how much does uberfastlane will charge from Point Richmond to White Lion Hotel,uberfastlane,Point Richmond,White Lion Hotel
how much does ubergo will charge from Zantigo to home,ubergo,Zantigo,home
how much does uberpool will charge from Carrabba s Italian Grill to work,uberpool,Carrabba s Italian Grill,work
how much does ubersuv cost from Seaport Village to that location,ubersuv,Seaport Village,that location
how much does uberx cost from seventh one to Talley Dunn Gallery,uberx,seventh one,Talley Dunn Gallery
how much does uberx will charge from eighth to sixth one,uberx,eighth,sixth one
how much does wav will charge from third one to Woodville Mall,wav,third one,Woodville Mall
how much execlarge is charging to travel to the first one from Dell Rhea s Chicken Basket,execlarge,Dell Rhea s Chicken Basket,first one
how much for LIVEUPVIP to First Nebraska Bank,LIVEUPVIP,,First Nebraska Bank
how much for LIVEUPVIP to La Luz de Jesus,LIVEUPVIP,,La Luz de Jesus
how much for an LIVEUP VIP to Panda Express,LIVEUP VIP,,Panda Express
how much for an exec to second one,exec,,second one
how much for an uber español to Kadeau København,uber español,,Kadeau København
how much for an uber español to Miami University Airport,uber español,,Miami University Airport
how much for an uber family to Wexner Center for the Arts,uber family,,Wexner Center for the Arts
how much for an uber suv to Mason Jewett Field,uber suv,,Mason Jewett Field
how much for an ubergo to Mount Adams,ubergo,,Mount Adams
how much for an uberlux to JPMorgan Chase,uberlux,,JPMorgan Chase
how much for an uberplus to the fourth,uberplus,,the fourth
how much for an ubersuv to Jack Edwards Airport,ubersuv,,Jack Edwards Airport
how much for an wav to Piedras Blancas Motel,wav,,Piedras Blancas Motel
how much for exec large to Miller s Ale House,exec large,,Miller s Ale House
how much for taxi to Atlanta Bread Company,taxi,,Atlanta Bread Company
how much for uber español to work,uber español,,work
how much for uber family to Hotel Florida Milan,uber family,,Hotel Florida Milan
how much for uber fastlane to eighth one,uber fastlane,,eighth one
how much for uber select to Zarate,uber select,,Zarate
how much for uberfamily to work,uberfamily,,work
how much for uberfastlane to 4 Rivers Smokehouse,uberfastlane,,4 Rivers Smokehouse
how much for uberlux to Homeland Hotel,uberlux,,Homeland Hotel
how much for ubert to Hawksmoor,ubert,,Hawksmoor
how much for uberx to Pililaau Army Recreation Center,uberx,,Pililaau Army Recreation Center
how much for uberxl to Springfield/Belmont,uberxl,,Springfield/Belmont
how much for wav to eighth,wav,,eighth
how much i have to play for Banchero long travel in uberfastlane,uberfastlane,,Banchero
how much i have to play for First Federal Bank long travel in uberfastlane,uberfastlane,,First Federal Bank
how much i need to pay for lux to reach to eighth,lux,,eighth
how much i need to pay for pool to reach to first,pool,,first
how much i need to pay for uber family to reach to The Boar s Head Hotel,uber family,,The Boar s Head Hotel
how much i need to pay for uber fastlane to reach to tenth,uber fastlane,,tenth
how much i need to pay for uber pool to reach to Wrapchic,uber pool,,Wrapchic
how much i need to pay for uber t to reach to fourth,uber t,,fourth
how much i need to pay for uberexec to reach to Tomato Bank,uberexec,,Tomato Bank
how much i need to pay for uberplus to reach to Biltmore Fashion Park,uberplus,,Biltmore Fashion Park
how much i need to pay for uberselect to reach to Café du Monde,uberselect,,Café du Monde
how much is a LIVEUP VIP to Şahin Restaurant,LIVEUP VIP,,Şahin Restaurant
how much is a LIVEUPVIP to Childress Municipal Airport,LIVEUPVIP,,Childress Municipal Airport
how much is a ride to L'Atelier de Joël Robuchon with uber x,uber x,,L'Atelier de Joël Robuchon
how much is a ride to Paper Heart Gallery with execlarge,execlarge,,Paper Heart Gallery
how much is a ride to Signature Bank with uber select,uber select,,Signature Bank
how much is a ride to Tomorrowland Terrace with execlarge,execlarge,,Tomorrowland Terrace
how much is a ride to eighth with uber select,uber select,,eighth
how much is a ride to fourth one with uber t,uber t,,fourth one
how much is a ride to second one with uber fastlane,uber fastlane,,second one
how much is a ride to the third with uberairport,uberairport,,the third
how much is a ride to work with uberairport,uberairport,,work
how much is a uber airport to the last,uber airport,,the last
