TransportTaxiEstimateTravelFareQ,TransportTaxiEstimateTravelFareTaxiType,TransportTaxiEstimateTravelFareOrigin,TransportTaxiEstimateTravelFareDestination
LIVEUP VIP cost to reach seventh one,LIVEUP VIP,,seventh one
LIVEUP VIP how much will the fare be to get from The Living Museum to REVERSE art space,LIVEUP VIP,The Living Museum,REVERSE art space
LIVEUP VIP how much will the fare be to get from work to Acadiana Mall,LIVEUP VIP,work,Acadiana Mall
LIVEUP VIP service prices to Le Cheval Blanc,LIVEUP VIP,,Le Cheval Blanc
LIVEUPVIP cost to reach the sixth,LIVEUPVIP,,the sixth
LIVEUPVIP estimate fare from second one to fifth,LIVEUPVIP,second one,fifth
LIVEUPVIP fee to third one,LIVEUPVIP,,third one
LIVEUPVIP service prices to Jack Brooks Regional Airport,LIVEUPVIP,,Jack Brooks Regional Airport
about how much will an execlarge cost to get Bessemer Airport,execlarge,,Bessemer Airport
about how much will an lux cost to get Bank of Hartland,lux,,Bank of Hartland
about how much will an uber exec cost to get home,uber exec,,home
about how much will an uber xl cost to get second one,uber xl,,second one
about how much will an uberblack cost to get Dauphin Hotel,uberblack,,Dauphin Hotel
about how much will an uberfastlane cost to get ninth one,uberfastlane,,ninth one
about how much will an uberlux cost to get First Financial Bank,uberlux,,First Financial Bank
about how much will an uberlux cost to get I-20,uberlux,,I-20
about how much will an uberselect cost to get Prince Llewelyn Hotel,uberselect,,Prince Llewelyn Hotel
about how much will an ubert cost to get first one,ubert,,first one
about how much would it cost to take an execlarge to the L.A Louver,execlarge,,L.A Louver
about how much would it cost to take an uber go to the work,uber go,,work
about how much would it cost to take an uberplus to the Manhattan Mall,uberplus,,Manhattan Mall
about how much would it cost to take an uberplus to the fifth,uberplus,,fifth
about how much would it cost to take an uberpool to the Naval Air Station Fallon,uberpool,,Naval Air Station Fallon
about how much would it cost to take an uberx to the this,uberx,,this
ai how much will it roughly cost if i take exec from the tenth to Qdoba Mexican Grill,exec,the tenth,Qdoba Mexican Grill
ai how much will it roughly cost if i take pool from First Financial Bank to Afton Oaks,pool,First Financial Bank,Afton Oaks
ai how much will it roughly cost if i take uber español from Long Island Bank to Frog and the Peach,uber español,Long Island Bank,Frog and the Peach
ai how much will it roughly cost if i take uber pool from Krispy Kreme to Park View,uber pool,Krispy Kreme,Park View
ai how much will it roughly cost if i take uber pool from tenth one to the third,uber pool,tenth one,the third
ai how much will it roughly cost if i take uber x from Stratford Square Mall to Bank of the South,uber x,Stratford Square Mall,Bank of the South
ai how much will it roughly cost if i take uberairport from Longview Mall to seventh,uberairport,Longview Mall,seventh
ai how much will it roughly cost if i take uberespañol from Fidelity Trust Company to work,uberespañol,Fidelity Trust Company,work
ai how much will it roughly cost if i take uberlux from JPMorgan Chase to Apple Bank for Savings,uberlux,JPMorgan Chase,Apple Bank for Savings
ai if i take a lux from where i am now to there what s the estimated cost,lux,,there
ai if i take a uberairport from where i am now to Miracle Mile Shops what s the estimated cost,uberairport,,Miracle Mile Shops
ai if i take a ubergo from where i am now to Tenkaippin what s the estimated cost,ubergo,,Tenkaippin
ai if i take a uberplus from where i am now to Broadview Hotel what s the estimated cost,uberplus,,Broadview Hotel
ai if i take a uberplus from where i am now to Richard L Feigen & Co what s the estimated cost,uberplus,,Richard L Feigen & Co
aneeda can you look up the estimated fare for LIVEUP VIP from Baldwin Hills to Domino s Pizza,LIVEUP VIP,Baldwin Hills,Domino s Pizza
aneeda can you look up the estimated fare for uber black from sixth to Monmouth Mall,uber black,sixth,Monmouth Mall
aneeda can you look up the estimated fare for uber fast lane from Tazza D'Oro to The Johnstown Galleria,uber fast lane,Tazza D'Oro,The Johnstown Galleria
aneeda can you look up the estimated fare for uber pool from Los Angeles Contemporary Exhibitions to Haverford North,uber pool,Los Angeles Contemporary Exhibitions,Haverford North
aneeda can you look up the estimated fare for ubergo from the fourth to St Petersburg–Clearwater International Airport,ubergo,the fourth,St Petersburg–Clearwater International Airport
aneeda can you look up the estimated fare for uberlux from last one to Casselton Robert Miller Regional Airport,uberlux,last one,Casselton Robert Miller Regional Airport
aneeda can you look up the estimated fare for wav from Van Nuys Airport to seventh,wav,Van Nuys Airport,seventh
aneeda can you show me how much it would cost to take an uber fastlane from Capital City Airport to my local Hotel Equatoria,uber fastlane,Capital City Airport,Hotel Equatoria
aneeda can you show me how much it would cost to take an uber pool from seventh to my local First Bank,uber pool,seventh,First Bank
aneeda can you show me how much it would cost to take an uberespañol from Universal Concepts Unlimited to my local Hodad s,uberespañol,Universal Concepts Unlimited,Hodad s
aneeda estimate the cost of using uber black to bring me to Illinois Valley Airport,uber black,,Illinois Valley Airport
aneeda estimate the cost of using uber pool to bring me to Urasawa,uber pool,,Urasawa
aneeda estimate the cost of using uber xl to bring me to Dillon Read & Co,uber xl,,Dillon Read & Co
aneeda estimate the cost of using uberblack to bring me to tenth,uberblack,,tenth
aneeda how much will it cost me to get to Charlottetown Mall using uber select,uber select,,Charlottetown Mall
aneeda how much will it cost me to get to Fairbanks International Airport using uber x,uber x,,Fairbanks International Airport
aneeda how much will it cost me to get to Fidelity Trust Company using uber select,uber select,,Fidelity Trust Company
aneeda how much will it cost me to get to Metropolis using uber xl,uber xl,,Metropolis
aneeda how much will it cost me to get to eighth using uber plus,uber plus,,eighth
aneeda how much will it cost me to get to fifth using uber x,uber x,,fifth
aneeda how much will it cost me to get to fourth using execlarge,execlarge,,fourth
aneeda how much will it cost me to get to the second using uber exec,uber exec,,the second
aneeda how much would it cost me to take an LIVEUP VIP from Jensens Strip to the last,LIVEUP VIP,Jensens Strip,the last
aneeda how much would it cost me to take an lux from the seventh to Sabin,lux,the seventh,Sabin
aneeda how much would it cost me to take an uber airport from fifth to Wrapchic,uber airport,fifth,Wrapchic
aneeda how much would it cost me to take an uber black from the seventh to the last,uber black,the seventh,the last
aneeda how much would it cost me to take an uber go from Sherman Oaks Galleria to that place,uber go,Sherman Oaks Galleria,that place
aneeda how much would it cost me to take an uber suv from Alexandria Museum of Art to First Market Bank,uber suv,Alexandria Museum of Art,First Market Bank
aneeda how much would it cost me to take an uberlux from Boeing Field to CoBank,uberlux,Boeing Field,CoBank
aneeda how much would it cost me to take an uberplus from First Nebraska Bank to seventh one,uberplus,First Nebraska Bank,seventh one
aneeda how much would it cost me to take an uberselect from the fifth to Team Gallery,uberselect,the fifth,Team Gallery
aneeda how much would it cost to get to Toby Keith s I Love This Bar & Grill if i took an uber family,uber family,,Toby Keith s I Love This Bar & Grill
aneeda how much would it cost to take lux from tenth one to the St Mary s Rectory,lux,tenth one,St Mary s Rectory
aneeda how much would it cost to take pool from Sconyers Bar-B-Que to the third,pool,Sconyers Bar-B-Que,third
aneeda how much would it cost to take uber black from CoBank to the Green Gallery,uber black,CoBank,Green Gallery
aneeda how much would it cost to take uber español from Tomato Bank to the third one,uber español,Tomato Bank,third one
aneeda how much would it cost to take uber fastlane from Asian American Arts Centre to the ninth one,uber fastlane,Asian American Arts Centre,ninth one
aneeda how much would it cost to take uber fastlane from Renaissance Society to the fifth one,uber fastlane,Renaissance Society,fifth one
aneeda how much would it cost to take uber pool from the second to the last one,uber pool,the second,last one
aneeda how much would it cost to take uber x from Fisher Landau Center to the Zoës Kitchen,uber x,Fisher Landau Center,Zoës Kitchen
aneeda how much would it cost to take uberexec from that place to the last,uberexec,that place,last
aneeda how much would it cost to take uberfamily from last one to the seventh,uberfamily,last one,seventh
aneeda how much would it cost to take ubergo from Artesia Municipal Airport to the Franklin Barbecue,ubergo,Artesia Municipal Airport,Franklin Barbecue
aneeda how much would it cost to take ubert from Dixie Farms to the Fairgrounds Square Mall,ubert,Dixie Farms,Fairgrounds Square Mall
aneeda how much would it cost to take uberxl from Westfarms Mall to the tenth,uberxl,Westfarms Mall,tenth
aneeda how much would it cost with LIVEUP VIP to drive from the fourth to work,LIVEUP VIP,the fourth,work
aneeda how much would it cost with uber exec to drive from River Roads Mall to Bard Graduate Center,uber exec,River Roads Mall,Bard Graduate Center
aneeda how much would it cost with uber fastlane to drive from Lower East Side to Sam Woo Restaurant,uber fastlane,Lower East Side,Sam Woo Restaurant
aneeda how much would it cost with uber fastlane to drive from home to home,uber fastlane,home,home
aneeda how much would it cost with uber go to drive from sixth one to first one,uber go,sixth one,first one
aneeda how much would it cost with uber plus to drive from Big Mountain Air Force Station to Alum Rock,uber plus,Big Mountain Air Force Station,Alum Rock
aneeda how much would it cost with uber suv to drive from second to first,uber suv,second,first
aneeda how much would it cost with uberfamily to drive from Lum s to Landover Mall,uberfamily,Lum s,Landover Mall
aneeda how much would it cost with uberx to drive from Byberry to Caribou Municipal Airport,uberx,Byberry,Caribou Municipal Airport
aneeda how much would it cost with uberxl to drive from ninth to OHWOW,uberxl,ninth,OHWOW
aneeda show me the estimated fare for an uber exec that would take me to that location,uber exec,,that location
aneeda show me the estimated fare for an uberexec that would take me to second one,uberexec,,second one
aneeda show me the estimated fare for an uberlux that would take me to ninth,uberlux,,ninth
aneeda show me the estimated fare for an uberx that would take me to Central West End,uberx,,Central West End
aneeda show me the estimated fare for an uberx that would take me to Moe s Southwest Grill,uberx,,Moe s Southwest Grill
aneeda what is the estimated expense to reach Melbourne International Airport with uberespañol,uberespañol,,Melbourne International Airport
aneeda what is the estimated expense to reach the first with wav,wav,,the first
approximately how much will a ride from pool cost to get to the the fifth in youngstown,pool,,the fifth
approximately how much will a ride from uber black cost to get to the seventh one in youngstown,uber black,,seventh one
approximately how much will a ride from uber exec cost to get to the Mariston Hotel in youngstown,uber exec,,Mariston Hotel
approximately how much will a ride from uber t cost to get to the RBC Bank in youngstown,uber t,,RBC Bank
approximately how much will a ride from uberblack cost to get to the seventh in youngstown,uberblack,,seventh
approximately how much will a ride from uberespañol cost to get to the Bisbee-Douglas International Airport in youngstown,uberespañol,,Bisbee-Douglas International Airport
approximately how much will a ride from uberpool cost to get to the Merchants Bank in youngstown,uberpool,,Merchants Bank
calculate the cost of paying LIVEUP VIP to take me from Hilltop Mall to Gastromé,LIVEUP VIP,Hilltop Mall,Gastromé
calculate the cost of paying uber fast lane to take me from second one to the eighth,uber fast lane,second one,the eighth
calculate the cost of paying uber plus to take me from eighth to Dayton s Bluff,uber plus,eighth,Dayton s Bluff
calculate the fare for an exec to reach that place,exec,,that place
calculate the fare for an uber español to reach Four Seasons Resort Costa Rica,uber español,,Four Seasons Resort Costa Rica
calculate the fare for an uber family to reach the ninth,uber family,,the ninth
calculate the fare for an uber go to reach Birger Sandzén Memorial Gallery,uber go,,Birger Sandzén Memorial Gallery
calculate the fare for an uber go to reach eighth one,uber go,,eighth one
calculate the fare for an uber suv to reach Matsumotoro,uber suv,,Matsumotoro
calculate the fare for an uber x to reach Renaissance Society,uber x,,Renaissance Society
calculate the fare for an uberespañol to reach ninth,uberespañol,,ninth
calculate the fare for an uberfamily to reach there,uberfamily,,there
calculate the fare for an ubergo to reach Houma-Terrebonne Airport,ubergo,,Houma-Terrebonne Airport
calculate the fare for an ubergo to reach the sixth,ubergo,,the sixth
calculate the fare for an uberplus to reach Beaumont Municipal Airport,uberplus,,Beaumont Municipal Airport
calculate the fare on LIVEUPVIP from work to Currituck County Regional Airport,LIVEUPVIP,work,Currituck County Regional Airport
calculate the fare on exec from Voss Galleries to that place,exec,Voss Galleries,that place
calculate the fare on uber airport from that one to tenth one,uber airport,that one,tenth one
calculate the fare on uber español from last to Athens Institute for Contemporary Art,uber español,last,Athens Institute for Contemporary Art
calculate the fare on uber exec from the sixth to work,uber exec,the sixth,work
calculate the fare on uber fast lane from Powderhorn to Blue Canyon–Nyack Airport,uber fast lane,Powderhorn,Blue Canyon–Nyack Airport
calculate the fare on uber fast lane from work to Bank of the South,uber fast lane,work,Bank of the South
calculate the fare on uber go from the fourth to the last,uber go,the fourth,the last
calculate the fare on uber plus from Schlotzsky s to work,uber plus,Schlotzsky s,work
calculate the fare on uber x from this to Aldrich Contemporary Art Museum,uber x,this,Aldrich Contemporary Art Museum
calculate the fare on uberexec from that location to Smokey Bones,uberexec,that location,Smokey Bones
calculate the fare on ubergo from Hotel Charlottetown to Fiduciary Trust Company International,ubergo,Hotel Charlottetown,Fiduciary Trust Company International
calculate the fare on uberpool from Fairway Village to the sixth,uberpool,Fairway Village,the sixth
calculate the fare on uberselect from Haverford North to Logan Field,uberselect,Haverford North,Logan Field
calculate the fare on ubersuv from home to Auguste,ubersuv,home,Auguste
calculate the fare on wav from Der Bloasbalg to Hotel Lodi,wav,Der Bloasbalg,Hotel Lodi
can you estimate the cost for an pool from my Georgetown to work,pool,Georgetown,work
can you estimate the cost for an uber plus from my that one to Tony Roma s,uber plus,that one,Tony Roma s
can you estimate the cost for an wav from my Lower Ninth Ward to BNC Bank,wav,Lower Ninth Ward,BNC Bank
can you tell me the cost to take a LIVEUP VIP service to the Hamilton Arms Hotel,LIVEUP VIP,,Hamilton Arms Hotel
can you tell me the cost to take a exec large service to the Walker Bros,exec large,,Walker Bros
can you tell me the cost to take a exec large service to the second one,exec large,,second one
can you tell me the cost to take a uber black service to the the fourth,uber black,,the fourth
can you tell me the cost to take a uber exec service to the Schroeder Romero & Shredder,uber exec,,Schroeder Romero & Shredder
can you tell me the cost to take a uber t service to the Apple Bank for Savings,uber t,,Apple Bank for Savings
can you tell me the cost to take a ubergo service to the last,ubergo,,last
can you tell me the cost to take a ubersuv service to the Dena Foundation for Contemporary Art,ubersuv,,Dena Foundation for Contemporary Art
can you tell me the cost to take a ubersuv service to the The Lexington Club,ubersuv,,The Lexington Club
charge for pool to get to last,pool,,last
charge for uber exec to get to seventh one,uber exec,,seventh one
charge for uber fastlane to get to YO Sushi,uber fastlane,,YO Sushi
charge for uberlux to get to Logan Field,uberlux,,Logan Field
charge for uberlux to get to Pizza Time of St Augustine,uberlux,,Pizza Time of St Augustine
charge for uberlux to get to work,uberlux,,work
charge for uberselect to get to Cracker Barrel,uberselect,,Cracker Barrel
charge to reach Arizona Mills by execlarge,execlarge,,Arizona Mills
charge to reach Atlanta Contemporary Art Center by exec large,exec large,,Atlanta Contemporary Art Center
charge to reach Basiliek by uberplus,uberplus,,Basiliek
charge to reach Blytheville Municipal Airport by ubert,ubert,,Blytheville Municipal Airport
charge to reach Chesapeake Square Mall by uber go,uber go,,Chesapeake Square Mall
charge to reach Dickinson Narrows by taxi,taxi,,Dickinson Narrows
charge to reach Dillon Read & Co by uber plus,uber plus,,Dillon Read & Co
charge to reach Fairywood by uber exec,uber exec,,Fairywood
charge to reach First National Bank of Charlotte by uber airport,uber airport,,First National Bank of Charlotte
charge to reach Hemphill Fine Arts by uberexec,uberexec,,Hemphill Fine Arts
charge to reach Ivar s by uber family,uber family,,Ivar s
charge to reach Kearny Mesa by uberplus,uberplus,,Kearny Mesa
charge to reach Kingsbury Court Old Palace Lodge Hotel by lux,lux,,Kingsbury Court Old Palace Lodge Hotel
charge to reach Manhattan Mall by lux,lux,,Manhattan Mall
charge to reach Pine Street Art Works by uber airport,uber airport,,Pine Street Art Works
charge to reach Ramblewood by uberxl,uberxl,,Ramblewood
charge to reach Schroeder Romero & Shredder by uberexec,uberexec,,Schroeder Romero & Shredder
charge to reach Sean Kelly Gallery by uber plus,uber plus,,Sean Kelly Gallery
charge to reach The Park s Finest by execlarge,execlarge,,The Park s Finest
charge to reach The Village at Sandhill by uber xl,uber xl,,The Village at Sandhill
charge to reach Thurston Hotel by uber suv,uber suv,,Thurston Hotel
charge to reach Ward-Nasse Gallery by uberfamily,uberfamily,,Ward-Nasse Gallery
charge to reach Yesler Terrace by uberplus,uberplus,,Yesler Terrace
charge to reach eighth by uber plus,uber plus,,eighth
charge to reach eighth by uber t,uber t,,eighth
charge to reach fifth one by uber exec,uber exec,,fifth one
charge to reach home by LIVEUP VIP,LIVEUP VIP,,home
charge to reach home by uber t,uber t,,home
charge to reach ninth by ubergo,ubergo,,ninth
charge to reach ninth by uberplus,uberplus,,ninth
charge to reach ninth one by uber family,uber family,,ninth one
charge to reach sixth by ubergo,ubergo,,sixth
charge to reach tenth by uber español,uber español,,tenth
charge to reach tenth one by uberexec,uberexec,,tenth one
charge to reach that location by uberespañol,uberespañol,,that location
charge to reach the second by uberfamily,uberfamily,,the second
charge to reach the seventh by uber x,uber x,,the seventh
charge to reach the sixth by uberxl,uberxl,,the sixth
charge to reach work by uberexec,uberexec,,work
check LIVEUPVIP show fare for home,LIVEUPVIP,,home
check price exec large from Lincoln Airport to the third,exec large,Lincoln Airport,the third
check price uber black from The Fashion Mall at Keystone to Drake Hotel,uber black,The Fashion Mall at Keystone,Drake Hotel
check price uber pool from JANAF Shopping Center to fourth,uber pool,JANAF Shopping Center,fourth
check price uber select from home to Hotel Canberra,uber select,home,Hotel Canberra
check price uber x from that place to last one,uber x,that place,last one
check price ubergo from there to Residency Towers Chennai,ubergo,there,Residency Towers Chennai
check price uberpool from home to C Grimaldis Gallery,uberpool,home,C Grimaldis Gallery
check price wav from the sixth to there,wav,the sixth,there
check uber español show fare for Buca di Beppo,uber español,,Buca di Beppo
check uber go show fare for there,uber go,,there
check uber xl show fare for first one,uber xl,,first one
check uber xl show fare for fourth,uber xl,,fourth
check uberpool show fare for Braeburn,uberpool,,Braeburn
cost for exec from Kelling Heath Holiday Park to Smådalarö Gård,exec,Kelling Heath Holiday Park,Smådalarö Gård
cost for execlarge from Waterfall Seaplane Base to the fourth,execlarge,Waterfall Seaplane Base,the fourth
cost for taxi from Courier City-Oscawana to sixth,taxi,Courier City-Oscawana,sixth
cost for uberespañol from home to Bel-Air,uberespañol,home,Bel-Air
cost of exec large to Miami Valley Centre Mall,exec large,,Miami Valley Centre Mall
cost of exec large to the ninth,exec large,,the ninth
cost of execlarge to Monongalia Arts Center,execlarge,,Monongalia Arts Center
cost of execlarge to first one,execlarge,,first one
cost of taxi to Mama Lo s,taxi,,Mama Lo s
cost of uber plus fare to Lansing,uber plus,,Lansing
cost of uber t fare to Bloomfield Municipal Airport,uber t,,Bloomfield Municipal Airport
cost of uber x to Kalastajatorppa,uber x,,Kalastajatorppa
cost of uber x to Little Caesars,uber x,,Little Caesars
cost of uberblack to Cub Port Airport,uberblack,,Cub Port Airport
cost of uberespañol fare to Harland Sanders Café and Museum,uberespañol,,Harland Sanders Café and Museum
cost of uberplus to the sixth,uberplus,,the sixth
cost of uberpool to that place,uberpool,,that place
cost of uberpool to the second,uberpool,,the second
cost of ubert to fourth,ubert,,fourth
cost of uberx to Myricks Airport,uberx,,Myricks Airport
cost of uberxl fare to Fiduciary Trust Company International,uberxl,,Fiduciary Trust Company International
cost of wav fare to seventh one,wav,,seventh one
cost to reach Albus Cavus by exec,exec,,Albus Cavus
cost to reach Au Pied de Cochon by uberxl,uberxl,,Au Pied de Cochon
cost to reach Auberge la Provence by exec,exec,,Auberge la Provence
cost to reach Bank of the South by uberplus,uberplus,,Bank of the South
cost to reach Bannister Mall by uberfastlane,uberfastlane,,Bannister Mall
cost to reach Bard Graduate Center by uber family,uber family,,Bard Graduate Center
cost to reach Billy Simpson s House of Seafood and Steaks by uberplus,uberplus,,Billy Simpson s House of Seafood and Steaks
cost to reach Blue Canyon–Nyack Airport by uber xl,uber xl,,Blue Canyon–Nyack Airport
cost to reach Bright Angel Lodge by uberairport,uberairport,,Bright Angel Lodge
cost to reach CoBank by uber xl,uber xl,,CoBank
cost to reach Corning–Painted Post Airport by ubersuv,ubersuv,,Corning–Painted Post Airport
cost to reach Duchess by uber black,uber black,,Duchess
cost to reach Dunkin' Donuts by uberxl,uberxl,,Dunkin' Donuts
cost to reach Duurstede by uber exec,uber exec,,Duurstede
cost to reach Elephant Hotel by ubergo,ubergo,,Elephant Hotel
cost to reach Fairgrounds Square Mall by uber español,uber español,,Fairgrounds Square Mall
cost to reach Fidelity Bank by uber fastlane,uber fastlane,,Fidelity Bank
cost to reach First Nebraska Bank by ubert,ubert,,First Nebraska Bank
cost to reach Green Tree Mall by uberexec,uberexec,,Green Tree Mall
cost to reach Hanoi Garden by uberespañol,uberespañol,,Hanoi Garden
cost to reach Hoonah Airport by lux,lux,,Hoonah Airport
cost to reach Hotel President by ubersuv,ubersuv,,Hotel President
cost to reach L'Auberge du Pont de Collonges by execlarge,execlarge,,L'Auberge du Pont de Collonges
cost to reach Langham Hotel Boston by uber airport,uber airport,,Langham Hotel Boston
cost to reach LeRay Hotel by uber x,uber x,,LeRay Hotel
cost to reach Ledoyen by uber xl,uber xl,,Ledoyen
cost to reach Lincoln Heights by uberblack,uberblack,,Lincoln Heights
cost to reach Long Island Bank by uber go,uber go,,Long Island Bank
cost to reach Long Island Bank by uberx,uberx,,Long Island Bank
cost to reach Lumen Eclipse by uberx,uberx,,Lumen Eclipse
cost to reach Melia Barcelona Hotel by uber fast lane,uber fast lane,,Melia Barcelona Hotel
cost to reach Merchants Bank by uberxl,uberxl,,Merchants Bank
cost to reach Meridian Bank by uber x,uber x,,Meridian Bank
cost to reach Mid-Cambridge by uber black,uber black,,Mid-Cambridge
cost to reach Museum of Contemporary Art of Georgia by uber exec,uber exec,,Museum of Contemporary Art of Georgia
cost to reach Park West Gallery by ubersuv,ubersuv,,Park West Gallery
cost to reach Pioneer Trails by uber exec,uber exec,,Pioneer Trails
cost to reach Rockville Mall by uberpool,uberpool,,Rockville Mall
cost to reach Sandbridge by uberfastlane,uberfastlane,,Sandbridge
cost to reach The Green Lion Hotel by uberfamily,uberfamily,,The Green Lion Hotel
cost to reach The Mirage by uber t,uber t,,The Mirage
cost to reach The Old Three Cups Hotel by uberx,uberx,,The Old Three Cups Hotel
cost to reach The Pizza Studio by uber fast lane,uber fast lane,,The Pizza Studio
cost to reach Uniontown Mall by uber xl,uber xl,,Uniontown Mall
cost to reach Valley National Bank of Arizona by uber plus,uber plus,,Valley National Bank of Arizona
cost to reach Village of La Jolla by uber plus,uber plus,,Village of La Jolla
cost to reach West Elsdon by uber pool,uber pool,,West Elsdon
