TransportTaxiEstimateTravelFareQ,TransportTaxiEstimateTravelFareTaxiType,TransportTaxiEstimateTravelFareOrigin,TransportTaxiEstimateTravelFareDestination
how much is an uberpool to this,uberpool,,this
how much is an uberpool to this,uberpool,,this
how much is an uberselect from Alameda to Signature Bank,uberselect,Alameda,Signature Bank
how much is an uberselect from North Bon Air to Crosby Municipal Airport,uberselect,North Bon Air,Crosby Municipal Airport
how much is an uberselect from Solomon Pond Mall to The Granville Ramsgate,uberselect,Solomon Pond Mall,The Granville Ramsgate
how much is an uberselect from seventh one to Merchants Bank,uberselect,seventh one,Merchants Bank
how much is an uberselect from that to the sixth station,uberselect,that,sixth
how much is an uberselect to Anno Domini,uberselect,,Anno Domini
how much is an uberselect to Bank of North Dakota,uberselect,,Bank of North Dakota
how much is an uberselect to Mohawk Valley Airport,uberselect,,Mohawk Valley Airport
how much is an uberselect to The Roosevelt Inn,uberselect,,The Roosevelt Inn
how much is an uberselect to Westfield San Francisco Centre,uberselect,,Westfield San Francisco Centre
how much is an uberselect to Winter Hill,uberselect,,Winter Hill
how much is an uberselect to fourth,uberselect,,fourth
how much is an uberselect to home,uberselect,,home
how much is an uberselect to last,uberselect,,last
how much is an uberselect to ninth,uberselect,,ninth
how much is an uberselect to the Center for Architecture station,uberselect,,Center for Architecture
how much is an uberselect to the ninth,uberselect,,the ninth
how much is an ubersuv from Grodzinski Bakery to ninth,ubersuv,Grodzinski Bakery,ninth
how much is an ubersuv from Naval Air Station Joint Reserve Base Willow Grove to Beirut Marriott Hotel,ubersuv,Naval Air Station Joint Reserve Base Willow Grove,Beirut Marriott Hotel
how much is an ubersuv from YO Sushi to tenth one,ubersuv,YO Sushi,tenth one
how much is an ubersuv from fourth one to fifth,ubersuv,fourth one,fifth
how much is an ubersuv from seventh one to first,ubersuv,seventh one,first
how much is an ubersuv from tenth one to the second,ubersuv,tenth one,the second
how much is an ubersuv from the ninth to Holbrooke Hotel,ubersuv,the ninth,Holbrooke Hotel
how much is an ubersuv from the second to Indian Mound Mall,ubersuv,the second,Indian Mound Mall
how much is an ubersuv from work to the ninth,ubersuv,work,the ninth
how much is an ubersuv to Café de la Paix west covina,ubersuv,,Café de la Paix
how much is an ubersuv to East Bakersfield,ubersuv,,East Bakersfield
how much is an ubersuv to Indianapolis Metropolitan Airport,ubersuv,,Indianapolis Metropolitan Airport
how much is an ubersuv to Kadeau København,ubersuv,,Kadeau København
how much is an ubersuv to Portland Institute for Contemporary Art,ubersuv,,Portland Institute for Contemporary Art
how much is an ubersuv to Quaglino s,ubersuv,,Quaglino s
how much is an ubersuv to Ricky s Sports Theatre and Grill,ubersuv,,Ricky s Sports Theatre and Grill
how much is an ubersuv to Sperone Westwater Gallery,ubersuv,,Sperone Westwater Gallery
how much is an ubersuv to first one,ubersuv,,first one
how much is an ubersuv to sixth right now,ubersuv,,sixth
how much is an ubert from Alamo Placita to first one,ubert,Alamo Placita,first one
how much is an ubert from Murfreesboro Municipal Airport to Lorin District,ubert,Murfreesboro Municipal Airport,Lorin District
how much is an ubert from Peppermint Bay to the seventh,ubert,Peppermint Bay,the seventh
how much is an ubert from Scottsdale Museum of Contemporary Art to the eighth,ubert,Scottsdale Museum of Contemporary Art,the eighth
how much is an ubert from ninth to MoMA PS1,ubert,ninth,MoMA PS1
how much is an ubert to Bank of North Dakota,ubert,,Bank of North Dakota
how much is an ubert to Hotel Loraine,ubert,,Hotel Loraine
how much is an ubert to Lavenham Wool Hall,ubert,,Lavenham Wool Hall
how much is an ubert to Middleton Municipal Airport west covina,ubert,,Middleton Municipal Airport
how much is an ubert to Ocean County Mall,ubert,,Ocean County Mall
how much is an ubert to eighth,ubert,,eighth
how much is an ubert to first,ubert,,first
how much is an ubert to first,ubert,,first
how much is an ubert to home,ubert,,home
how much is an ubert to sixth one,ubert,,sixth one
how much is an uberx car from Billy Simpson s House of Seafood and Steaks to the Wolfslaar,uberx,Billy Simpson s House of Seafood and Steaks,Wolfslaar
how much is an uberx from Fulcrum Gallery to Little Joe s,uberx,Fulcrum Gallery,Little Joe s
how much is an uberx from Hilldale Shopping Center to Los Arcos Mall,uberx,Hilldale Shopping Center,Los Arcos Mall
how much is an uberx from Mansfield Lahm Regional Airport to fifth,uberx,Mansfield Lahm Regional Airport,fifth
how much is an uberx from Wells Fargo to home,uberx,Wells Fargo,home
how much is an uberx from that location to First Federal Bank,uberx,that location,First Federal Bank
how much is an uberx to Carroll County Regional Airport,uberx,,Carroll County Regional Airport
how much is an uberx to CoBank,uberx,,CoBank
how much is an uberx to Federal Savings Bank,uberx,,Federal Savings Bank
how much is an uberx to First Women s Bank of California,uberx,,First Women s Bank of California
how much is an uberx to Mobile Downtown Airport,uberx,,Mobile Downtown Airport
how much is an uberx to sixth,uberx,,sixth
how much is an uberxl from Bisbee-Douglas International Airport to Hallsborough Tavern,uberxl,Bisbee-Douglas International Airport,Hallsborough Tavern
how much is an uberxl from Mai Wah Museum to that place,uberxl,Mai Wah Museum,that place
how much is an uberxl from Union State Bank to Charlottesville Fashion Square,uberxl,Union State Bank,Charlottesville Fashion Square
how much is an uberxl from home to Yellow Sulphur Springs,uberxl,home,Yellow Sulphur Springs
how much is an uberxl from last to the tenth,uberxl,last,the tenth
how much is an uberxl from sixth to seventh one,uberxl,sixth,seventh one
how much is an uberxl from that one to eighth one,uberxl,that one,eighth one
how much is an uberxl from the sixth to Apple Bank for Savings,uberxl,the sixth,Apple Bank for Savings
how much is an uberxl to Brodie Creek,uberxl,,Brodie Creek
how much is an uberxl to Des Moines International Airport,uberxl,,Des Moines International Airport
how much is an uberxl to East Lake,uberxl,,East Lake
how much is an uberxl to Heartland Bank,uberxl,,Heartland Bank
how much is an uberxl to Juewei Duck Neck,uberxl,,Juewei Duck Neck
how much is an uberxl to Le Gavroche,uberxl,,Le Gavroche
how much is an uberxl to Metro Inns,uberxl,,Metro Inns
how much is an uberxl to Naval Auxiliary Landing Field Santa Rosa,uberxl,,Naval Auxiliary Landing Field Santa Rosa
how much is an uberxl to Oakland Southwest Airport,uberxl,,Oakland Southwest Airport
how much is an uberxl to Petersburg James A Johnson Airport west covina,uberxl,,Petersburg James A Johnson Airport
how much is an uberxl to The Oriel,uberxl,,The Oriel
how much is an uberxl to Yardbird,uberxl,,Yardbird
how much is an uberxl to third,uberxl,,third
how much is an uberxl to this,uberxl,,this
how much is an uberxl to work,uberxl,,work
how much is an wav from Bootleggers Cove to sixth,wav,Bootleggers Cove,sixth
how much is an wav from Cobbs Creek to Valley National Bank of Arizona,wav,Cobbs Creek,Valley National Bank of Arizona
how much is an wav from Envoy enterprises to A-Space,wav,Envoy enterprises,A-Space
how much is an wav from Ford s Filling Station to the tenth,wav,Ford s Filling Station,the tenth
how much is an wav from Hobbs Army Airfield to Easton Town Center,wav,Hobbs Army Airfield,Easton Town Center
how much is an wav from McDonough Museum of Art to Arabia Felix Hotel,wav,McDonough Museum of Art,Arabia Felix Hotel
how much is an wav from National Gallery of Art Sculpture Garden to home,wav,National Gallery of Art Sculpture Garden,home
how much is an wav from Opal s Steak House to the last,wav,Opal s Steak House,the last
how much is an wav from ninth one to Independence Heights,wav,ninth one,Independence Heights
how much is an wav from seventh one to home,wav,seventh one,home
how much is an wav to Anno Domini,wav,,Anno Domini
how much is an wav to Biltmore Fashion Park,wav,,Biltmore Fashion Park
how much is an wav to Bodysgallen Hall,wav,,Bodysgallen Hall
how much is an wav to Century Bank,wav,,Century Bank
how much is an wav to First Republic Bank Corporation,wav,,First Republic Bank Corporation
how much is an wav to Main Street Complex,wav,,Main Street Complex
how much is an wav to Medfield,wav,,Medfield
how much is an wav to Merrill Field,wav,,Merrill Field
how much is an wav to Tahoe Joe s from Springfield Mall,wav,Springfield Mall,Tahoe Joe s
how much is an wav to ninth one,wav,,ninth one
how much is an wav to seventh one,wav,,seventh one
how much is an wav to that one,wav,,that one
how much is an wav to work,wav,,work
how much is it for an exec to drive me to the Bamiyan,exec,,Bamiyan
how much is it for an execlarge to drive me to the this,execlarge,,this
how much is it for an uber x to drive me to the Sean Kelly Gallery,uber x,,Sean Kelly Gallery
how much is it for an uberfamily to drive me to the eighth,uberfamily,,eighth
how much is it for an uberxl to drive me to the Cranks restaurant,uberxl,,Cranks restaurant
how much is it from the Artspace to fourth when taking an uber t,uber t,Artspace,fourth
how much is it from the Arverne to Mall of New Hampshire when taking an uberlux,uberlux,Arverne,Mall of New Hampshire
how much is it from the First Financial Bank to Downtown Austin when taking an LIVEUP VIP,LIVEUP VIP,First Financial Bank,Downtown Austin
how much is it from the Pappadeaux Seafood Kitchen to Quail Springs Mall when taking an taxi,taxi,Pappadeaux Seafood Kitchen,Quail Springs Mall
how much is it from the Piada Italian Street Food to Long Beach Airport when taking an uber español,uber español,Piada Italian Street Food,Long Beach Airport
how much is it from the Sconyers Bar-B-Que to there when taking an uber fastlane,uber fastlane,Sconyers Bar-B-Que,there
how much is it from the South Square Mall to Reisterstown Station when taking an uberplus,uberplus,South Square Mall,Reisterstown Station
how much is it from the The Skeffington Arms Hotel to that place when taking an uber black,uber black,The Skeffington Arms Hotel,that place
how much is it from the fifth one to Summit Mall when taking an uberxl,uberxl,fifth one,Summit Mall
how much is it from the last to home when taking an ubersuv,ubersuv,last,home
how much is it from the ninth to 62 Castle St when taking an ubert,ubert,ninth,62 Castle St
how much is it from the the third to fifth when taking an exec large,exec large,the third,fifth
how much is it from the work to Doral Hotel when taking an uberselect,uberselect,work,Doral Hotel
how much is it from the work to Naval Air Station Joint Reserve Base New Orleans when taking an uber black,uber black,work,Naval Air Station Joint Reserve Base New Orleans
how much is it to pool to Museum of Contemporary Art Cleveland,pool,,Museum of Contemporary Art Cleveland
how much is it to take an uber suv to Mama Lo s,uber suv,,Mama Lo s
how much is it to take an uber t to that one,uber t,,that one
how much is it to take an uberespañol to Rodeway Inn,uberespañol,,Rodeway Inn
how much is it to uber family to Rainier Valley,uber family,,Rainier Valley
how much is it to uber family to fourth,uber family,,fourth
how much is it to uber fastlane to Village Hotels & Residences,uber fastlane,,Village Hotels & Residences
how much is it to uber xl to tenth one,uber xl,,tenth one
how much is it to uberairport to VanFleet Hotel,uberairport,,VanFleet Hotel
how much is it to ubergo to NewPark Mall,ubergo,,NewPark Mall
how much is the LIVEUP VIP ride from River Falls Mall to Mill Creek Town Center,LIVEUP VIP,River Falls Mall,Mill Creek Town Center
how much is the LIVEUP VIP ride from The Contemporary Museum Honolulu to Bank of Hartland,LIVEUP VIP,The Contemporary Museum Honolulu,Bank of Hartland
how much is the LIVEUP VIP ride from the eighth to the seventh,LIVEUP VIP,the eighth,the seventh
how much is the LIVEUPVIP ride from Armstrong s Barn to City of Dreams Manila,LIVEUPVIP,Armstrong s Barn,City of Dreams Manila
how much is the LIVEUPVIP ride from home to fifth,LIVEUPVIP,home,fifth
how much is the execlarge fare from that location to Elkhorn Park,execlarge,that location,Elkhorn Park
how much is the fare to Foothills Mall,,,Foothills Mall
how much is the fare to Leon s Frozen Custard,,,Leon s Frozen Custard
how much is the fare to Librije s Zusje Amsterdam,,,Librije s Zusje Amsterdam
how much is the fare to Luhring Augustine Gallery,,,Luhring Augustine Gallery
how much is the fare to fifth,,,fifth
how much is the fare to first one,,,first one
how much is the fare to that,,,that
how much is the fare to that location,,,that location
how much is the fare to the ninth,,,the ninth
how much is the fare to the ninth,,,the ninth
how much is the uber airport ride from Hemphill Fine Arts to Union Bank & Trust Company,uber airport,Hemphill Fine Arts,Union Bank & Trust Company
how much is the uber black ride from Birger Sandzén Memorial Gallery to L2O,uber black,Birger Sandzén Memorial Gallery,L2O
how much is the uber español ride from Double Eagle II Airport to first,uber español,Double Eagle II Airport,first
how much is the uber español ride from tenth one to Center City Mall,uber español,tenth one,Center City Mall
how much is the uber family fare from home to home,uber family,home,home
how much is the uber fastlane fare from Creole Kosher Kitchen to Arts Club of Chicago,uber fastlane,Creole Kosher Kitchen,Arts Club of Chicago
how much is the uber go ride from Kuehnle s Hotel to First American Bank,uber go,Kuehnle s Hotel,First American Bank
how much is the uber plus ride from Reliance Bank to ninth,uber plus,Reliance Bank,ninth
how much is the uber select ride from third one to Culinaire Verwennerij Bij Jef,uber select,third one,Culinaire Verwennerij Bij Jef
how much is the uber suv fare from fourth one to Bose Pacia Gallery,uber suv,fourth one,Bose Pacia Gallery
how much is the uber suv ride from Ocean Forest Hotel to The Gallery at Military Circle,uber suv,Ocean Forest Hotel,The Gallery at Military Circle
how much is the uber xl ride from Plane Space to last one,uber xl,Plane Space,last one
how much is the uber xl ride from the eighth to Jason McCoy Inc,uber xl,the eighth,Jason McCoy Inc
how much is the uberairport fare from fifth one to fifth,uberairport,fifth one,fifth
how much is the uberblack fare to the the eighth,uberblack,,the eighth
how much is the uberblack ride from Luhring Augustine Gallery to Inland Center,uberblack,Luhring Augustine Gallery,Inland Center
how much is the uberespañol fare from home to Hilton Garden Inn Sunderland,uberespañol,home,Hilton Garden Inn Sunderland
how much is the uberespañol fare to the Comerç 24,uberespañol,,Comerç 24
how much is the uberexec ride from Palm City to Perry South,uberexec,Palm City,Perry South
how much is the uberfamily ride from third to Mall at Rockingham Park,uberfamily,third,Mall at Rockingham Park
how much is the ubersuv ride from First Bank to Club Cal Neva,ubersuv,First Bank,Club Cal Neva
how much money do i have to pay to get to the De Karmeliet using uber family,uber family,,De Karmeliet
how much money do i have to pay to get to the Hui Lau Shan using uberpool,uberpool,,Hui Lau Shan
how much money do i have to pay to get to the Valley National Bank of Arizona using uber airport,uber airport,,Valley National Bank of Arizona
how much money do i have to pay to get to the sixth using wav,wav,,sixth
how much money do i have to pay to get to the that one using uber español,uber español,,that one
how much money do i have to pay to get to the the eighth using uber español,uber español,,the eighth
how much money is it to get to the Elephant and Castle Pub and Restaurant using uberxl,uberxl,,Elephant and Castle Pub and Restaurant
how much money is it to get to the fifth one using uber family,uber family,,fifth one
how much money would it take for me to get to the Great Lakes Mall using wav,wav,,Great Lakes Mall
how much money would it take for me to get to the New North Roland Park-Poplar Hill using execlarge,execlarge,,New North Roland Park-Poplar Hill
how much money would it take for me to get to the Saladworks using lux,lux,,Saladworks
how much money would it take for me to get to the the eighth using uber pool,uber pool,,the eighth
how much money would it take for me to get to the the sixth using ubergo,ubergo,,the sixth
how much money would it take to get a ride through lux from Gavin Brown s Enterprise to the work,lux,Gavin Brown s Enterprise,work
how much money would it take to get a ride through taxi from Zach Feuer Gallery to the ninth one,taxi,Zach Feuer Gallery,ninth one
how much money would it take to get a ride through uber fastlane from eighth one to the Cafe Express,uber fastlane,eighth one,Cafe Express
how much money would it take to get a ride through uber fastlane from second to the Grøften,uber fastlane,second,Grøften
how much money would it take to get a ride through uberfastlane from home to the last one,uberfastlane,home,last one
how much money would it take to get a ride through ubergo from Villa Muniria to the Newport Arms Hotel,ubergo,Villa Muniria,Newport Arms Hotel
how much pool is charging to travel to the Plymouth Meeting Mall from Iron Cactus,pool,Iron Cactus,Plymouth Meeting Mall
how much should i pay for lux to reach First Financial Bank,lux,,First Financial Bank
how much should i pay for pool to reach Pioneer Chicken,pool,,Pioneer Chicken
how much should i pay for taxi to reach Pelican Place at Craft Farms,taxi,,Pelican Place at Craft Farms
how much should i pay for uber fastlane to reach Kotipizza,uber fastlane,,Kotipizza
how much should i pay for uber suv to reach eighth one,uber suv,,eighth one
how much should i pay for uber x to reach tenth,uber x,,tenth
how much should i pay for uber xl to reach Turfland Mall,uber xl,,Turfland Mall
how much should i pay for uberblack to reach Howard Johnson s,uberblack,,Howard Johnson s
how much should i pay for uberlux to reach Cape Panwa Hotel,uberlux,,Cape Panwa Hotel
how much should i pay for uberpool to reach fourth,uberpool,,fourth
how much to get from Asia Bank to Quay with uberplus,uberplus,Asia Bank,Quay
how much to get from Canal Hotel to Seminary Park with uberselect,uberselect,Canal Hotel,Seminary Park
how much to get from First American Bank to Lyon s with uber exec,uber exec,First American Bank,Lyon s
how much to get from Union State Bank to tenth with uberlux,uberlux,Union State Bank,tenth
how much to get from home to the last with uber pool,uber pool,home,the last
how much to get from ninth to work with pool,pool,ninth,work
how much to get from that location to sixth with uber x,uber x,that location,sixth
how much to get from that one to Gary with uberselect,uberselect,that one,Gary
how much to get to Hotel Paso del Norte in an uberairport,uberairport,,Hotel Paso del Norte
how much to get to Shah Ghouse Café in an uberpool,uberpool,,Shah Ghouse Café
how much to get to South Bay Galleria in an ubert,ubert,,South Bay Galleria
how much to get to The Cecil in an uber fastlane,uber fastlane,,The Cecil
how much to get to ninth in an uber español,uber español,,ninth
how much to get to the last in an uber exec,uber exec,,the last
how much to get to the tenth in an ubergo,ubergo,,the tenth
how much to get to third in an uber select,uber select,,third
how much to take execlarge from eighth to Den Røde Cottage,execlarge,eighth,Den Røde Cottage
how much to take pool from the eighth to that,pool,the eighth,that
how much to take uberxl from Bel Mar Shores to last one,uberxl,Bel Mar Shores,last one
how much ubersuv is charging to travel to the Cinnabon from home,ubersuv,home,Cinnabon
how much will LIVEUPVIP cost from Saladworks to Little Greek Restaurants,LIVEUPVIP,Saladworks,Little Greek Restaurants
how much will an pool charge to take me to the Langham Hotel,pool,,Langham Hotel
how much will an uber airport charge to take me to the first one,uber airport,,first one
how much will cost a execlarge to take me to Imperial County Airport,execlarge,,Imperial County Airport
how much will cost a uber xl to take me to seventh one,uber xl,,seventh one
how much will cost a wav to take me to Virginia Park,wav,,Virginia Park
how much will exec large charge me for reaching General Mitchell International Airport,exec large,,General Mitchell International Airport
how much will exec large cost me to be at the Century Bank,exec large,,Century Bank
how much will i have to pay to travel to Devil s Pocket with uber plus,uber plus,,Devil s Pocket
how much will i have to pay to travel to ninth with execlarge,execlarge,,ninth
how much will i have to pay to travel to work with uberexec,uberexec,,work
how much will i pay to take execlarge to the ninth one,execlarge,,ninth one
how much will i pay to take uber black to the Keg Mansion,uber black,,Keg Mansion
how much will i pay to take uber español to the Neosho Hugh Robinson Airport,uber español,,Neosho Hugh Robinson Airport
how much will i pay to take uber pool to the seventh one,uber pool,,seventh one
how much will i pay to take uber t to the Elephant Bar,uber t,,Elephant Bar
how much will i pay to take uberlux to the Downtown Salt Lake City,uberlux,,Downtown Salt Lake City
how much will i pay to take uberpool to the Institute of Contemporary Art Boston,uberpool,,Institute of Contemporary Art Boston
how much will i pay to take uberselect to the tenth one,uberselect,,tenth one
how much will i pay to use uber airport from Woodhaven to Puerto Rico Museum of Contemporary Art,uber airport,Woodhaven,Puerto Rico Museum of Contemporary Art
how much will i pay to use uber español from fifth one to home,uber español,fifth one,home
how much will i pay to use uber fastlane from Westfield Culver City to home,uber fastlane,Westfield Culver City,home
how much will i pay to use uber go from ninth to Gibson s Hotel,uber go,ninth,Gibson s Hotel
how much will i pay to use ubergo from Hotel Inglaterra to Mutual Bank,ubergo,Hotel Inglaterra,Mutual Bank
how much will i pay to use uberplus from The Pizza Studio to eighth one,uberplus,The Pizza Studio,eighth one
how much will i pay to use ubert from Century Bank to sixth one,ubert,Century Bank,sixth one
how much will it charge me to reach 2643 Park Avenue by pool,pool,,2643 Park Avenue
how much will it charge me to reach Big Beaver Airport by uber pool,uber pool,,Big Beaver Airport
how much will it charge me to reach CasaBlanca Resort by uber airport,uber airport,,CasaBlanca Resort
how much will it charge me to reach Center for Architecture by lux,lux,,Center for Architecture
how much will it charge me to reach Cheval Blanc by uber x,uber x,,Cheval Blanc
how much will it charge me to reach Columbus Airport by uberfamily,uberfamily,,Columbus Airport
how much will it charge me to reach Fiduciary Trust Company International by ubert,ubert,,Fiduciary Trust Company International
how much will it charge me to reach Four Seasons Hotel Toronto by ubert,ubert,,Four Seasons Hotel Toronto
how much will it charge me to reach Kennydale by pool,pool,,Kennydale
how much will it charge me to reach Kualao Restaurant by uber español,uber español,,Kualao Restaurant
how much will it charge me to reach Liverpool by uberplus,uberplus,,Liverpool
how much will it charge me to reach Mall del Norte by execlarge,execlarge,,Mall del Norte
how much will it charge me to reach Meridian Bank by ubersuv,ubersuv,,Meridian Bank
how much will it charge me to reach North Knoxville by uberespañol,uberespañol,,North Knoxville
how much will it charge me to reach Paulson Bott Press by LIVEUPVIP,LIVEUPVIP,,Paulson Bott Press
how much will it charge me to reach Roberts Field by uber fast lane,uber fast lane,,Roberts Field
how much will it charge me to reach The Kitchen of Joy by uber pool,uber pool,,The Kitchen of Joy
how much will it charge me to reach Trolley Square by LIVEUPVIP,LIVEUPVIP,,Trolley Square
how much will it charge me to reach Vltava by uber plus,uber plus,,Vltava
how much will it charge me to reach Wawona Hotel by execlarge,execlarge,,Wawona Hotel
how much will it charge me to reach Westfield Fox Valley by uber x,uber x,,Westfield Fox Valley
how much will it charge me to reach Westfield West Covina by uber t,uber t,,Westfield West Covina
how much will it charge me to reach home by uber español,uber español,,home
how much will it charge me to reach tenth one by uber airport,uber airport,,tenth one
how much will it charge me to reach that one by uber fastlane,uber fastlane,,that one
how much will it charge me to reach the fourth by uberespañol,uberespañol,,the fourth
how much will it charge me to reach the second by execlarge,execlarge,,the second
how much will it charge me to reach the third by exec large,exec large,,the third
how much will it charge me to reach third one by uber family,uber family,,third one
how much will it charge me to reach work by uberlux,uberlux,,work
how much will it cost for LIVEUPVIP to get me Official All Star Café,LIVEUPVIP,,Official All Star Café
how much will it cost for a exec ride to Inlet Square Mall,exec,,Inlet Square Mall
how much will it cost for a execlarge ride to Centre Municipal Airport,execlarge,,Centre Municipal Airport
how much will it cost for a lux ride to Bermuda Dunes Airport,lux,,Bermuda Dunes Airport
how much will it cost for a lux ride to Naval Outlying Field Santa Rosa,lux,,Naval Outlying Field Santa Rosa
